,country,description,designation,points,price,province,region_1,region_2,taster_name,taster_twitter_handle,title,variety,winery,type,sparkling
89489,US,"It smells like a nicely charred steak and tastes like black pepper, dark chocolate, and boysenberry. It has plenty of oak in the aroma and flavors, but enough fruit, tannins and rich mouthfeel to balance it out.",Petite Sirah,86,13.0,California,Clarksburg,Central Valley,Jim Gordon,@gordone_cellars,Vinum 2012 Petite Sirah (Clarksburg),Petite Sirah,Vinum,red,no
90311,US,"Fresh-pressed blackberry aromas leap out of the glass of this wine, along with asphalt and a touch of purple flowers. The palate is a study of density and thickness, with black plums, coffee and espresso showing most out of the deep, black flavors.",Petite Sirah,88,40.0,California,Paso Robles,Central Coast,Matt Kettmann,@mattkettmann,Siot 2013 Petite Sirah (Paso Robles),Petite Sirah,Siot,red,no
90498,US,"A dusty, plummy, dark berry pie Petite Sirah from old vines grown in the Santa Clara Valley by the Guglielmo family, who have been based here since 1925. With lots of bittersweet chocolate, white pepper and well-integrated oak, this Petite is subtle, its alcohol relatively low and its tannins quite refined, a Petite for French palates.",Private Reserve Estate Grown,90,25.0,California,Santa Clara Valley,Central Coast,Virginie Boone,@vboone,Guglielmo 2007 Private Reserve Estate Grown Petite Sirah (Santa Clara Valley),Petite Sirah,Guglielmo,red,no
90669,US,"This wine has all the deep, dark color and firm tannins that are expected, but it pleasantly sweetens the blackberry flavors ever so slightly and smooths the edges in terms of texture, for a big wine that's also quite friendly.",Petite Sirah,90,25.0,California,Lodi,Central Valley,Jim Gordon,@gordone_cellars,Klinker Brick 2014 Petite Sirah (Lodi),Petite Sirah,Klinker Brick,red,no
90850,US,"No matter how hard you try to tame Petite Sirah and make it civilized, it retains its feral, rustic nature, which is what makes it such an interesting wine in the right hands. Quivira has “claretized” this wine, yoking the intense cassis, currant, cocoa, gamy leather and pepper flavors to finely ground tannins and a modest alcohol level. But it's still a quintessentially wild Petite Sirah. Drink now through 2017.",Wine Creek Ranch,91,26.0,California,Dry Creek Valley,Sonoma,,,Quivira 2005 Wine Creek Ranch Petite Sirah (Dry Creek Valley),Petite Sirah,Quivira,red,no
90921,US,"Dry and clean, this has modest cherry-berry flavors. It's rustic and raw in texture, with a harsh finish.",Petite Sirah,81,18.0,California,California,California Other,,,Main & Geary 2011 Petite Sirah (California),Petite Sirah,Main & Geary,red,no
90960,US,"This bottling has been variable over the years, but with the '06, Vina Robles seizes full command of Petite Sirah. Shows a classically thick, full-bodied texture, with dark currant, plum and licorice flavors edged with baker's chocolate. Fully dry, it's marvelous now with tri-tip, and should age for many years.",Jardine,93,26.0,California,Paso Robles,Central Coast,,,Vina Robles 2006 Jardine Petite Sirah (Paso Robles),Petite Sirah,Vina Robles,red,no
91041,US,"Decadent in coffee, toffee and caramel tones, the leathery mouthfeel of this wine is met head-to-head by a juiciness of ripe, dense blackberry fruit. An approachable Petite Sirah that will also please lovers of the variety's chewiness and concentration.",Seven Sinners,88,19.0,California,Lodi,Central Valley,Virginie Boone,@vboone,Nine North Wine Company 2010 Seven Sinners Petite Sirah (Lodi),Petite Sirah,Nine North Wine Company,red,no
91065,US,"With jammy flavors of blackberries, cherries, raspberries and smoky oak, this easy-drinking Petite Sirah shows the peppery notes and thick tannins of the variety. Drink now.",Petite Sirah,84,15.0,California,Lodi,Central Valley,,,Christine Andrew 2006 Petite Sirah (Lodi),Petite Sirah,Christine Andrew,red,no
91131,US,"There's a lot to like in this thickly ripe wine, so dark purple in color as to be almost paint. Lipsmacking black and blue berries ride a wave of smoky tannin, chocolate and power, the acidity moderate.",Estate,88,34.0,California,Russian River Valley,Sonoma,Virginie Boone,@vboone,Matrix 2013 Estate Petite Sirah (Russian River Valley),Petite Sirah,Matrix,red,no
91360,US,"A pretty bouquet of violets greets the nose, followed by a bolt of black pepper. Boysenberry, black cherry and leather combine to mark the palate, which also reveals cola and anise. Soft and restrained for the variety, this is a food-friendly wine, with a gnarled bite of tannin on the finish.",Petite Sirah,91,40.0,California,Russian River Valley,Sonoma,Virginie Boone,@vboone,Armida 2012 Petite Sirah (Russian River Valley),Petite Sirah,Armida,red,no
91521,US,"Big and bold, this is classic coastal Petite Sirah. It's dark in color, robust in texture and massive in blackberry, cherry, currant, mocha and anise flavors that taste like they've been baked into a pie. Dry, crisp and balanced, it will be delicious with a charbroiled steak.",Petite Sirah,88,25.0,California,Mendocino,,,,Stonehedge 2004 Petite Sirah (Mendocino),Petite Sirah,Stonehedge,red,no
91678,US,"This is drinkable but not overly interesting, with a good berry flavor. It's marked with an off-putting aroma of cigarette ash, and it feels raw.",Petite Sirah,82,9.0,California,California,California Other,,,Lucky Star 2011 Petite Sirah (California),Petite Sirah,Lucky Star,red,no
92068,US,"Dark and earthy, a thick, heavy wine with plummy, chocolatey flavors and big tannins, although the acidity is soft. The main drawback is residual sugar. Once that sugar hits, the palate is discombobulated.",Petite Sirah,81,10.0,California,California,California Other,,,Stonehedge 2001 Petite Sirah (California),Petite Sirah,Stonehedge,red,no
92273,US,"Despite the fancy Lot designation, this is a simple Petite Sirah. It's soft and lush in licorice and blackberry jam flavors, wrapped into firm tannins. Fine for drinking now with burgers, ribs, Mexican fare.",Lot 96,84,15.0,California,California,California Other,,,Foppiano 2010 Lot 96 Petite Sirah (California),Petite Sirah,Foppiano,red,no
92304,US,"There's a feral quality to the nose of this wine, with wet hay and grapeseed aromas alongside black-cherry fruit. A punchy plum flavor shows on the palate, as does dried oregano and more barnyard qualities.",Petite Sirah,84,48.0,California,Temecula,South Coast,Matt Kettmann,@mattkettmann,Danza del Sol 2012 Petite Sirah (Temecula),Petite Sirah,Danza del Sol,red,no
92452,US,"Tasted in October 2013, this 100% varietal wine was jammy with flavors of raspberries, cherries and mocha, with a slightly grapey note like a Beaujolais fresh from the tank. Lay it down until 2017 or so to let it develop.",Show Pony Red Cedar Vineyard,88,40.0,California,Paso Robles,Central Coast,,,Clayhouse 2011 Show Pony Red Cedar Vineyard Petite Sirah (Paso Robles),Petite Sirah,Clayhouse,red,no
92844,US,"Rustic and sweet on the finish, with jellied blackberry, cherry, licorice, cola and Asian spice flavors. Gains a point or two for its smooth, rich tannins. Drink now.",Petite Sirah,84,16.0,California,Lake County,,,,Writer's Block 2005 Petite Sirah (Lake County),Petite Sirah,Writer's Block,red,no
92903,US,"Built for the long haul, this full-bodied and very firmly textured wine is impressive to taste now but will drink best after 2023. Beguiling aromas touch on sweet spices, grilled meat, black pepper, blackberries and wood smoke. Concentrated, layered fruit flavors seem to coat the palate and linger on the finish.",Petite Sirah,92,24.0,California,Amador County,Sierra Foothills,Jim Gordon,@gordone_cellars,Fiddletown Cellars 2013 Petite Sirah (Amador County),Petite Sirah,Fiddletown Cellars,red,no
92935,US,"Earthy and leathery, this medium-bodied, ripe varietal wine dabbles in vanilla, blueberry and coffee cake aromas and flavors, finishing with a welcome softness.",Bastoni Vineyards,88,32.0,California,Sonoma County,Sonoma,Virginie Boone,@vboone,Joseph Swan Vineyards 2013 Bastoni Vineyards Petite Sirah (Sonoma County),Petite Sirah,Joseph Swan Vineyards,red,no
93871,US,"A great price for a great wine, this Bea's Knees offers soft raspberry and leathery plum. Likewise it's soft, though not shy, in tannins. With savory cedar and espresso going on aside a long finish, it's ready to enjoy right now—thanks to the winery's holding back on release—and could further mellow into an even more savory self in time.",Bea's Knees,88,15.0,California,El Dorado County,Sierra Foothills,Virginie Boone,@vboone,People's Wine Revolution 2008 Bea's Knees Petite Sirah (El Dorado County),Petite Sirah,People's Wine Revolution,red,no
94216,US,"This is an extreme example of an extreme varietal. The color is black except for a thin purple rim. The aromas are like dark chocolate and subdued blueberry. Flavors convey a deep profusion of blackberry and boysenberry with hints of sweet oak. Very full-bodied, full-flavored and mouthfilling, it delivers power with polish.",Petite Sirah,92,26.0,California,Amador County,Sierra Foothills,Jim Gordon,@gordone_cellars,Deaver 2010 Petite Sirah (Amador County),Petite Sirah,Deaver,red,no
94498,US,"Petite Sirah has a long history in Livermore Valley and the Del Arroyo Vineyard from which this wine hails is planted to the heritage Concannon clone. Restrained and spicy, it offers velvety blackberry and raspberry fruit and a lingering tropical aroma, encased with a morsel of dark chocolate. With well-managed tannins, the wine begs to be set on the table alongside peppery steaks.",Del Arroyo Vineyard,90,35.0,California,Livermore Valley,Central Coast,Virginie Boone,@vboone,Occasio 2011 Del Arroyo Vineyard Petite Sirah (Livermore Valley),Petite Sirah,Occasio,red,no
94607,US,"This is heavy, soft and overripe, with raisin and Port-like flavors.",Petite Sirah,81,22.0,California,Paso Robles,Central Coast,,,Bianchi 2009 Petite Sirah (Paso Robles),Petite Sirah,Bianchi,red,no
94645,US,"Blueberry tops a hefty and robust foundation of vanilla syrup in this ripe wine, dusty in tannin and weighty on the long, oaky finish.",Petite Sirah,87,40.0,California,Knights Valley,Sonoma,Virginie Boone,@vboone,Summers 2013 Petite Sirah (Knights Valley),Petite Sirah,Summers,red,no
94650,Chile,"Cheesy aromas of leather, licorice and black fruits filter into a jagged, fiercely tannic palate. Flavors of tea, black plum, stewed berry and herbs finish with a big residual tannic bite.",Gran Reserva El Acacio Vineyard,87,15.0,Maipo Valley,,,Michael Schachner,@wineschach,Carmen 2012 Gran Reserva El Acacio Vineyard Petite Sirah (Maipo Valley),Petite Sirah,Carmen,red,no
94864,US,"For a wine from a sometimes rough-edged variety, this is especially smooth, sculpted and drinkable. That's not to deny that it's intense in color, full bodied and firm textured. But the tannins feel polished so the texture is smooth, letting ripe blackberry and boysenberry flavors come out.",Estate Grown,91,25.0,California,Lodi,Central Valley,Jim Gordon,@gordone_cellars,Mettler Family Vineyards 2013 Estate Grown Petite Sirah (Lodi),Petite Sirah,Mettler Family Vineyards,red,no
94994,US,"Vanilla, clove, allspice, dried ginger and soy are laced into black-plum sauce on the nose of this densely layered wine. The palate is even-handed, with tight boysenberry spiced up by caramel and bitter espresso notes.",Petite Sirah,88,35.0,California,Paso Robles,Central Coast,Matt Kettmann,@mattkettmann,Opaque 2012 Petite Sirah (Paso Robles),Petite Sirah,Opaque,red,no
95129,US,"Intense and concentrated blackberry flavors rise above thick tannins in this full-bodied wine. Aromas suggest boysenberry, smoke and clove, while the flavors taste more like blackberry jam. Although the texture is dense and tannic, it stays velvety rather than drying. This will be great now with ribs or roast venison, but will easily age through 2020.",Petite Sirah,90,12.0,California,Lodi,Central Valley,Jim Gordon,@gordone_cellars,Ironstone 2014 Petite Sirah (Lodi),Petite Sirah,Ironstone,red,no
95180,US,"A lofty violet perfume meets bold black pepper in this lively, fresh and memorable wine, which blends smaller amounts of Syrah, Grenache and other Rhône varieties. Blackberry, blueberry and leather form a reel of highlights that is soft enough to enjoy now.",Petite Sirah,91,45.0,California,Napa Valley,Napa,Virginie Boone,@vboone,Stags' Leap Winery 2013 Petite Sirah (Napa Valley),Petite Sirah,Stags' Leap Winery,red,no
95278,US,"An intensely fruity Petite full of plum and aromas of strawberries dipped in chocolate. Blended with 10% Mourvèdre, the wine is soft and round, with tame tannins. It finishes long, with a taste of char and Sweet Tarts, in a good way.",Petite Sirah,88,24.0,California,Calaveras County,Sierra Foothills,Virginie Boone,@vboone,Twisted Oak 2008 Petite Sirah (Calaveras County),Petite Sirah,Twisted Oak,red,no
95393,US,"Soft and approachable, this Petite Sirah has easy tannins and rich blackberry, funky meat, cola and cedar flavors. Ready now.",Petite Sirah,86,30.0,California,Rockpile,Sonoma,,,Miro 2008 Petite Sirah (Rockpile),Petite Sirah,Miro,red,no
95871,US,"A little jagged around the edges, with some harsh tannins surrounding riper notes of blackberries and tobacco. Could develop bottle nuances in a few years.",Bud,84,32.0,California,Paso Robles,Central Coast,,,Waltzing Bear 2005 Bud Petite Sirah (Paso Robles),Petite Sirah,Waltzing Bear,red,no
96093,US,"A fine Mendocino Petite Sirah that's mouth filling with blueberry and licorice and plenty structured to age longer than it already has. With pleasant layers of licorice and black tea, especially on the finish, it's also ready to drink now.",Petite Sirah,87,18.0,California,Mendocino,,Virginie Boone,@vboone,Graziano 2007 Petite Sirah (Mendocino),Petite Sirah,Graziano,red,no
96238,US,"This wine may age to interesting things, but currently it's hard in tannins and acidity, and so dry it makes you long for some sugar. But you'll find a deep core of black currant, licorice and spicy plum flavors. Should pair well with rustic grilled meats.",Petite Sirah,85,15.0,California,Paso Robles,Central Coast,,,Greg Norman California Estates 2005 Petite Sirah (Paso Robles),Petite Sirah,Greg Norman California Estates,red,no
96344,US,"This is a simple, structured and grippy version of the variety, homegrown and delightfully floral. Relatively restrained, it shows hints of chocolate, blueberry, fig and dark cherry, unfettered by oak.",Puccioni Ranch,90,30.0,California,Dry Creek Valley,Sonoma,Virginie Boone,@vboone,Puccioni 2013 Puccioni Ranch Petite Sirah (Dry Creek Valley),Petite Sirah,Puccioni,red,no
96361,US,"Dusty pencil shavings mark the nose of this fulsome, generously ripe wine, thick and soft in integrated layers of black licorice, sage and dark chocolate.",Newsome,90,38.0,California,Dry Creek Valley,Sonoma,Virginie Boone,@vboone,Pezzi King 2013 Newsome Petite Sirah (Dry Creek Valley),Petite Sirah,Pezzi King,red,no
96568,US,"Oak dominates this wine, withstrong notes of buttered toast, vanilla and sweet char. There's nothing wrong with those pleasant aromas and flavors, but the underlying wine, with its cherry and currant fruit, is overpowered by the wood.",Petite Sirah,85,20.0,California,Russian River Valley,Sonoma,,,Foppiano 2009 Petite Sirah (Russian River Valley),Petite Sirah,Foppiano,red,no
96650,US,"This wine opens in a reduced way, with plenty of barrel influence apparent. It develops in the glass into a mix of chalky tannin and red and blue fruit, with accents of black licorice and white chocolate. Aged in new French, American and European oak, it has a tannic finish that should benefit with time. Drink now through 2021.",La Storia Estate Bottled,90,34.0,California,Alexander Valley,Sonoma,Virginie Boone,@vboone,Trentadue 2013 La Storia Estate Bottled Petite Sirah (Alexander Valley),Petite Sirah,Trentadue,red,no
96700,US,"Shows the typical character of a young, warm-climate Petite Sirah in the thick tannic structure and fantastically ripe fruit. Swamps the palate with blackberry jam, mocha, cherry pie filling, chocolate-covered mint and anise flavors, and finishes distinctly sweet. Now through 2018.",Petite Sirah,85,36.0,California,Paso Robles,Central Coast,,,Chronic Cellars 2006 Petite Sirah (Paso Robles),Petite Sirah,Chronic Cellars,red,no
97069,US,"Shows the thick tannins and blackberry, currant, dark chocolate and smoked meat flavors that make Petite Sirah so popular. But the main drawback is excessive softness, which limits the ability of this famously ageable variety to improve in the cellar. So drink now.",Tower Road,86,35.0,California,Paso Robles,Central Coast,,,J. Lohr 2008 Tower Road Petite Sirah (Paso Robles),Petite Sirah,J. Lohr,red,no
97113,US,"The quality is fair for the price on this soft, one-dimensional wine. It has straightforward flavors of sour cherry candy and cranberry sauce.",Petite Sirah,83,11.0,California,California,California Other,,,Guenoc 2012 Petite Sirah (California),Petite Sirah,Guenoc,red,no
97341,US,"Here's a lusty, lip-smackingly ripe Petite Sirah that's perfect for grilled meats and hard cheeses. Full-throttle flavors of blackberries, cherries and chocolate finish with Asian spices in this dry, softly tannic wine.",Heretic,88,38.0,California,Paso Robles,Central Coast,,,Four Vines 2005 Heretic Petite Sirah (Paso Robles),Petite Sirah,Four Vines,red,no
97596,US,"This is great Petite Sirah, and classically Dry Creek Valley in style. It has the weight and texture of a fine Cabernet, with gorgeously smooth tannins, but it's the flavors that really make you reach for another glass. Offers blackberries, black currants, bacon, charred meat bone, pepper and anise flavors that go on and on into a long finish. Will age for a long time, but you can drink it at any point in its journey.",Petite Sirah,92,45.0,California,Dry Creek Valley,Sonoma,,,St. Francis 2010 Petite Sirah (Dry Creek Valley),Petite Sirah,St. Francis,red,no
97647,US,"Shows real elegance and finesse in a variety that can sometimes get a little out of control. With smoothly polished tannins giving it a full-bodied mouthfeel, this single-vineyard wine has rich blackberry, black currant and pepper flavors. Fine now, and should develop for many years.",Nord Vineyard,92,45.0,California,Napa Valley,Napa,,,Envy 2007 Nord Vineyard Petite Sirah (Napa Valley),Petite Sirah,Envy,red,no
98247,US,"This bottling from the Beckett brothers—bolstered with 14% Syrah—is yet another crowd-pleaser from their stylish, affordable label. Plump black-fruit aromas meet iodine and dried purple-flower notes on the nose. The palate is rich and soft at first, growing tannic over time, with dark purple-fruit flavors that last long into the finish, edged in bright acidity.",Suite Petite,88,15.0,California,Paso Robles,Central Coast,Matt Kettmann,@mattkettmann,Chronic Cellars 2015 Suite Petite Petite Sirah (Paso Robles),Petite Sirah,Chronic Cellars,red,no
98957,US,"Hot, spicy and sweet in blackberries, cherries and raspberries, like a fruit reduction sauce. The tannins are tough. Cries out for barbecue.",Carver Sutro Palisades Vineyard,85,40.0,California,Napa Valley,Napa,,,Rock Wall 2009 Carver Sutro Palisades Vineyard Petite Sirah (Napa Valley),Petite Sirah,Rock Wall,red,no
99245,US,"This 100% varietal provides a pretty example of Petite Sirah, with appealing accents of dark coffee and plum. The soft, supple feel to the fruit flavors belies the firm tannins at this wine's core. Amaro-like bitters on the finish are the only thing that holds this wine back from reaching further heights.",Trout Trilogy,88,30.0,Idaho,,,Sean P. Sullivan,@wawinereport,Sawtooth 2011 Trout Trilogy Petite Sirah,Petite Sirah,Sawtooth,red,no
99378,US,"Big and tight and intense, a bottle for serious Petite Sirah lovers only. True Vine's wines are estate grown and aged for two years in American oak. Big and ageworthy. Marco Cappelli is the winemaker.",Estate,86,28.0,California,El Dorado County,Sierra Foothills,Virginie Boone,@vboone,True Vine 2007 Estate Petite Sirah (El Dorado County),Petite Sirah,True Vine,red,no
99576,US,"Inky black, hard in tannins, bone dry and incredibly rich in smoked meat, blackberry, cassis and pepper flavors, this is, in other words, classic Petite Sirah. It's brawny, but never loses its sense of poise. Will develop in the bottle for 20 years.",Petite Sirah,91,35.0,California,Napa Valley,Napa,,,Coquerel Family Wine Estates 2008 Petite Sirah (Napa Valley),Petite Sirah,Coquerel Family Wine Estates,red,no
99757,US,"This 100% Petite Sirah showcases the variety's tannins, full body and fruity concentration, with waves of blackberry and blueberry jam, cherry pie, cbocolate and new oak flavors. It's too soft to develop in the bottle, but will be lovely over the next year with rich stews and roasts.",Ann's Block Estate,88,48.0,California,Paso Robles,Central Coast,,,Alta Colina 2010 Ann's Block Estate Petite Sirah (Paso Robles),Petite Sirah,Alta Colina,red,no
99856,US,"A good look at the potential of the soon-to-be official Creston appellation, this opaque wine is scented with pickled cherries, black tea and sour herbal aromas. Balsamic vinegar leads the palate, which is showing a bit of age, so drink now.",Creston Valley Vineyard,89,44.0,California,Paso Robles,Central Coast,Matt Kettmann,@mattkettmann,Vina Robles 2011 Creston Valley Vineyard Petite Sirah (Paso Robles),Petite Sirah,Vina Robles,red,no
99857,US,"That friendly, familiar, cedar and cinnamon aroma that comes from oak barrels jumps out of the glass when sipping this full-bodied and deep-colored wine. It has gripping tannins that dry the mouth but will work well with pork, beef and lamb. And it blends in enough ripe fruit flavor for good balance. Best now through 2018.",Reserve Avila Vineyard,89,40.0,California,Fair Play,Sierra Foothills,Jim Gordon,@gordone_cellars,Winery by the Creek 2012 Reserve Avila Vineyard Petite Sirah (Fair Play),Petite Sirah,Winery by the Creek,red,no
100080,US,"The aromas of cola, java chip, licorice and cherry are pleasant and plentiful, ultimately evolving into grapey dark-fruit and cedary spice flavors. With its medium-grained tannins, modestly concentrated flavors and supporting acids, this should pair well with burgers or other casual foods.",Petite Sirah,85,19.0,New Mexico,New Mexico,,,,Vivác Winery 2009 Petite Sirah (New Mexico),Petite Sirah,Vivác Winery,red,no
100367,US,"Deep and hearty black cherry, vanilla, cola and black-pepper aromas make for a lush, imposing and yet classic nose on this bottling. It's simultaneously soft and powerful on the palate, with black-cherry foam, crème de cassis, vanilla custard and melted milk-chocolate flavors set against a backbone of vibrant acidity and plush tannins. It's a decadent mouthful.",Petite Sirah,92,32.0,California,Paso Robles,Central Coast,Matt Kettmann,@mattkettmann,Peachy Canyon 2014 Petite Sirah (Paso Robles),Petite Sirah,Peachy Canyon,red,no
100448,US,"Ouch. Tough, extremely dry, and acidic-tannic, this wine isn't showing much charm now. There's a suggestion of blackberry, bitter cherry and blueberry fruit, as well as lots of smoky oak. Nowhere near ready, and hard to predict. Try after 2008.",Jardine,84,26.0,California,Paso Robles,Central Coast,,,Vina Robles 2005 Jardine Petite Sirah (Paso Robles),Petite Sirah,Vina Robles,red,no
100529,US,"Grown in a highlands plateau between Napa Valley and the Russian River Valley, this shows the varietal's bigtime tannins, but it's lighter in body than you might expect. It's delicious in blackberry, currant, grilled meat and sandalwood flavors. This is one of the more elegant and sophisticated Petite Sirahs of the vintage. It's showing its best now and will continue to drink well over the next few years.",Petite Sirah,92,36.0,California,Knights Valley,Sonoma,,,Summers 2009 Petite Sirah (Knights Valley),Petite Sirah,Summers,red,no
100886,US,"A solid and nuanced sip of this varietal for a fair price, this bottling of older vines from Paso's eastern flanks shows plump elderberry and cedar on the elegant nose. A smoked-chocolate flavor hits the palate, bolstered by blackberry syrup, white pepper, bay leaf and dried basil, with plenty of both tannin and acid.",Old VInes Rio Cedar VIneyard,91,23.0,California,Paso Robles,Central Coast,Matt Kettmann,@mattkettmann,Clayhouse 2013 Old VInes Rio Cedar VIneyard Petite Sirah (Paso Robles),Petite Sirah,Clayhouse,red,no
100890,US,"Reserved on the nose at first, this wine eventually releases pressed black raspberry and elderberry fruit as well as a peppery teriyaki element. Similar fresh fruit shows on the palate, enhanced by anise, dried sage and other aromatic herbs.",Worth Hill VIneyard,91,49.0,California,Paso Robles,Central Coast,Matt Kettmann,@mattkettmann,Culton 2013 Worth Hill VIneyard Petite Sirah (Paso Robles),Petite Sirah,Culton,red,no
100927,US,"Soft and approachable, this full-bodied wine features classic elements of blueberry, blackberry and leathery chocolate that finish without much ado.",Petite Sirah,86,30.0,California,Dry Creek Valley,Sonoma,Virginie Boone,@vboone,Puccioni 2012 Petite Sirah (Dry Creek Valley),Petite Sirah,Puccioni,red,no
101154,Israel,"An enticing nose of cherry pie and vanilla sets the stage for flavors of ripe cherry, blueberry, white chocolate and lilac. Grippy tannins hold their own against a strong vein of acidity, and the finish is notable for its light floral lift.",Reserve,92,32.0,Galilee,,,Mike DeSimone,@worldwineguys,Recanati 2014 Reserve Petite Sirah (Galilee),Petite Sirah,Recanati,red,no
101486,US,"A heavy, dull wine, this is dry and tannic, and it offers blackberry, cassis and cedar flavors that seem thin.",Petite Sirah,82,18.0,California,Paso Robles,Central Coast,,,Tower 15 2010 Petite Sirah (Paso Robles),Petite Sirah,Tower 15,red,no
