,country,description,designation,points,price,province,region_1,region_2,taster_name,taster_twitter_handle,title,variety,winery,type,sparkling
57958,US,"Violet, lavender, espresso and cherry-cola syrup aromas show on the nose of this wine by interior designer Caren Rideau and industry veteran Andres Ibarra, who's been growing and making wine for decades. The palate offers blueberry, cedar ash and pencil shavings, but it shows quite a bit of grip and will require more patience to enjoy fully.",La Presa Vineyard,87,34.0,California,Santa Ynez Valley,Central Coast,Matt Kettmann,@mattkettmann,Ibarra 2010 La Presa Vineyard Petite Sirah (Santa Ynez Valley),Petite Sirah,Ibarra,red,no
58081,US,"Here is a full-throttle mouthful of brambly berry fruit, with generous accents of dried herb and underbrush. The melding of fruit and herb is perfect, with clean, polished tannins.",Petite Sirah,89,27.0,Oregon,Rogue Valley,Southern Oregon,Paul Gregutt,@paulgwine ,J. Scott Cellars 2010 Petite Sirah (Rogue Valley),Petite Sirah,J. Scott Cellars,red,no
58325,US,"Dark in color, the wine is meaty, dry and brambly in wild strawberry. It's easy to drink and like, with a smooth, hearty finish.",Rosé,87,20.0,California,Alexander Valley,Sonoma,Virginie Boone,@vboone,Field Stone 2013 Heritage Block Rosé of Petite Sirah (Alexander Valley),Petite Sirah,Field Stone,rose,no
58327,US,"There's plenty of dark chocolate and full-throttled blueberry fruit in this Petite Sirah from a producer with a longstanding history with the grape. Subtle yet chewy black pepper plays on the palate, finishing in a waft of smoke.",Estate Bottled,87,25.0,California,Russian River Valley,Sonoma,Virginie Boone,@vboone,Foppiano 2011 Estate Bottled Petite Sirah (Russian River Valley),Petite Sirah,Foppiano,red,no
58813,US,"Generous in white pepper, particularly on the nose, this Petite has tight, puckering tannins pleading for more time in the bottle. Soft flavors lean to the leathery blackberry and licorice side of things.",Reserve,86,28.0,California,Livermore Valley,Central Coast,Virginie Boone,@vboone,Cedar Mountain 2009 Reserve Petite Sirah (Livermore Valley),Petite Sirah,Cedar Mountain,red,no
58886,US,"Lusty and rustic, this Petite Sirah has full-bodied flavors of berry-cherry jam, chocolate and spice. The tannins are rich, suggesting char-broiled steaks and chops.",The Heritage Collection,84,12.0,California,Lodi,Central Valley,,,Peirano 2006 The Heritage Collection Petite Sirah (Lodi),Petite Sirah,Peirano,red,no
59147,US,"A 100% Petite Sirah, this is inky, dark and thick, exuding tobacco, blackberry and an old-school rusticity true to its Mendocino roots.",True Grit,85,20.0,California,Mendocino,,Virginie Boone,@vboone,Parducci 2008 True Grit Petite Sirah (Mendocino),Petite Sirah,Parducci,red,no
59250,US,"Asphalt, wet dirt, blueberry fruit and grapeseed aromas show on the nose of this dark and dense bottling. The palate starts with milk-chocolate shavings followed by tart red-cherry fruit. The acidity is overwhelming, singeing the tongue, and the tannins are a bit chunky. It should improve with cellar time.",Dark Phantom,86,60.0,California,Paso Robles,Central Coast,Matt Kettmann,@mattkettmann,Graveyard 2013 Dark Phantom Petite Sirah (Paso Robles),Petite Sirah,Graveyard,red,no
59595,US,"The wine offers a taste of cherry liqueur and blueberries that's soft, high in acidity and still a bit tight in tannins. This would be a good one to give a bit more time.",Ghielmetti Vineyard,86,28.0,California,Livermore Valley,Central Coast,Virginie Boone,@vboone,Fenestra 2010 Ghielmetti Vineyard Petite Sirah (Livermore Valley),Petite Sirah,Fenestra,red,no
59603,Israel,"This is a deep violet-red wine, with aromas of blackberry, blueberry, butterscotch and anisette. Flavors of blueberry, toffee and licorice play off of strong woody notes that dominate the finish.",Reserve,86,27.0,Galilee,,,Mike DeSimone,@worldwineguys,Recanati 2012 Reserve Petite Sirah (Galilee),Petite Sirah,Recanati,red,no
59778,US,"Very firm in tannins, this Petite Sirah is astringent and closed right now. It's hard to appreciate the sweetly ripe cherry and licorice flavors. Could improve significantly over the years, but there's no guarantee.",Spring Creek Vineyard,86,37.0,California,St. Helena,Napa,,,Rutherford Grove 2006 Spring Creek Vineyard Petite Sirah (St. Helena),Petite Sirah,Rutherford Grove,red,no
59798,US,"Parducci's '03 True Grit was a sensation. The '04 is a worthy successor. Dry, tannic and amazingly rich, it floods the mouth with blackberry, cherry, currant, leather, coffee, carob and peppery spice flavors that go on and on in the finish. Like any great young Petite Sirah, it will age for many years.",True Grit,93,25.0,California,Mendocino,,,,Parducci 2004 True Grit Petite Sirah (Mendocino),Petite Sirah,Parducci,red,no
59904,US,"Leather-boot black in color, this fine Petite Sirah is distinctive in herbal, almost eucalyptus aromas and intensely huge blackberry fruit. Earthy and soft with curtains of tannin, the wine is a complex version of the variety, rich. Age it until 2017–2021 and see if the eucalyptus mellows or intensifies.",Sirius Eaglepoint Ranch,92,45.0,California,Mendocino County,,Virginie Boone,@vboone,Sean Thackrey 2010 Sirius Eaglepoint Ranch Petite Sirah (Mendocino County),Petite Sirah,Sean Thackrey,red,no
60188,US,"Brooding aromas of dill, purple fruit, vanilla and wood spice are followed by full dark cherry flavors backed by a wall of firm yet still accessible tannins.",Monarch Reserve Zephyr Ridge Vineyards,88,30.0,Washington,Horse Heaven Hills,Columbia Valley,Sean P. Sullivan,@wawinereport,Latah Creek 2012 Monarch Reserve Zephyr Ridge Vineyards Petite Sirah (Horse Heaven Hills),Petite Sirah,Latah Creek,red,no
60340,US,"Like a liquid blueberry cobbler, this is a juicy, soft, well-integrated red wine, leathery and roundly rich. Perfect for a rib roast meal with buttery mashed potatoes, let it breathe a half-hour or two before serving.",Estate,89,32.0,California,South Coast,,Virginie Boone,@vboone,Orfila 2011 Estate Petite Sirah,Petite Sirah,Orfila,red,no
60551,US,"Pretty good for a Petite Sirah with a statewide appellation. Satisfies for its lush array of flavors and for the way the sturdy tannins and brisk acidity provide a fine framework of balance. Blackberries, cherries, leather, olive tapenade, grilled beef, tamari and white pepper are just a few of the flavors.",Vineyard Blend,88,16.0,California,California,California Other,,,Ursa 2004 Vineyard Blend Petite Sirah (California),Petite Sirah,Ursa,red,no
60575,US,"This is an untamed traditional-style wine that is tannic to its core and may require 20 years to reach its peak of enjoyment. It has aromas of blackberry and black pepper, flavors of espresso and bitter chocolate and a titanic structure built with layer after layer of muscular tannins that leave quite an astringent effect on the finish. Best after 2025.",Estate Reserve,88,32.0,California,El Dorado,Sierra Foothills,Jim Gordon,@gordone_cellars,Jodar 2014 Estate Reserve Petite Sirah (El Dorado),Petite Sirah,Jodar,red,no
60583,US,"This is a very wood-driven bottling, starting with strong cigar box on the nose alongside broad lilac, baked blackberry, spearmint and slate aromas. Cedar spice dominates the palate, allowing just hints of blueberry and wild herbs to emerge. It presents balanced tannin and acidity.","Barrels 12, 13 and 14",88,45.0,California,Temecula Valley,South Coast,Matt Kettmann,@mattkettmann,"Lorenzi Estate 2013 Barrels 12, 13 and 14 Petite Sirah (Temecula Valley)",Petite Sirah,Lorenzi Estate,red,no
60862,US,"Too sharp in acids, giving the cherry and raspberry flavors a real bite. Almost sour on the finish. Drink now.",Petite Sirah,82,19.0,California,North Coast,North Coast,,,Ramsay 2009 Petite Sirah (North Coast),Petite Sirah,Ramsay,red,no
60865,US,"Soft and simple, with candied fruit, cola and spice flavors.",Petite Sirah,82,8.0,California,California,California Other,,,Redtree 2009 Petite Sirah (California),Petite Sirah,Redtree,red,no
60876,US,"Tastes old, tired and vegetal, with modest berry flavors. It's also too soft and sweet. The alcohol seems higher and hotter than the official reading of 14.3%.",Petite Sirah,80,29.0,California,Paso Robles,Central Coast,,,Estrella Creek 2005 Petite Sirah (Paso Robles),Petite Sirah,Estrella Creek,red,no
61052,US,"The color is almost black, and lots of dark berry and black pepper aromas come out. This wine's flavors are even more pronounced, tasting peppery, meaty and like boysenberries. Dense ­tannins make the mouthfeel thick and layered. A lingering finish attests to its considerable concentration.",Petite Sirah,91,18.0,California,Amador County,Sierra Foothills,Jim Gordon,@gordone_cellars,Terra d'Oro 2013 Petite Sirah (Amador County),Petite Sirah,Terra d'Oro,red,no
61064,US,"From a notoriously tannic grape variety comes this well-polished yet massively concentrated wine. Gorgeous, softly ripe berry and black-fig flavors demand attention from the first whiff to the lingering finish. Delicious to drink now with meat or game, it will age well through at least 2020.",Estate,91,36.0,California,Livermore Valley,Central Coast,Jim Gordon,@gordone_cellars,Las Positas 2012 Estate Petite Sirah (Livermore Valley),Petite Sirah,Las Positas,red,no
61521,US,"A brawny, dusty Petite with ripe flavors of plum and black fruit enveloped by sticky tannins.",Petite Sirah,86,18.0,California,Red Hills Lake County,,Virginie Boone,@vboone,Chacewater 2009 Petite Sirah (Red Hills Lake County),Petite Sirah,Chacewater,red,no
61685,US,"Thick in sandpapery tannins, this Petite Sirah shows very ripe, sweet flavors of blackberry jam, currants, chocolate, raisins and pepper. It's rustic now, and likely to remain so over a long lifespan.",Altitude 2401 Fair Play Farms,84,35.0,California,El Dorado,Sierra Foothills,,,Perry Creek 2006 Altitude 2401 Fair Play Farms Petite Sirah (El Dorado),Petite Sirah,Perry Creek,red,no
61696,US,"Wilson's red wines tend to be simple and forward in sweet, sugary fruit, and so is this wine. It shows jammy or pie-filling flavors of raspberries, cherries and currants.",Ellie's Vineyard,84,35.0,California,Dry Creek Valley,Sonoma,,,Wilson 2005 Ellie's Vineyard Petite Sirah (Dry Creek Valley),Petite Sirah,Wilson,red,no
61847,US,"Muted aromatics frame the entry of this wine, a concentration of baked raspberry and blackberry at its core. Smooth and soft, with minimal presence of oak, it's a fairly elegant expression of the grape.",Petite Sirah,87,42.0,California,Russian River Valley,Sonoma,Virginie Boone,@vboone,Graton Ridge 2013 Petite Sirah (Russian River Valley),Petite Sirah,Graton Ridge,red,no
61861,US,"This 100% varietal wine is soft in jammy black fruit, with back notes of black pepper and smoke. From the warmer part of the Napa Valley in a warm vintage, it's big and powerful.",Estate,87,49.0,California,Calistoga,Napa,Virginie Boone,@vboone,Envy 2012 Estate Petite Sirah (Calistoga),Petite Sirah,Envy,red,no
61906,US,"Pretty rustic even for a Petite Sirah, with big, edgy tannins and a scoury mouthfeel. But it shows rich flavors of cherries, berries, cola, bacon and sandalwood, with a spicy, peppery finish. Ready to drink now.",Petite Sirah,86,28.0,California,Dry Creek Valley,Sonoma,,,Puccioni 2006 Petite Sirah (Dry Creek Valley),Petite Sirah,Puccioni,red,no
62030,US,"This is a linebacker wine, at 15.7% abv, bursting with roasted coffee, licorice and dry tannins all around. Soft, supple and round, and fully concentrated, the finish could use a bit more harrumph. The back label's suggestion to pair this wine with short ribs is a good call.",Old Vine,86,35.0,California,Contra Costa County,Central Coast,Virginie Boone,@vboone,Trinitas 2010 Old Vine Petite Sirah (Contra Costa County),Petite Sirah,Trinitas,red,no
62082,US,"Here's a lush young Petite Sirah brimming with blackberry jam, cherry liqueur, dark chocolate and licorice flavors that taste a little sweet. It's tannic and immature now, but should age well for up to a decade.",Estate,87,45.0,California,Paso Robles,Central Coast,,,Venteux 2006 Estate Petite Sirah (Paso Robles),Petite Sirah,Venteux,red,no
62105,US,"Capturing the dense essence of Petite Sirah, this marries deep berry flavor to a highlight of Bourbon-soaked chocolate. It's not overly sweet, but it's definitely a dessert wine.",Mistelle,91,24.0,Oregon,Rogue Valley,Southern Oregon,Paul Gregutt,@paulgwine ,J. Scott Cellars 2010 Mistelle Petite Sirah (Rogue Valley),Petite Sirah,J. Scott Cellars,red,no
62204,US,"Bright cherry and raspberry flavors and a smooth texture make this wine stand out. Aromas are a bit earthy, mature but slightly floral, and the flavors resemble blackberry jam. While full bodied, it's not very tannic and has an unsually soft mouthfeel for this varietal.",Petite Sirah,86,28.0,California,Lodi,Central Valley,Jim Gordon,@gordone_cellars,Ripken 2013 Petite Sirah (Lodi),Petite Sirah,Ripken,red,no
62249,US,"This is a dark, inky Petite Sirah, dense in tannins and full-bodied. It basically takes command of the palate and puts up a wall of astringency. That's young Petite Sirah for you. Behind that wall are rich flavors of blackberries and currants, with a generous sweetness from toasty oak, and finished with a hit of acidity. You should cellar this wine for at least six years.",Amelia's Block,90,34.0,California,Calistoga,Napa,,,Shypoke 2008 Amelia's Block Petite Sirah (Calistoga),Petite Sirah,Shypoke,red,no
62329,US,"From the eastern side of Calistoga, under the gorgeous geological formation for which the vineyard is named, this wine shows complex, moderately ripe aspects of pencil, leather and youthful, lifted acidity. Grippy still, the Burgundian oak used for aging was 30% new. Elegantly refined, it'll do well with further time in the cellar; enjoy best 2024 through 2034.",Palisades Vineyard,94,55.0,California,Calistoga,Napa,Virginie Boone,@vboone,Robert Biale 2014 Palisades Vineyard Petite Sirah (Calistoga),Petite Sirah,Robert Biale,red,no
62522,US,"Ripe, vibrant and focused fruit flavors give this full-bodied wine a lot of life. It smells and tastes like rich boysenberry and lively raspberry, feels well balanced and fresh on the palate, and does not have heavy tannins.",Private Reserve Estate Grown,90,31.0,California,Livermore Valley,Central Coast,Jim Gordon,@gordone_cellars,Eagle Ridge 2011 Private Reserve Estate Grown Petite Sirah (Livermore Valley),Petite Sirah,Eagle Ridge,red,no
62675,US,"This wine's fresh and boisterous nature make it great for barbecues. Aromas of blueberry jam, condensed lilacs and smoked meats are very inviting. The fruit-forward palate combines smoked boysenberries and blueberries with roasted pork, dried oregano and a unique salt-and-pepper component.",Estate Reserve,90,22.0,California,Paso Robles,Central Coast,Matt Kettmann,@mattkettmann,San Simeon 2011 Estate Reserve Petite Sirah (Paso Robles),Petite Sirah,San Simeon,red,no
62823,US,"A fine Mendocino Petite Sirah that's mouth filling with blueberry and licorice and plenty structured to age longer than it already has. With pleasant layers of licorice and black tea, especially on the finish, it's also ready to drink now.",Petite Sirah,87,18.0,California,Mendocino,,Virginie Boone,@vboone,Graziano 2007 Petite Sirah (Mendocino),Petite Sirah,Graziano,red,no
62928,US,"After all the soft red wines lately, it's almost a relief to gag on some real tannins. Dry and spicy, with big-time black cherry pie flavors, complete with the baked, buttery crust.",Petite Sirah,87,24.0,California,Mendocino County,,,,Eaglepoint Ranch 2002 Petite Sirah (Mendocino County),Petite Sirah,Eaglepoint Ranch,red,no
63176,US,"Concentrated but fresh aromas of black cherries and blueberries mesh with hot black gravel and nose-tickling lilacs on this wine by the Fess Parker family. Dark chocolate, peppery spice, black cherry syrup and mocha flavors shine on the robust, rich and delicious palate.",Rodney's Vineyard,92,32.0,California,Santa Barbara County,Central Coast,Matt Kettmann,@mattkettmann,Epiphany 2012 Rodney's Vineyard Petite Sirah (Santa Barbara County),Petite Sirah,Epiphany,red,no
63401,US,"Textbook Sonoma Petite Sirah, midnight black in color, high in alcohol and enormously thick in blackberry, cassis and chocolate, with a bacony, funky note of cured meat. It's delicious now with richly-flavored meats and cheeses.",Petasera Estate Grown,87,35.0,California,Dry Creek Valley,Sonoma,,,Mounts 2010 Petasera Estate Grown Petite Sirah (Dry Creek Valley),Petite Sirah,Mounts,red,no
64229,US,"This wine pumps up the jammy fruit flavors of the grape variety. It packs in the typical thick but fine tannins, and also contributes spicy complexities like cardamom and black pepper that lend it an extra dimension. The oak flavors seem very intense but there is so much grapy richness that the wine remains powerfully balanced. Drink now through 2020.",Petite Sirah,90,25.0,California,Lodi,Central Valley,Jim Gordon,@gordone_cellars,Klinker Brick 2012 Petite Sirah (Lodi),Petite Sirah,Klinker Brick,red,no
64492,US,"This is a fine Petite Sirah at this price, good for everyday fare like pizza or barbecue. It's dark in color, dry, tannic and stuffed with juicy blackberry and currant fruit.",Petite Sirah,85,11.0,California,California,California Other,,,Bogle 2010 Petite Sirah (California),Petite Sirah,Bogle,red,no
64595,US,"Soft and somewhat sweet, this rustic Petite Sirah has candied flavors of raspberries, mocha, bacon and black pepper. An easy sipper to enjoy now.",Alexander Valley Estate,85,15.0,California,Sonoma County,Sonoma,,,Trentadue 2008 Alexander Valley Estate Petite Sirah (Sonoma County),Petite Sirah,Trentadue,red,no
65324,US,"Dark, thick and young, with sour cherry Lifesaver flavors and noticeable dusty tannins. It's actually a very pretty wine, very dry and balanced, with good length and a clean finish. Will age, but drinks well now. —S.H.",Petite Sirah,88,20.0,California,El Dorado,Sierra Foothills,,,Granite Springs 1999 Petite Sirah (El Dorado),Petite Sirah,Granite Springs,red,no
65341,Australia,"This big and broodingly dark wine is packed with grapey fruit and vanilla. The tannins on the finish are dusty but ripe and should preserve the wine for up to 10 years in the cellar. Still, why not drink it now with barbecue and savor the youthfully lusty fruit? —J.C.",Petite Sirah,88,27.0,Victoria,Rutherglen,,Joe Czerwinski,@JoeCz,Warrabilla 2000 Petite Sirah (Rutherglen),Petite Sirah,Warrabilla,red,no
65572,US,"Despite the relatively high alcohol and scents of slightly cooked, raisined fruit, this comes across as rather thin and stiff. The fruit lacks any sweetness, and the tannins turn chalky in the finish.",Petite Sirah,85,30.0,Oregon,Applegate Valley,Southern Oregon,Paul Gregutt,@paulgwine ,Plaisance Ranch 2012 Petite Sirah (Applegate Valley),Petite Sirah,Plaisance Ranch,red,no
65591,US,"Concentrated but fresh aromas of black cherries and blueberries mesh with hot black gravel and nose-tickling lilacs on this wine by the Fess Parker family. Dark chocolate, peppery spice, black cherry syrup and mocha flavors shine on the robust, rich and delicious palate.",Rodney's Vineyard,92,32.0,California,Santa Barbara County,Central Coast,Matt Kettmann,@mattkettmann,Epiphany 2012 Rodney's Vineyard Petite Sirah (Santa Barbara County),Petite Sirah,Epiphany,red,no
65612,US,"Textbook Napa Petite Sirah—rich, smooth and insanely delicious. Chocolate blackberry jam, spiced plum pudding and toasty oak flavors, are wrapped into thick, velvety tannins. What a great summer barbecue wine, or with mid-winter short ribs of beef. Terrific now, and will age for a decade or more.",S&J Vineyard Reserve,93,65.0,California,Napa Valley,Napa,,,Frank Family 2010 S&J Vineyard Reserve Petite Sirah (Napa Valley),Petite Sirah,Frank Family,red,no
65644,US,"Aged in all-new American oak, this vineyard-designate is light bodied and restrained, a nice surprise for the variety. Soft, simple and bright, it shows a warmth of plum cake and Christmas spice, ending in a rainfall of black pepper. A nuanced, quiet wine, it should be enjoyed in its youth.",Hayne Vineyard,90,75.0,California,Napa Valley,Napa,Virginie Boone,@vboone,Jacob Franklin 2012 Hayne Vineyard Petite Sirah (Napa Valley),Petite Sirah,Jacob Franklin,red,no
65663,US,"This is a gutsy wine, with firm tannins, making the texture slightly astringent while tightly holding in the fruit and oak flavors. It needs rich food alongside, or hold it until 2017 to mellow.",Petite Sirah,87,12.0,California,Lodi,Central Valley,Jim Gordon,@gordone_cellars,Ironstone 2013 Petite Sirah (Lodi),Petite Sirah,Ironstone,red,no
65806,US,"Welsh winemaker Damian Grindley has turned out a winner from north of his Paso Robles winery. Aromas of black cherry, toasted vanilla, fudge and cigar ash lead into a palate that's juicy and jammy with black fruits at first, but then edged with dark flavors of coffee grinds and charred meat.",Petite Sirah,92,42.0,California,Monterey,Central Coast,Matt Kettmann,@mattkettmann,Brecon Estate 2013 Petite Sirah (Monterey),Petite Sirah,Brecon Estate,red,no
65911,US,"In this wine aged 26 months in new and used American oak, the barrel aromas show themselves first, with notes of vanilla and coffee followed by spice and dark fruit. The coffee and cherry flavors are medium bodied, with well-integrated tannins backing them up.",Zephyr Ridge,88,20.0,Washington,Horse Heaven Hills,Columbia Valley,Sean P. Sullivan,@wawinereport,Thurston Wolfe 2012 Zephyr Ridge Petite Sirah (Horse Heaven Hills),Petite Sirah,Thurston Wolfe,red,no
65959,US,"This wine is a classic of the type that can only improve with time. The aromas show tightly packed spices, superripe fruit and cedar. Dense blackberry, blueberry and dark chocolate flavors fill this full-bodied and lavishly tannic wine to the brim. The color is black, except for a slim ring of deep ruby at the edge. Best after 2025.",Petite Sirah,94,50.0,California,Amador County,Sierra Foothills,Jim Gordon,@gordone_cellars,Renwood 2014 Petite Sirah (Amador County),Petite Sirah,Renwood,red,no
65977,US,"Chocolate and blueberry highlight a high-octane experience of soft, candied flavor in this leathery, juicy wine from the producer's estate. Full-bodied and ripe, it displays the bold rusticity of the variety.",Hillside Estate,88,40.0,California,Dry Creek Valley,Sonoma,Virginie Boone,@vboone,Collier Falls 2013 Hillside Estate Petite Sirah (Dry Creek Valley),Petite Sirah,Collier Falls,red,no
66593,US,"This wine doesn't try to conceal what it is, a 100% varietal exploration of a hearty grape, though in this case, from a relatively cool area. Black-purple in color, it offers structure and tension atop developed flavors of mocha chocolate and plum.",Petite Sirah,88,28.0,California,Russian River Valley,Sonoma,Virginie Boone,@vboone,Bluenose 2012 Petite Sirah (Russian River Valley),Petite Sirah,Bluenose,red,no
67017,US,"Grown in Calistoga, this is textbook Petite Sirah: It's black as a moonless night, bone dry, intensely tannic and enormously packed in fruit. Those tannins really lock the wine down in astringency, but they can't hide the massive burst of blackberry, cassis liqueur, mocha, crispy bacon and black pepper. Nowhere near ready to drink, it's a wine to be cellared for 5–6 years, at the very least. It should glide through the decades effortlessly, gradually losing tannins and growing more clean and pure.",Miljenko's Vineyard Estate Grown,93,55.0,California,Napa Valley,Napa,,,Grgich Hills 2008 Miljenko's Vineyard Estate Grown Petite Sirah (Napa Valley),Petite Sirah,Grgich Hills,red,no
67150,US,"Extremely woody aromas of cedar meet with prunes, tobacco leaf and nutmeg on the nose of this bottling from a property south of San Jose. That woody character also plays powerfully on the palate, mixing with baked blueberry flavors to achieve a sort of balance. The tannins makes for a squeaky texture on the finish.",Tower View Vineyards,88,36.0,California,Santa Clara Valley,Central Coast,Matt Kettmann,@mattkettmann,Castillo's Hillside Shire 2012 Tower View Vineyards Petite Sirah (Santa Clara Valley),Petite Sirah,Castillo's Hillside Shire,red,no
67185,US,"Violets and white pepper intrude pleasantly on the nose of this estate-grown wine, accented by 10% Zinfandel. Layered and mischievously elegant despite its size, it's drinkable now, as satisfying as a piece of blueberry pie, and yet structured. It's a fine wine to lie down, through 2022.",East Ridge Vineyard Estate,92,28.0,California,Dry Creek Valley,Sonoma,Virginie Boone,@vboone,Gustafson Family 2012 East Ridge Vineyard Estate Petite Sirah (Dry Creek Valley),Petite Sirah,Gustafson Family,red,no
68097,US,"Collin Cranor is a young, eager winemaker looking to make his mark in the Livermore Valley and this wine shows off his skill and ability to work with great fruit to make an interesting wine. Savory, this Petite Sirah has classic notes of chocolate, cherry and berry, though it benefits from a bit of air and time to open. Try it with meaty dishes; if they include bacon, all the better.",Black Label,87,32.0,California,Livermore Valley,Central Coast,Virginie Boone,@vboone,Nottingham Cellars 2009 Black Label Petite Sirah (Livermore Valley),Petite Sirah,Nottingham Cellars,red,no
68344,US,"Fresh and inviting on the nose, this bottling from the Estrella and San Miguel subdistricts shows black cherry pie, clove, vanilla and buttered rum aromas. It's incredibly rich on the palate, with caramelized black fruit, vanilla and cola flavors, bolstered by a minerally backbone and iodine touches.",Tower Road,89,35.0,California,Paso Robles,Central Coast,Matt Kettmann,@mattkettmann,J. Lohr 2014 Tower Road Petite Sirah (Paso Robles),Petite Sirah,J. Lohr,red,no
