,country,description,designation,points,price,province,region_1,region_2,taster_name,taster_twitter_handle,title,variety,winery,type,sparkling
90290,France,"This is juicy, full of red-berry flavors that are balanced with attractive tannins and acidity. It has some concentration from the old vines, planted in 1951, that gives the wine considerable depth and richness. This is one of those Beaujolais that could age through 2022, although it's very drinkable now.",Vignes de 1951,91,17.0,Beaujolais,Beaujolais-Villages,,Roger Voss,@vossroger,Lucien Lardy 2015 Vignes de 1951  (Beaujolais-Villages),Gamay,Lucien Lardy,red,no
90668,France,"Three parcels, totaling 16 acres from the Hospices de Belleville estate, provide the fruit for this wine. Wood aged and rich, the wine is fruity, packed with generous red-cherry flavors. There are concentration and some dark tannins as well as fine fruitiness and acidity. Drink this wine from 2018. This is Drouhin's second vintage making wine in partnership with the Hospices de Belleville charity.",Hospices de Belleville,90,26.0,Beaujolais,Fleurie,,Roger Voss,@vossroger,Joseph Drouhin 2015 Hospices de Belleville  (Fleurie),Gamay,Joseph Drouhin,red,no
91204,France,"A full, rich and rounded wine that brings out the concentration from the low yielding old vines. It has rich black cherry and spice flavors that go with the delicious acidity and solid structure. This could be a wine to age, but it's so good now. If you want, drink until 2018.",Vignes de 1939,92,35.0,Beaujolais,Chénas,,Roger Voss,@vossroger,Pascal Aufranc 2012 Vignes de 1939  (Chénas),Gamay,Pascal Aufranc,red,no
91305,France,"The wine is full of ripe bananas as well as cherry flavors, very much in the style of a nouveau. It's soft and rounded, with plenty of fruitiness as well as soft tannins. The wine is ready to drink now.",Tradition,85,12.0,Beaujolais,Beaujolais-Villages,,Roger Voss,@vossroger,Domaine de la Madone 2013 Tradition  (Beaujolais-Villages),Gamay,Domaine de la Madone,red,no
91306,France,"This fruity wine offers attractive cherry flavors that are spoiled by touches of banana. However, the acidity is good, keeping the wine fresh and indicating that it will be very drinkable in 2015.",Gamay,85,20.0,Beaujolais,Saint-Amour,,Roger Voss,@vossroger,Domaine du Haut-Poncié 2013  Saint-Amour,Gamay,Domaine du Haut-Poncié,red,no
91422,France,"A cool wine that shows fresh fruitiness and a firm sense of structure. There is an attractive red berry character, laced with considerable acidity. It should age for a few months, so drink from 2014.",Eté Fleuri,85,16.0,Beaujolais,Chiroubles,,Roger Voss,@vossroger,Vignerons de Bel Air 2012 Eté Fleuri  (Chiroubles),Gamay,Vignerons de Bel Air,red,no
91547,France,"From one of the leading estates in this cru appellation, the wine is structured and firm and likely to age well. With black cherry and red-currant fruits it is crisp although with its solid texture it should broaden out. Drink this wine from 2018.",Gamay,90,22.0,Beaujolais,Chiroubles,,Roger Voss,@vossroger,Domaine Cheysson 2015  Chiroubles,Gamay,Domaine Cheysson,red,no
91548,France,"Annick and Jean-Marc Lafont's three acres on the slopes below the chapel of la Madone give a firm and concentrated cru wine that will repay aging. There are layers of red-berry fruits that are cut with solid tannins and a dry core. The wine will age, so drink from 2018.",Rosé,90,21.0,Beaujolais,Fleurie,,Roger Voss,@vossroger,Domaine de Bel Air 2015 Granits Rosés  (Fleurie),Gamay,Domaine de Bel Air,rose,no
91549,France,"Although the Chermette family is based among the Beaujolais vineyards to the south, it does also possess vines in the crus villages of the north. With an open, ripe and juicy character the wine has concentration and richness. It is full, fruity and ready to drink.",Pierreux,90,26.0,Beaujolais,Brouilly,,Roger Voss,@vossroger,Domaine du Vissoux 2015 Pierreux  (Brouilly),Gamay,Domaine du Vissoux,red,no
92999,France,"A rich and fruity wine that is ripe with black-plum fruits. It is soft and smooth, with a juicy berry character. The tannins act as a cushion to all this opulent fruit. It is an attractive cru wine, ready to drink from mid-2017.",Gamay,89,,Beaujolais,Morgon,,Roger Voss,@vossroger,Trenel Fils 2015  Morgon,Gamay,Trenel Fils,red,no
94209,France,"Old vines give a solid structure for this firm wine that is concentrated and dense. With wood aging and rich berry fruits, it's a complex wine with a good future. The black currant and berry fruits have a fresh character as well as great acidity. Drink from 2017.",Gamay,92,26.0,Beaujolais,Moulin-à-Vent,,Roger Voss,@vossroger,Richard Rottiers 2013  Moulin-à-Vent,Gamay,Richard Rottiers,red,no
94280,France,"Fruity and juicy, this is an immediately attractive cru wine. With its ripe berry fruits and soft tannins, it has a good depth of flavor that gives it richness. The wine, with its crisp fruitiness, is ready to drink.",Gamay,88,16.0,Beaujolais,Régnié,,Roger Voss,@vossroger,Domaine de la Combe au Loup 2015  Régnié,Gamay,Domaine de la Combe au Loup,red,no
94281,France,"From the south facing Côte du Py, this oak-aged wine is full of ripe fruit that is given a crisp edge by the acidity. Lightly textured, the wine is tight, mineral and likely to age. Jean-Ludovic Loron is the cru property's fifth generation. Drink from 2018.",Côte du Py,88,24.0,Beaujolais,Morgon,,Roger Voss,@vossroger,Domaine des Gaudets 2015 Côte du Py  (Morgon),Gamay,Domaine des Gaudets,red,no
94287,France,"From one of the many cru estates that are run by Beaujolais merchant Georges Duboeuf, this wine is smooth, generous and juicy. It has red-cherry fruit that is surrounded by some firm tannins as well as juicy acidity. Drink from late 2017.",Domaine de Javernière,88,20.0,Beaujolais,Morgon,,Roger Voss,@vossroger,Georges Duboeuf 2015 Domaine de Javernière  (Morgon),Gamay,Georges Duboeuf,red,no
94417,France,"Plum-jam-flavored wine, this is very sweet, rich and very direct. The freshness is here, but this is more about the dense, superripe fruits.",Gamay,88,25.0,Beaujolais,Fleurie,,Roger Voss,@vossroger,Domaine Chignard 2006  Fleurie,Gamay,Domaine Chignard,red,no
94422,France,A hint of wood is a good sign of the richness and balance of this wine. There is some dryness and tautness to go with its black cherry and plum-skin flavors. There is a big and bold fruity aftertaste.,Château de la Terrière,88,,Beaujolais,Beaujolais-Villages,,Roger Voss,@vossroger,Terroirs et Talents 2006 Château de la Terrière  (Beaujolais-Villages),Gamay,Terroirs et Talents,red,no
94426,France,"From biodynamic producer Marcel Lapierre, this is probably as good as it got in 2007. It's a rich wine, concentrated, although the crisp fruits of the year tend to dominate. There are raspberry flavors, very pure, very fresh, but with some good depth of flavor.",Gamay,88,30.0,Beaujolais,Morgon,,Roger Voss,@vossroger,Marcel Lapierre 2007  Morgon,Gamay,Marcel Lapierre,red,no
94442,France,"Aged in wood from Domaine de la Romanée-Conti, this rich wine has sweetness, just enough tannins and wood to give structure, and a deep red cherry fruitiness.",Cuvée Tradition,88,,Beaujolais,Juliénas,,Roger Voss,@vossroger,Domaine de Gry-Sablon 2006 Cuvée Tradition  (Juliénas),Gamay,Domaine de Gry-Sablon,red,no
94577,France,"Light and fruity, full of red cherries, sweet tannins and attractive acidity. The wine is softly attractive with some of the warmth of the year.",Gamay,85,,Beaujolais,Régnié,,Roger Voss,@vossroger,Domaine de la Combe au Loup 2009  Régnié,Gamay,Domaine de la Combe au Loup,red,no
94655,France,"The wine has a tannic edge that suggests it is still young. Underneath there is some attractive red-berry fruit and acidity. It just needs a few more months to fill out, so drink from 2017.",Gamay,87,11.0,Beaujolais,Beaujolais,,Roger Voss,@vossroger,Château de Pizay 2015  Beaujolais,Gamay,Château de Pizay,red,no
94715,France,"Impressive and dense, this wine has a dark structure, firm tannins as well as fruit. Flavors of spice and smokiness are lifted by the red-berry flavors and acidity. The wine is still young, needing more time, so drink from 2016.",Les Roches,91,22.0,Beaujolais,Fleurie,,Roger Voss,@vossroger,Lucien Lardy 2014 Les Roches  (Fleurie),Gamay,Lucien Lardy,red,no
94722,France,"Named after the street where the winery stands, this is jammy and ripe while also structured with some firm tannins. Rich and juicy red-berry fruits have both crisp acidity and a dense texture. It should be drunk from 2017.",Cuvée du Colombier,91,23.0,Beaujolais,Morgon,,Roger Voss,@vossroger,Vignobles Bulliat 2014 Cuvée du Colombier  (Morgon),Gamay,Vignobles Bulliat,red,no
94954,France,"This is a ripe wine, full of cherry fruit and bright acidity. It has a dry edge that gives the wine a structure to balance the crisp, perfumed fruitiness. Drink now.",Vieilles Vignes,85,15.0,Beaujolais,Beaujolais,,Roger Voss,@vossroger,Domaine Duperray 2015 Vieilles Vignes  (Beaujolais),Gamay,Domaine Duperray,red,no
94960,France,"Lively, fruity and made to be drunk young, this is a crisp red-fruit-flavored wine. It has acidity and a tangy orange peel character. Drink now.",Gamay,85,15.0,Beaujolais,Beaujolais-Villages,,Roger Voss,@vossroger,Domaine Bertrand 2015  Beaujolais-Villages,Gamay,Domaine Bertrand,red,no
94966,France,"Light tannins give this wine an attractive texture. It has bright cherry fruits along with glittering acidity. It's a fruity, fresh wine that is ready to drink.",Gamay,85,12.0,Beaujolais,Beaujolais,,Roger Voss,@vossroger,Patriarche Père et Fils 2015  Beaujolais,Gamay,Patriarche Père et Fils,red,no
94968,France,"This is a tight wine with red-currant fruits and plenty of acidity. It is crisp and very fresh, demanding a few more months to calm down. Drink from 2017.",Terre de Loyse,85,,Beaujolais,Beaujolais-Villages,,Roger Voss,@vossroger,Laurent Perrachon 2015 Terre de Loyse  (Beaujolais-Villages),Gamay,Laurent Perrachon,red,no
94971,France,"The wine is nothing but fresh cherries from vines grown on sandy soil. Light tannins and bright fruitiness are the wine's hallmarks, giving a crisp, lively aftertaste.",Les Sableux,85,,Beaujolais,Beaujolais,,Roger Voss,@vossroger,Louis Tête 2015 Les Sableux  (Beaujolais),Gamay,Louis Tête,red,no
94972,France,"A soft banana and cherry-flavored wine that has attractive acidity and only the lightest of tannins. It is bright, fruity and ready to drink.",Gamay,85,10.0,Beaujolais,Beaujolais,,Roger Voss,@vossroger,Henry Fessy 2015  Beaujolais,Gamay,Henry Fessy,red,no
94974,France,"Produced from vines around the grand chateau, this is a crisp wine that has banana flavors and tight red-currant acidity that is crisp and lightly perfumed. It will probably be softer from early 2017.",Château de Plantigny,85,17.0,Beaujolais,Beaujolais-Villages,,Roger Voss,@vossroger,Georges Duboeuf 2015 Château de Plantigny  (Beaujolais-Villages),Gamay,Georges Duboeuf,red,no
95012,France,"The high elevation appellation of Chiroubles produces structured wine like this. It's a cool, tannin and crisp fruit flavored wine. Red currants are cut with acidity and a juicy, really fruity aftertaste. The structure will allow the wine to age a few months, so drink from the end of 2016.",Vidame de Rocsain,88,15.0,Beaujolais,Chiroubles,,Roger Voss,@vossroger,Vignerons de Bel Air 2014 Vidame de Rocsain  (Chiroubles),Gamay,Vignerons de Bel Air,red,no
95152,France,"This wine is packed with cheerful red fruits that are given a more serious edge by the tannic structure and acidity,. With its touch of pepper and minerality, it will age well over the next two years. The cru wine comes from a family-owned property on steep slopes.",Domaine de la Madrière,91,24.0,Beaujolais,Fleurie,,Roger Voss,@vossroger,Stéphane Aviron 2015 Domaine de la Madrière  (Fleurie),Gamay,Stéphane Aviron,red,no
95169,France,"This is a spicy wine, finely fruity with black-currant fruits and with some firm structured tannins. It is a concentrated wine that is likely to mature slowly. There is a sense of power behind this fine cru wine. Drink from 2018.",Gamay,91,20.0,Beaujolais,Juliénas,,Roger Voss,@vossroger,Domaine de Côtes Rémont 2015  Juliénas,Gamay,Domaine de Côtes Rémont,red,no
95197,France,"Big and solid, this is very firm in character. It has weight, density and dry tannins. At the same more juicy black fruits and acidity emerge from this mineral textured wine. Powered by its structure, it could well age for 3–5 years.",Rochegrès,91,,Beaujolais,Moulin-à-Vent,,Roger Voss,@vossroger,Georges Duboeuf 2011 Rochegrès  (Moulin-à-Vent),Gamay,Georges Duboeuf,red,no
95215,France,"This cherry-fruited wine is spicy, but a strong acid streak gives a raw aftertaste that should have softened by now. It is ready to drink.",Les Violettes,84,10.0,Beaujolais,Beaujolais-Villages,,Roger Voss,@vossroger,Boutinot 2016 Les Violettes  (Beaujolais-Villages),Gamay,Boutinot,red,no
95217,France,"Classic, simple and fruity, this is an immediately accessible wine. With bright red fruits and a soft, juicy texture, it is crisp, lively and ready to drink.",Gamay,84,11.0,Beaujolais,Beaujolais,,Roger Voss,@vossroger,Château de Pizay 2016  Beaujolais,Gamay,Château de Pizay,red,no
95225,France,"This wine has easy flavors that are bursting with red cherry. A shot of tannin gives this open, fruity wine shape. It is ready to drink.",Collection,84,11.0,Beaujolais,Beaujolais,,Roger Voss,@vossroger,L. Tramier & Fils 2015 Collection  (Beaujolais),Gamay,L. Tramier & Fils,red,no
95654,France,"This fruit and acidity-driven wine has bright red cherry and raspberry flavors. Young and fruity, it is best drunk now, although waiting until 2015 will soften the fresh tones.",L'Enfer des Balloquets,86,22.0,Beaujolais,Brouilly,,Roger Voss,@vossroger,Robert Perroud 2013 L'Enfer des Balloquets  (Brouilly),Gamay,Robert Perroud,red,no
95664,France,"Ripe and soft, it offers attractive acidity given richness by red berry fruits. It's ready to drink, with a final balanced, velvet texture.",Eté Indien,86,18.0,Beaujolais,Brouilly,,Roger Voss,@vossroger,Vignerons de Bel Air 2013 Eté Indien  (Brouilly),Gamay,Vignerons de Bel Air,red,no
95931,US,"While there are not many acres of Gamay in Michigan, it seems to be an viable addition to the rows of Pinot throughout the the state's two northern AVAs. From a warmer vintage, this wine shows plenty of red cherry and strawberry alongside lightly toasted vanilla. While juicy and snappy, a light dusting of tannins offers just enough support.",Reserve,87,25.0,Michigan,Old Mission Peninsula,,Alexander Peartree,,Chateau Grand Traverse 2012 Reserve Gamay (Old Mission Peninsula),Gamay,Chateau Grand Traverse,red,no
96074,France,"The wine is full of fresh fruits and crisp acidity. Alongside that, ripe plum skins and a mineral texture promise short-term aging. The old vines give concentration that adds a firm structure at the end.",Vieilles Vignes,87,22.0,Beaujolais,Brouilly,,Roger Voss,@vossroger,Les Frères Perroud 2013 Vieilles Vignes  (Brouilly),Gamay,Les Frères Perroud,red,no
96075,France,"This shows a more serious side to Gamay. Black cherry and plum fruits are sustained by firm tannins and tight, mineral acidity. It needs a few months to develop. Drink from 2015.",Eté Fleuri,87,,Beaujolais,Chiroubles,,Roger Voss,@vossroger,Vignerons de Bel Air 2013 Eté Fleuri  (Chiroubles),Gamay,Vignerons de Bel Air,red,no
96237,France,"Fresh, simple, raspberry-flavored wine, this is very soft, candied and fruity. There is just enough tannin to give the wine some structure, but the crispness of 2007 shows right through.",Gamay,85,15.0,Beaujolais,Beaujolais,,Roger Voss,@vossroger,Domaine Pral 2007  Beaujolais,Gamay,Domaine Pral,red,no
96243,France,"A vivid, vibrant, red-fruited wine, bursting with crisp fruits, light acidity, and red cherry flavors. Very fresh.",Château des Maladrets,85,,Beaujolais,Beaujolais-Villages,,Roger Voss,@vossroger,Terroirs et Talents 2007 Château des Maladrets  (Beaujolais-Villages),Gamay,Terroirs et Talents,red,no
96251,France,"Crisp, red hedgerow fruits and wild strawberries add to the acidity in this wine. There is an edge of greenness, but there is also some weight. Certainly not a powerful wine.",Domaine de Boischampt,85,,Beaujolais,Beaujolais-Villages,,Roger Voss,@vossroger,Terroirs et Talents 2007 Domaine de Boischampt  (Beaujolais-Villages),Gamay,Terroirs et Talents,red,no
96306,France,"A blend from different vineyards of the Fleurie appellation, this wine is deliciously elegant and floral. Crisp red fruits are sustained by acidity and a juicy character. As often with this appellation, it is a wine to age and will be better from 2018.",Gamay,92,25.0,Beaujolais,Fleurie,,Roger Voss,@vossroger,Domaines Dominique Piron 2015  Fleurie,Gamay,Domaines Dominique Piron,red,no
96456,France,"Light in color, this shows red cherry and strawberry flavors. The tannins are soft, creating an easy wine that is ready to drink.",Gamay,84,10.0,Beaujolais,Beaujolais,,Roger Voss,@vossroger,Barton & Guestier 2011  Beaujolais,Gamay,Barton & Guestier,red,no
97440,France,"A big, bold and fruity wine that is full of ripe berry fruits, rich and generous. This is Beaujolais at its most exuberant, a celebration of delicious fruit. It could age, but is ready to drink.",Domaine des Rosiers,91,,Beaujolais,Moulin-à-Vent,,Roger Voss,@vossroger,Georges Duboeuf 2009 Domaine des Rosiers  (Moulin-à-Vent),Gamay,Georges Duboeuf,red,no
97503,France,"Cherry fruits and firm tannins band well together in this rich wine. It offers spice from light wood aging, a touch of banana, and full forward fruitiness. The structure suggests it needs to age for a year.",Domaine Mont Chavy,88,,Beaujolais,Morgon,,Roger Voss,@vossroger,Jean-Claude Debeaune 2011 Domaine Mont Chavy  (Morgon),Gamay,Jean-Claude Debeaune,red,no
97548,France,"Warm, rounded and open style of wine with attractive fruits, hints of raisins and a smoky character. Not for aging.",Gamay,87,19.0,Beaujolais,Côte de Brouilly,,Roger Voss,@vossroger,Henry Fessy 2009  Côte de Brouilly,Gamay,Henry Fessy,red,no
97821,France,"Well structured wine, the red cherry fruits laced with some banana hints. The wine is deliciously fruity, the tannin edge just a light coating.",Sélection,84,12.0,Beaujolais,Régnié,,Roger Voss,@vossroger,Georges Duboeuf 2010 Sélection  (Régnié),Gamay,Georges Duboeuf,red,no
97827,France,"With bright red fruits and acidity, this shows structure, piles of red cherry flavors, followed by firm tannins.",Gamay,84,10.0,Beaujolais,Beaujolais-Villages,,Roger Voss,@vossroger,Mommessin 2010  Beaujolais-Villages,Gamay,Mommessin,red,no
97831,France,"Showing up-front fruit, with tense acidity, this is all about freshness. There's a cool, textured feel to the wine, more plum skin than juice.",Domaine Romy,83,15.0,Beaujolais,Beaujolais,,Roger Voss,@vossroger,Paul Beaudet 2010 Domaine Romy  (Beaujolais),Gamay,Paul Beaudet,red,no
98267,France,"Volcanic ash over granite gives this vineyard its structured character, which carries over into this wine. Wood aged in large barrels, it has a rich firm character that will allow the wine to develop. Powered by acidity and tannins, the ripe black fruits are juicy and concentrated. Drink this wine from 2018.",Grand Cras,91,25.0,Beaujolais,Morgon,,Roger Voss,@vossroger,Laurent Gauthier 2015 Grand Cras  (Morgon),Gamay,Laurent Gauthier,red,no
98305,France,"Red-berry fruits and a full-bodied texture form the hallmark of this ripe wine. It has spice, a rich character that is generous and fruity. The wine is ready to drink.",Gamay,88,14.0,Beaujolais,Beaujolais-Villages,,Roger Voss,@vossroger,Louis Jadot 2015  Beaujolais-Villages,Gamay,Louis Jadot,red,no
98592,France,"Powerful tannins dominate this serious wine. It has a complex, dense structure, full of wood and fruit tannins, along with blackberry fruits and a touch of spiced bitter cherry. This is Beaujolais for aging. Give it at least 3–5 years.",Domaine des Rosiers,92,,Beaujolais,Moulin-à-Vent,,Roger Voss,@vossroger,Georges Duboeuf 2011 Domaine des Rosiers  (Moulin-à-Vent),Gamay,Georges Duboeuf,red,no
98710,France,"From vines planted as its name suggests on granite soil, the wine is structured and dense with rich juicy black fruits. Packed with perfumed fruitiness and acidity, the wine is developing well, ready to drink from late 2017.",Cuvée les Vieux Granits,92,22.0,Beaujolais,Fleurie,,Roger Voss,@vossroger,Château de Chatelard 2015 Cuvée les Vieux Granits  (Fleurie),Gamay,Château de Chatelard,red,no
98711,France,"Wines from this great producer have developed a tendency towards too much alcohol for a wine from Beaujolais. It is a shame because otherwise this is a generous structured cru wine that is finely balanced. With tannins and delicious acidity, the wine is ready to develop further. Drink from 2018.",Gamay,92,25.0,Beaujolais,Fleurie,,Roger Voss,@vossroger,Château des Jacques 2015  Fleurie,Gamay,Château des Jacques,red,no
98713,France,"Owner Arnaud Briday has made a firm structured cru wine. While it has the generous fruit of the year, it also has plenty of tannins that give it tension and concentration. The wine is rich with explosive berry fruits and balanced acidity. Drink from 2018.",Vieilles Vignes,92,29.0,Beaujolais,Moulin-à-Vent,,Roger Voss,@vossroger,Domaine des Chers 2015 Vieilles Vignes  (Moulin-à-Vent),Gamay,Domaine des Chers,red,no
98714,France,"This cru is a solid wine. It has a dense structure spearheaded by the tannins and lifted by acidity. Black plum and berry fruits are still developing behind the firm facade. It will take some time to develop, so wait until early 2019.",Gamay,92,25.0,Beaujolais,Fleurie,,Roger Voss,@vossroger,Domaine des Marrans 2015  Fleurie,Gamay,Domaine des Marrans,red,no
99179,France,"Full, juicy and ripe, this is rich with black cherry and red plum fruits that are textured with tannins and spice. The wine, while drinkable now, will be much better from late 2016 as it broadens out.",Gamay,90,20.0,Beaujolais,Moulin-à-Vent,,Roger Voss,@vossroger,Vignobles Bulliat 2014  Moulin-à-Vent,Gamay,Vignobles Bulliat,red,no
99188,France,"This rich and full-bodied Gamay from Vincent Sangouard is ripe with black cherry and sweet fruits. A juicy side brings acidity, while a dense, firm dry core promises some aging. Drink from 2016. The Leynes village is a sub-region producing Beaujolais Villages and Burgundy Maçon wines.",La Citadelle,90,14.0,Beaujolais,Beaujolais-Leynes,,Roger Voss,@vossroger,Domaine Sangouard 2014 La Citadelle  (Beaujolais-Leynes),Gamay,Domaine Sangouard,red,no
99193,France,"From one of the properties where Duboeuf does vinification and bottling at the estate, this is a dense and structured wine. While it does have intense, young acidity, it also offers ripe berry fruits that are bold and rich. Drink from 2016.",Château des Poupets,90,20.0,Beaujolais,Juliénas,,Roger Voss,@vossroger,Georges Duboeuf 2014 Château des Poupets  (Juliénas),Gamay,Georges Duboeuf,red,no
99387,France,"Tight and tannic with as much structure as fruit. The freshness comes from the acidity, although at the end strawberry juiciness shows through.",Haute Ronze,86,18.0,Beaujolais,Régnié,,Roger Voss,@vossroger,Domaine Dupré 2010 Haute Ronze  (Régnié),Gamay,Domaine Dupré,red,no
99474,France,"With good structure and some firm tannins, this wine will age. Plenty of plums and dark black cherries add freshness to the ripe wine. Let it age another year and drink from late 2016.",Gamay,89,15.0,Beaujolais,Morgon,,Roger Voss,@vossroger,Château de Pizay 2014  Morgon,Gamay,Château de Pizay,red,no
99480,France,"This is a structured wine, solid with tannins as well as ripe red berry and dark cherry fruits. The combination gives a wine that has concentration from old vines on sandy soil as well as the potential to age. Drink from 2016. The handsome château was an important fortified structure when the Lords of Beaujeu were defending themselves in the 12th century.",Cheateau de la Pierre,89,14.0,Beaujolais,Beaujolais-Villages,,Roger Voss,@vossroger,Loron et Fils 2014 Cheateau de la Pierre  (Beaujolais-Villages),Gamay,Loron et Fils,red,no
99826,France,"A relatively austere wine, showing its mineral side, with tight tannins and firm structure. But, of course, this being a fine Beaujolais, there is also ripe, exuberant fruit under all this severity. Give it another 6 months to a year.",Domaine le Cotoyon,89,21.0,Beaujolais,Juliénas,,Roger Voss,@vossroger,Château de Fuissé 2006 Domaine le Cotoyon  (Juliénas),Gamay,Château de Fuissé,red,no
99985,France,"Full in the mouth, this is a rich and easy wine, packed with jammy fruit. It is soft, the plum flavors rounded and only light brushed by tannin and acidity.",Sélection,88,,Beaujolais,Saint-Amour,,Roger Voss,@vossroger,Georges Duboeuf 2009 Sélection  (Saint-Amour),Gamay,Georges Duboeuf,red,no
100285,France,"From a single-walled vineyard, this is a ripe, generous and still structured cru wine. It has layers of delicious black-plum fruits and a jammy ripe texture that cushions the tannins. The vineyard is wholly owned by Edouard Labruyère, making it a monopole. Drink from 2018.",Le Clos du Moulin-à-Vent,93,73.0,Beaujolais,Moulin-à-Vent,,Roger Voss,@vossroger,Domaine Labruyère 2014 Le Clos du Moulin-à-Vent  (Moulin-à-Vent),Gamay,Domaine Labruyère,red,no
100360,France,"A dense wine with the tannins and structure to go with the density. It is concentrated with great swathes of black plum and spice flavors, shot through with acidity. Made with wild yeast and without carbonic maceration, this is a wine for serious aging. Drink from 2019.",Gamay,92,27.0,Beaujolais,Morgon,,Roger Voss,@vossroger,Jean-Paul Brun 2015  Morgon,Gamay,Jean-Paul Brun,red,no
