,country,description,designation,points,price,province,region_1,region_2,taster_name,taster_twitter_handle,title,variety,winery,type,sparkling
30,France,"Red cherry fruit comes laced with light tannins, giving this bright wine an open, juicy character.",Nouveau,86,,Beaujolais,Beaujolais-Villages,,Roger Voss,@vossroger,Domaine de la Madone 2012 Nouveau  (Beaujolais-Villages),Gamay,Domaine de la Madone,red,no
42,France,"This is a festive wine, with soft, ripe fruit and acidity, plus a red berry flavor.",Nouveau,86,9.0,Beaujolais,Beaujolais,,Roger Voss,@vossroger,Henry Fessy 2012 Nouveau  (Beaujolais),Gamay,Henry Fessy,red,no
49,France,"Soft and fruity, this is a generous, ripe wine that's full of juicy red-cherry fruits and gentle tannins. It has some richness, giving a sweet character to this open, ready-to-drink wine.",Eté Indien,86,14.0,Beaujolais,Brouilly,,Roger Voss,@vossroger,Vignerons de Bel Air 2011 Eté Indien  (Brouilly),Gamay,Vignerons de Bel Air,red,no
95,France,"This is a dense wine, packed with both tannins and acidity. It brings out the ageworthiness of this appellation with its rich potential and dark mineral texture. Drink this concentrated cru wine from 2018.",Gamay,88,20.0,Beaujolais,Juliénas,,Roger Voss,@vossroger,Henry Fessy 2015  Juliénas,Gamay,Henry Fessy,red,no
96,France,"The wine comes from one of the cru estates followed by this negociant house. It is a light, ripe and fruity wine. With its attractive red-berry flavors, finished with crisp acidity, it is accessible and ready to drink.",Gamay,88,18.0,Beaujolais,Régnié,,Roger Voss,@vossroger,Henry Fessy 2015  Régnié,Gamay,Henry Fessy,red,no
110,France,"Produced from cru vines at the base of Mount Brouilly, the wine has structure as well as ripe black-plum fruits. It is generous and its fruit is well balanced by acidity and solid tannins. The wines is ready to drink.",Les Quartelets,87,23.0,Beaujolais,Brouilly,,Roger Voss,@vossroger,Pardon et Fils 2015 Les Quartelets  (Brouilly),Gamay,Pardon et Fils,red,no
163,France,"Produced from vineyards donated to a charitable hospital in the 19th century, this wine is rich and now perfectly mature. It has smoky tannins that lie under the fine, elegant cherry and red plum fruits and acidity. The wine still has freshness although the attraction here is the ripe structure. The ornate label dates back to 1926.",Hospices Civils de Romanèche Thurins,91,,Beaujolais,Moulin-à-Vent,,Roger Voss,@vossroger,Collin-Bourisset 2011 Hospices Civils de Romanèche Thurins  (Moulin-à-Vent),Gamay,Collin-Bourisset,red,no
802,France,"This is a firm wine, balancing some solid tannins with ripe red fruits. Still young, it is packed with fruitiness and with acidity that are centered around a firm core. Drink this stylish wine from 2018.",Le Griottier,90,22.0,Beaujolais,Juliénas,,Roger Voss,@vossroger,Domaine Franck Besson 2014 Le Griottier  (Juliénas),Gamay,Domaine Franck Besson,red,no
818,France,"The wine is warm and round, full of ripe berry fruits and soft tannins. It's ready to drink now with its full structure, balanced acidity and juicy aftertaste.",Belle Grâce,86,15.0,Beaujolais,Beaujolais-Villages,,Roger Voss,@vossroger,Les Vins Aujoux 2013 Belle Grâce  (Beaujolais-Villages),Gamay,Les Vins Aujoux,red,no
831,France,Some wood aging gives the fruitiness of the wine an added spice. Tannins support the bitter cherry flavors and add firmness to the juicy acidity. Drink from the end of 2015.,Roche Grès,86,23.0,Beaujolais,Moulin-à-Vent,,Roger Voss,@vossroger,Domaine du Haut-Poncié 2013 Roche Grès  (Moulin-à-Vent),Gamay,Domaine du Haut-Poncié,red,no
832,France,"The wine is very fresh, with intense acidity and fragrant red fruits. Made from 100-year-old vines, it's tight, mineral and has a cool, light character with the merest hint of tannin. Drink now.",Coeur de Vendanges,86,,Beaujolais,Beaujolais,,Roger Voss,@vossroger,Domaine du Vissoux 2013 Coeur de Vendanges  (Beaujolais),Gamay,Domaine du Vissoux,red,no
835,France,"Attractive cherry flavors give a ripe, rounded feel that's balanced by the acidity and tannins. Black cherries burst easily from the glass, delivering a full aftertaste.",Flower Label,86,12.0,Beaujolais,Beaujolais,,Roger Voss,@vossroger,Georges Duboeuf 2013 Flower Label  (Beaujolais),Gamay,Georges Duboeuf,red,no
842,France,"While the wine has a crisp side, it's also full of red fruits and soft tannins. That makes for a wine that's fragrant, fruity, ready to drink and not likely to age much. Enjoy it now.",Gamay,86,16.0,Beaujolais,Beaujolais-Villages,,Roger Voss,@vossroger,Manoir du Carra 2013  Beaujolais-Villages,Gamay,Manoir du Carra,red,no
1508,France,"This is rich, spicy and full of red cherry flavor. It also has a dark, firm structure from the granite-based soil. The acidity that cuts through the fruit lends balance. Age this for 2–3 years.",Clos de Rochegrès,92,,Beaujolais,Moulin-à-Vent,,Roger Voss,@vossroger,Château des Jacques 2011 Clos de Rochegrès  (Moulin-à-Vent),Gamay,Château des Jacques,red,no
1512,France,"Made using fruit that was sourced from vines planted in 1939, this wine shows the great concentration low yields and old vines can give. It has Gamay's natural freshness, with firm, dry tannins, a spice note and a fragrant finish. It's drinkable now, but it will be better in two years.",Vignes de 1939,92,35.0,Beaujolais,Chénas,,Roger Voss,@vossroger,Pascal Aufranc 2011 Vignes de 1939  (Chénas),Gamay,Pascal Aufranc,red,no
1804,France,"This wine is light, fruity and with only a slightly tannic character. Aromatic cherry flavors give freshness and bring out a jammy character. It's ready to drink.",Les Vignes de Thulon,85,,Beaujolais,Beaujolais-Villages,,Roger Voss,@vossroger,Jean-Marc Burgaud 2014 Les Vignes de Thulon  (Beaujolais-Villages),Gamay,Jean-Marc Burgaud,red,no
1818,France,"This wine is tight, fresh with crisp red currant and red-cherry flavors. It is as bright as a button, fruity with layers of acidity that bring out a perfumed character at the end. The Colonge family has been growing grapes in Beaujolais since 1789.",Gamay,85,,Beaujolais,Beaujolais,,Roger Voss,@vossroger,Domaine André Colonge 2014  Beaujolais,Gamay,Domaine André Colonge,red,no
1820,France,"Banana aromas don't intrude too strongly into the fruity palate of this wine that has a crisp character. Tart red-berry fruits and and bright acidity give the wine a fresh, totally fruity appeal with only a hint of tannin. Drink now.",Les Pays de Pierres Dorées,85,15.0,Beaujolais,Beaujolais,,Roger Voss,@vossroger,Domaine Pral 2014 Les Pays de Pierres Dorées  (Beaujolais),Gamay,Domaine Pral,red,no
1823,France,"Structured and firm, this wine has more in the way of dry tannins than of fruit. It presents a fine skeleton without much flesh, leaving a wine that is tight and extracted. It needs plenty of time, so drink from late 2016.",Gamay,85,20.0,Beaujolais,Chiroubles,,Roger Voss,@vossroger,Georges Duboeuf 2014  Chiroubles,Gamay,Georges Duboeuf,red,no
1824,France,"This structured wine has a tight, tannic, dry character. It is slow to develop, leaving the black cherry fruits still masked by the forward dryness. Drink from 2016.",Domaine du Paradis,85,22.0,Beaujolais,Saint-Amour,,Roger Voss,@vossroger,Georges Duboeuf 2014 Domaine du Paradis  (Saint-Amour),Gamay,Georges Duboeuf,red,no
1826,France,"This wine is totally fresh, with crisp red currant and riper banana flavors—a bright wine that's all fruit and refreshing acidity. The family has been in the wine business since 1811 and today works with some 50 small-production growers.",Beau!,84,12.0,Beaujolais,Beaujolais,,Roger Voss,@vossroger,Loron et Fils 2014 Beau!  (Beaujolais),Gamay,Loron et Fils,red,no
1957,France,"Bold and fruity, this is laden with bitter cherry and juicy plum flavors. The tannins are light and attractive, with juicy, refreshing acidity. Age this for a few more months.",L'Enfer des Balloquets,88,17.0,Beaujolais,Brouilly,,Roger Voss,@vossroger,Robert Perroud 2011 L'Enfer des Balloquets  (Brouilly),Gamay,Robert Perroud,red,no
1964,France,"This has a firmly tannic structure and juicy fruit, suggesting its aging potential. It is rich and ripe, with black cherry and plum flavors that create a generous finish.",Domaine de la Source,88,15.0,Beaujolais,Chiroubles,,Roger Voss,@vossroger,Vignerons de Bel Air 2011 Domaine de la Source  (Chiroubles),Gamay,Vignerons de Bel Air,red,no
1970,France,"Showing a mineral-driven structure and firm tannins, this is a Beaujolais that needs to age. Rich and juicy, its perfumed red fruits currently cut through the dry tannins.",Gamay,88,20.0,Beaujolais,Chiroubles,,Roger Voss,@vossroger,Château de Raousset 2011  Chiroubles,Gamay,Château de Raousset,red,no
1986,France,"For a Morgon, this is relatively light, showing more fruit than structure, with freshness that's tempered by a firm edge and minerality. Keep for a year, or drink now.",Domaine de l'Oseraie,88,14.0,Beaujolais,Morgon,,Roger Voss,@vossroger,Signé Vigneron 2011 Domaine de l'Oseraie  (Morgon),Gamay,Signé Vigneron,red,no
2143,France,"Too alcoholic for its own good, the wine is full bodied and heavy. It has tannins, superripe black fruits while missing structure and acidity. It is developing fast and will be ready to drink from 2017.",Collection,84,22.0,Beaujolais,Moulin-à-Vent,,Roger Voss,@vossroger,L. Tramier & Fils 2015 Collection  (Moulin-à-Vent),Gamay,L. Tramier & Fils,red,no
2157,France,"A fruity wine with soft tannins that is ready to drink. It has banana, red cherry and light spice flavors, finished off with attractive acidity.",Collection,84,14.0,Beaujolais,Beaujolais-Villages,,Roger Voss,@vossroger,L. Tramier & Fils 2014 Collection  (Beaujolais-Villages),Gamay,L. Tramier & Fils,red,no
2368,France,"A rich wine, full of black fruits, ripe tannins and juicy acidity. It's powerful and structured, showing a mineral texture, bold acidity and ample fruitiness.",Domaine de la Croix Rouge,88,20.0,Beaujolais,Juliénas,,Roger Voss,@vossroger,Signé Vigneron 2012 Domaine de la Croix Rouge  (Juliénas),Gamay,Signé Vigneron,red,no
2421,France,"This tastes bone dry, with a caramel note that's followed by light, bright notes of red berry and apple. The finish is crisp and tight.",Rosé,85,12.0,Beaujolais,Beaujolais Rosé,,Roger Voss,@vossroger,Château de Pizay 2011 Rosé d'Une Nuit Gamay (Beaujolais Rosé),Gamay,Château de Pizay,rose,no
2427,France,"A classically fruity Beaujolais from the south of the region, this is packed with bitter cherry and ripe raspberry flavors. The tannins are soft—plentiful enough to lend structure. It is delicious, juicy and ready to drink.",Les Griottes,85,15.0,Beaujolais,Beaujolais,,Roger Voss,@vossroger,Domaine du Vissoux 2011 Les Griottes  (Beaujolais),Gamay,Domaine du Vissoux,red,no
2431,France,"This has surprisingly structured fruits and firm tannins for a Nouveau, and it still maintains a juicy cherry flavor and ripe acidity. The finish has a tangy, textured character.",Nouveau,85,11.0,Beaujolais,Beaujolais,,Roger Voss,@vossroger,Georges Duboeuf 2012 Nouveau  (Beaujolais),Gamay,Georges Duboeuf,red,no
2671,France,"This is a concentrated, firm and tannic wine. It has a structured feel from Chiroubles, which are the highest vineyards in Beaujolais. With its black fruits, dark tannins and concentrated texture, it could certainly age for 2–3 years, although it is ready to drink now.",Domaine des Pontheux,90,,Beaujolais,Chiroubles,,Roger Voss,@vossroger,Georges Duboeuf 2011 Domaine des Pontheux  (Chiroubles),Gamay,Georges Duboeuf,red,no
2836,France,"From an estate enveloping a magnificent medieval castle, this is a lightly structured cru wine with red cherry and berry flavors. It has a backdrop of tannins and acidity that give it structure. The wine is ripe and fruity at the end and ready to drink.",Gamay,88,,Beaujolais,Brouilly,,Roger Voss,@vossroger,Château de la Terrière 2015  Brouilly,Gamay,Château de la Terrière,red,no
2841,France,"This is a romantic conjunction of names. The cru wine is silky and smooth, with integrated tannins and red-cherry fruit. It is bright and crisply textured, ready to drink from mid-2017.",Domaine du Paradis,88,22.0,Beaujolais,Saint-Amour,,Roger Voss,@vossroger,Georges Duboeuf 2015 Domaine du Paradis  (Saint-Amour),Gamay,Georges Duboeuf,red,no
2842,France,"This cru wine comes from a 44-acre vineyard with 50-year-old vines supplied by one of Duboeuf's regular growers. It is structured and dense, perhaps too dense with its heavy dry tannins. The wine will need time. Drink from 2019.",Domaine Mont Chavy,88,20.0,Beaujolais,Morgon,,Roger Voss,@vossroger,Georges Duboeuf 2015 Domaine Mont Chavy  (Morgon),Gamay,Georges Duboeuf,red,no
2843,France,"Full of crisp fruit, this cru wine is bright with red-berry flavors. It is light and with a cool character that comes from the high altitude of the vineyards. There is an edgy texture that keeps the wine together. Drink now.",Flower Label,88,20.0,Beaujolais,Chiroubles,,Roger Voss,@vossroger,Georges Duboeuf 2015 Flower Label  (Chiroubles),Gamay,Georges Duboeuf,red,no
2844,France,"A floral wine, full of ripe black-cherry fruit and with a firm structure that sustains the wine. This cru wine is rich, still developing, still with enough tannins and acidity to allow it to age further. Drink this attractive wine from mid-2017.",Flower Label,88,20.0,Beaujolais,Fleurie,,Roger Voss,@vossroger,Georges Duboeuf 2015 Flower Label  (Fleurie),Gamay,Georges Duboeuf,red,no
3044,France,"This three-acre parcel has produced a beautiful fruity wine. With red cherry and spice flavors, the wine is perfumed and juicy. Crisp acidity shoots through the attractive fruit to give a wine that is only lightly tannic and ready to drink.",En Rémont Vignes de 1939,88,22.0,Beaujolais,Chénas,,Roger Voss,@vossroger,Pascal Aufranc 2015 En Rémont Vignes de 1939  (Chénas),Gamay,Pascal Aufranc,red,no
3046,France,"Named after the steeply sloping vineyard, the wine is cool, crisp with tight cherry flavors. It is lined with acidity and some tannins. The wine will need another few months to soften out and become richer.",L'Enfer des Balloquets,88,22.0,Beaujolais,Brouilly,,Roger Voss,@vossroger,Robert Perroud 2015 L'Enfer des Balloquets  (Brouilly),Gamay,Robert Perroud,red,no
3058,France,"The wine is still young with its crisp red fruits and tense tannins. It is a structured wine, firm with a dry core and still developing its fruitiness. It will need to age a while yet, so drink from 2018.",Les Michelons,88,25.0,Beaujolais,Moulin-à-Vent,,Roger Voss,@vossroger,Yohan Lardy 2015 Les Michelons  (Moulin-à-Vent),Gamay,Yohan Lardy,red,no
3180,France,"This is one of several estates in this cru appellation where Georges Duboeuf makes and markets the wine. It is lightly wood aged to smooth out the ebullient fruits. Rich and with some firm tannins that will develop, it has concentration and a dense texture. Drink from 2018.",Château de Juliénas,90,22.0,Beaujolais,Juliénas,,Roger Voss,@vossroger,Georges Duboeuf 2015 Château de Juliénas  (Juliénas),Gamay,Georges Duboeuf,red,no
3181,France,"This cru estate is owned by the Duboeuf family. The wine has some wood aging that adds to the rich texture while not detracting from the ripe juicy red-cherry fruit. With its tannins, the wine could age, so drink from late 2017.",Château des Capitans,90,20.0,Beaujolais,Juliénas,,Roger Voss,@vossroger,Georges Duboeuf 2015 Château des Capitans  (Juliénas),Gamay,Georges Duboeuf,red,no
3182,France,"From the south-east facing Côte du Py, this is a powerfully structured wine. It is as full of tannins as of ripe red fruits. The wine with its dense character it likely to age well over several years. Drink from 2018.",Domaine de Javernière Côte du Py,90,20.0,Beaujolais,Morgon,,Roger Voss,@vossroger,Georges Duboeuf 2015 Domaine de Javernière Côte du Py  (Morgon),Gamay,Georges Duboeuf,red,no
3183,France,"Owned by the Darroze family, the cru wine from this estate is produced by Georges Duboeuf. It is a dense wine with balancing rich black fruits. Its spicy cherry-fruit flavor and rich tannins give a wine that should age further. Drink from 2018.",Domaine des Quatres Vents,90,22.0,Beaujolais,Fleurie,,Roger Voss,@vossroger,Georges Duboeuf 2015 Domaine des Quatres Vents  (Fleurie),Gamay,Georges Duboeuf,red,no
3191,France,Ripe perfumed black fruits dominate this cru wine. They float above the firm tannins and concentrated acidity to offer a wine that will become rich and generous as it develops. A touch of pepper and spice adds to the layers of fruit. Drink from 2018,Les Mouilles,90,23.0,Beaujolais,Juliénas,,Roger Voss,@vossroger,Pardon et Fils 2015 Les Mouilles  (Juliénas),Gamay,Pardon et Fils,red,no
3200,France,A four-acre parcel of old vines is the source of this dense and rich wine. It has jammy red berry and cherry fruits that are lifted by the mineral texture and acidity. The wine is balanced although it does need to age. Drink from the end of 2017.,Clos de la Brosse,90,21.0,Beaujolais,Saint-Amour,,Roger Voss,@vossroger,Terroirs et Talents 2015 Clos de la Brosse  (Saint-Amour),Gamay,Terroirs et Talents,red,no
3374,France,"This is a beautifully perfumed wine, ripe with black fruits and generous with its tannins and acidity. It comes from a one-acre parcel called Le Vivier which has 70-year-old vines. It is concentrated, dense and with aging potential. Drink from 2018.",Le Vivier,92,22.0,Beaujolais,Fleurie,,Roger Voss,@vossroger,Yohan Lardy 2015 Le Vivier  (Fleurie),Gamay,Yohan Lardy,red,no
3431,France,"The wine is still young with its crisp red fruits and tense tannins. It is a structured wine, firm with a dry core and still developing its fruitiness. It will need to age a while yet, so drink from 2018.",Les Michelons,88,25.0,Beaujolais,Moulin-à-Vent,,Roger Voss,@vossroger,Yohan Lardy 2015 Les Michelons  (Moulin-à-Vent),Gamay,Yohan Lardy,red,no
3729,France,"Aged in large wood barrels for seven months, the wine is ripe and structured. It also has fine fruitiness, rich tannins and soft acidity. The wine will be better from 2017.",Gamay,86,20.0,Beaujolais,Beaujolais-Villages,,Roger Voss,@vossroger,Château Gaillard 2015  Beaujolais-Villages,Gamay,Château Gaillard,red,no
3741,France,"With a vineyard planted in the traditional Beaujolais style of individual bushes rather than trained on wires, this is a light, soft and fruity wine. It has attractive tannins and fresh red fruits. Drink now.",Château des Vierres,86,17.0,Beaujolais,Beaujolais-Villages,,Roger Voss,@vossroger,Georges Duboeuf 2015 Château des Vierres  (Beaujolais-Villages),Gamay,Georges Duboeuf,red,no
3751,France,There is an earthy character to this wine. It gives a dry edge to the black fruits and crisp acidity. The wine has the tannins typical of the appellation although it also has a light herbal touch that is less attractive. Drink now.,Gamay,86,19.0,Beaujolais,Morgon,,Roger Voss,@vossroger,Domaine de Leyre-Loup 2014  Morgon,Gamay,Domaine de Leyre-Loup,red,no
3813,France,"This is a generous, ripe wine, full of red fruits and soft acidity. It's already enjoyable, but will benefit from aging until 2015 to bring out the refreshing fruitiness even more.",Gamay,88,22.0,Beaujolais,Beaujolais-Villages,,Roger Voss,@vossroger,Château de Corcelles 2012  Beaujolais-Villages,Gamay,Château de Corcelles,red,no
3955,France,"Dominated by its dry tannins, this is a tight black currant and dark plum skin-flavored wine, surrounded by a firm core of tannins, a firm and dark-hued wine.",Clos des Garands,90,,Beaujolais,Fleurie,,Roger Voss,@vossroger,Georges Duboeuf 2009 Clos des Garands  (Fleurie),Gamay,Georges Duboeuf,red,no
3956,France,"There is great structure here, with dusty tannins percolating through the rich wine. It has power, concentration and density, with cocoa and cherry flavors well integrated. Think about aging for 1–2 years.",Sélection,90,,Beaujolais,Moulin-à-Vent,,Roger Voss,@vossroger,Georges Duboeuf 2009 Sélection  (Moulin-à-Vent),Gamay,Georges Duboeuf,red,no
4279,France,"Sweet and sparkling, this light, fresh wine is delicious on a hot day or as an apéritif. It is crisp with red berry fruits and a soft, sweet aftertaste that is cut with acidity.",Caprice,85,24.0,France Other,Vin de France,,Roger Voss,@vossroger,Les Rocailles NV Caprice Gamay (Vin de France),Gamay,Les Rocailles,red,no
4384,France,"This rich wine features ripe, jammy red-plum and cherry fruits. It is dense, with its tannins and a touch of pepper coming from the high alcohol. The wine is a blend from five parcels. Ripe and with a juicy aftertaste, it will be best from 2018.",Vuril,88,22.0,Beaujolais,Brouilly,,Roger Voss,@vossroger,Domaine Bertrand 2015 Vuril  (Brouilly),Gamay,Domaine Bertrand,red,no
4402,France,"This wine is structured and firm, its red fruits waiting behind the wood and tannin complexity. It shows plenty of potential through its good acidity and cherry fruitiness. Drink from late 2018.",Collection,88,19.0,Beaujolais,Morgon,,Roger Voss,@vossroger,L. Tramier & Fils 2016 Collection  (Morgon),Gamay,L. Tramier & Fils,red,no
4429,France,"The small Beaujolais cru of Chénas is next door to Moulin à Vent. As this wine shows, it has the same firm structure and ripe fruit. The wine from the cru's chateau is dense, smoky and has plenty of firm tannins. It is a wine to age, so drink from 2019.",Gamay,89,20.0,Beaujolais,Chénas,,Roger Voss,@vossroger,Château de Chénas 2015  Chénas,Gamay,Château de Chénas,red,no
4439,France,"With no wood aging, the fruit speaks in this wine. However, it does have tannins and a stalky, young character, along with generous black-cherry fruit and a touch of spice. The wine needs to age a few months more, so drink from 2018.",Gamay,89,40.0,Beaujolais,Chénas,,Roger Voss,@vossroger,Florent Descombe 2015  Chénas,Gamay,Florent Descombe,red,no
4852,France,"This is a perfumed wine that is soft, full of red cherry fruit and gentle tannins. It does have a dry core that gives the wine shape and there is plenty of juicy fruitiness at the end. The wine is made for the Hospices, a charity in Lyon.",Domaine des Hospices Civils de Lyon,87,,Beaujolais,Beaujolais-Villages,,Roger Voss,@vossroger,Collin-Bourisset 2014 Domaine des Hospices Civils de Lyon  (Beaujolais-Villages),Gamay,Collin-Bourisset,red,no
5124,France,"Named after the medieval rulers of the village, this cru wine is firm and structured in the solid style of the appellation. It has rich black cherry and black-plum fruits that come with juicy acidity. At the same time, the tannins and the dry core promise considerable aging. Drink from 2019.",Les Capitans,92,25.0,Beaujolais,Juliénas,,Roger Voss,@vossroger,Trenel Fils 2015 Les Capitans  (Juliénas),Gamay,Trenel Fils,red,no
5130,France,"Owned by Beaune merchant Louis Jadot, this cru estate produces some impressive wines. While its alcohol is excessive for a Beaujolais, it wears its power well. The black plum fruit and tannins from wood aging that are still very present will soften over the next year to give a rich generous wine with a style that is Burgundian rather than traditional Beaujolais. Drink from 2018.",Côte du Py,92,43.0,Beaujolais,Morgon,,Roger Voss,@vossroger,Château des Jacques 2015 Côte du Py  (Morgon),Gamay,Château des Jacques,red,no
5132,France,"The northernmost of the Beaujolais cru villages can produce wines that are Burgundian in their structure. This wine fits that profile well with its dark tannins and rich concentration. Densely textured with both black-cherry fruit and a dry core, the wine is taking its time to develop. Drink from late 2017 or 2018.",Vieilles Vignes,92,25.0,Beaujolais,Saint-Amour,,Roger Voss,@vossroger,Domaine des Chers 2015 Vieilles Vignes  (Saint-Amour),Gamay,Domaine des Chers,red,no
5659,France,"Richly structured this wine, from well-exposed vines (hence the land of light in the name) is fruity with black cherry and some firm tannins. It is going to develop into a serious, complex wine. Drink from 2018.",Cuvée Terre de Lumière,90,24.0,Beaujolais,Moulin-à-Vent,,Roger Voss,@vossroger,Château de Chatelard 2015 Cuvée Terre de Lumière  (Moulin-à-Vent),Gamay,Château de Chatelard,red,no
5665,France,"From an small estate that also has vines in Chénas and Saint-Amour, this is a firmly tannic wine that also has attractive juicy red-berry fruits. The wine, still young, will repay aging allowing it to broaden out with rich fruit and a soft texture. Drink this cru from late 2017.",Domaine de Roche Noire,90,24.0,Beaujolais,Moulin-à-Vent,,Roger Voss,@vossroger,Georges Duboeuf 2015 Domaine de Roche Noire  (Moulin-à-Vent),Gamay,Georges Duboeuf,red,no
6179,France,"This Burgundian negociant take on Beaujolais is soft and ripe. Juicy red-berry fruits and supporting acidity receive a firm base of tannins. It is young, fruity and ready to drink from 2018.",Collection,87,22.0,Beaujolais,Saint-Amour,,Roger Voss,@vossroger,L. Tramier & Fils 2016 Collection  (Saint-Amour),Gamay,L. Tramier & Fils,red,no
6598,France,"Very fresh, crisp raspberry flavors are layered with acidity. This shows the bright red fruit character of 2007—light, fragrant, maybe finishing with some leanness.",Cuvée Tradition,86,,Beaujolais,Juliénas,,Roger Voss,@vossroger,Domaine du Clos du Fief 2007 Cuvée Tradition  (Juliénas),Gamay,Domaine du Clos du Fief,red,no
6600,France,"Soft and fruity, showing attractive ripe red cherry fruits along with hints of candy, light acidity and gentle tannins. It's a pleasing wine, easy and ready to drink, one of those Beaujolais that is best slightly chilled.",Gamay,86,,Beaujolais,Beaujolais-Villages,,Roger Voss,@vossroger,Georges Duboeuf 2007  Beaujolais-Villages,Gamay,Georges Duboeuf,red,no
