,country,description,designation,points,price,province,region_1,region_2,taster_name,taster_twitter_handle,title,variety,winery,type,sparkling
66235,France,"From the famous Morgon hillside of Côte de Py, this is a firm and structured wine. It shows the aging possibility of a Beaujolais, rich and full of firm tannins that come straight from the granite soil. The wine will develop well, packed with dark plum fruit that has a great shot of acidity. Drink from 2017.",Cuvée du Py,91,26.0,Beaujolais,Morgon,,Roger Voss,@vossroger,Château de Pizay 2013 Cuvée du Py  (Morgon),Gamay,Château de Pizay,red,no
66535,France,"Firm and rustic, this has red plum and berry flavors that mingle with a barnyard note. The tannins are forceful, so age it for another year.",La Réserve d'Amélie,85,17.0,Beaujolais,Moulin-à-Vent,,Roger Voss,@vossroger,Gérard Charvet 2011 La Réserve d'Amélie  (Moulin-à-Vent),Gamay,Gérard Charvet,red,no
66542,France,"For a wine meant to be consumed now, this is almost too tannic. It has bright fruit and a flavor of black currant skin, plus a dry, tannic core.",Nouveau,85,13.0,Beaujolais,Beaujolais-Villages,,Roger Voss,@vossroger,Albert Bichot 2012 Nouveau  (Beaujolais-Villages),Gamay,Albert Bichot,red,no
66554,France,"Light, juicy and fruity, this is classic Beaujolais. A red cherry flavor and a burst of acidity come with gentle tannins. Ready to drink.",Les Grands Eparcieux,85,20.0,Beaujolais,Beaujolais,,Roger Voss,@vossroger,Domaine Chasselay 2011 Les Grands Eparcieux  (Beaujolais),Gamay,Domaine Chasselay,red,no
66585,France,"With vineyards spread across the top sectors of the Fleurie cru, this wine is fruity and structured at the same time. It has a dry core that is surrounded by ripe berry fruits that also hint at black cherry. The wine needs time to soften, so drink from 2018.",Gamay,91,22.0,Beaujolais,Fleurie,,Roger Voss,@vossroger,Château de Fleurie 2015  Fleurie,Gamay,Château de Fleurie,red,no
66586,France,"This single vineyard wine comes from a steep parcel that is wedged between crus Fleurie and Moulin-à-Vent. It is deliciously packed with crisp cherry fruits and fine acidity. At the same time, it is structured, solid and with a core of tannins. It is a wine that will age for a while longer, so drink from late 2017.",Les Moriers,91,26.0,Beaujolais,Fleurie,,Roger Voss,@vossroger,Domaine Chignard 2015 Les Moriers  (Fleurie),Gamay,Domaine Chignard,red,no
66587,France,The Descombes family has farmed vines in this appellation since the French Revolution and Jean-Ernest Descombes supplied one of Georges Duboeuf's first Morgon wines in 1968. The latest generation has produced a ripe and fruity wine with a balanced structure. It is dense in tannins that will soften over the next year. Drink from 2018.,Jean-Ernest Descombes,91,22.0,Beaujolais,Morgon,,Roger Voss,@vossroger,Georges Duboeuf 2015 Jean-Ernest Descombes  (Morgon),Gamay,Georges Duboeuf,red,no
66699,France,"Made using fruit that was sourced from 100-year-old vines, this has a dark color, firm tannins and minerality, plus a solid black-plum flavor. This will age for several years.",Coeur de Vendanges,89,21.0,Beaujolais,Beaujolais,,Roger Voss,@vossroger,Domaine du Vissoux 2011 Coeur de Vendanges  (Beaujolais),Gamay,Domaine du Vissoux,red,no
66700,France,"Firmly tannic, this has has a dark plum flavor, layered with considerable density and dryness. With its juicy acidity and firm structure, this needs to age.",Vignes de 1935,89,17.0,Beaujolais,Morgon,,Roger Voss,@vossroger,Domaine Dupré 2011 Vignes de 1935  (Morgon),Gamay,Domaine Dupré,red,no
66706,France,"This is firm, concentrated and, as its name suggests, it's ready to pair with hearty fare. It has structure, followed by red cherry and blueberry fruits, and it's finished with acidity and a dry edge. Age for 3–4 years.",Hiver Gourmand,89,14.0,Beaujolais,Morgon,,Roger Voss,@vossroger,Vignerons de Bel Air 2011 Hiver Gourmand  (Morgon),Gamay,Vignerons de Bel Air,red,no
67114,France,"This is a romantic conjunction of names. The cru wine is silky and smooth, with integrated tannins and red-cherry fruit. It is bright and crisply textured, ready to drink from mid-2017.",Domaine du Paradis,88,22.0,Beaujolais,Saint-Amour,,Roger Voss,@vossroger,Georges Duboeuf 2015 Domaine du Paradis  (Saint-Amour),Gamay,Georges Duboeuf,red,no
67115,France,"This cru wine comes from a 44-acre vineyard with 50-year-old vines supplied by one of Duboeuf's regular growers. It is structured and dense, perhaps too dense with its heavy dry tannins. The wine will need time. Drink from 2019.",Domaine Mont Chavy,88,20.0,Beaujolais,Morgon,,Roger Voss,@vossroger,Georges Duboeuf 2015 Domaine Mont Chavy  (Morgon),Gamay,Georges Duboeuf,red,no
67116,France,"Full of crisp fruit, this cru wine is bright with red-berry flavors. It is light and with a cool character that comes from the high altitude of the vineyards. There is an edgy texture that keeps the wine together. Drink now.",Flower Label,88,20.0,Beaujolais,Chiroubles,,Roger Voss,@vossroger,Georges Duboeuf 2015 Flower Label  (Chiroubles),Gamay,Georges Duboeuf,red,no
67117,France,"A floral wine, full of ripe black-cherry fruit and with a firm structure that sustains the wine. This cru wine is rich, still developing, still with enough tannins and acidity to allow it to age further. Drink this attractive wine from mid-2017.",Flower Label,88,20.0,Beaujolais,Fleurie,,Roger Voss,@vossroger,Georges Duboeuf 2015 Flower Label  (Fleurie),Gamay,Georges Duboeuf,red,no
67131,France,This estate has been producing wine in Morgon since the 11th century. The wine comes from structured granite soil in a blend of different parcels. It has a strong mineral elements as well as layers of ripe black-cherry fruits. There is just a hint of banana that does spoil the full effect of the wine and hopefully will blow away as it ages. Drink from 2018.,Gamay,88,15.0,Beaujolais,Morgon,,Roger Voss,@vossroger,Château de Pizay 2015  Morgon,Gamay,Château de Pizay,red,no
67283,France,"A small wine region close to the city of Lyon, Coteaux du Lyonnais produces the wine for the city's bars. This is soft, rounded, a delicious cherry flavored wine. It has a light structure and attractive final acidity.",Fleurieux,85,18.0,Beaujolais,Coteaux du Lyonnais,,Roger Voss,@vossroger,Signé Vigneron 2011 Fleurieux  (Coteaux du Lyonnais),Gamay,Signé Vigneron,red,no
67284,France,"Ripe, rich and fruity, this is Gamay from old vines that give extra concentration. The wine is full of bitter cherries, tight acidity and a light texture. Drink now.",Vieilles Vignes,85,13.0,Burgundy,Coteaux Bourguignons,,Roger Voss,@vossroger,Signé Vigneron 2011 Vieilles Vignes  (Coteaux Bourguignons),Gamay,Signé Vigneron,red,no
67581,France,"The wine has firm, smoky tannins as well as ripe berry fruits and acidity. Put the elements together and it adds up to a satisfying, full wine with a good sense of structure and a medium-term future. Drink from the end of 2014.",Gamay,88,16.0,Beaujolais,Beaujolais-Villages,,Roger Voss,@vossroger,Domaine des Nugues 2013  Beaujolais-Villages,Gamay,Domaine des Nugues,red,no
67782,France,"Light and fruity, this has a red cherry flavor that's filled with refreshing acidity. The banana flavor from the fermentation is a little too prominent, but this is still a bright, ready-to-drink selection.",Cuvée Rochebonne,84,15.0,Beaujolais,Beaujolais,,Roger Voss,@vossroger,Trenel Fils 2011 Cuvée Rochebonne  (Beaujolais),Gamay,Trenel Fils,red,no
67805,France,"This is a light wine, and the fruit is dominated by acidity. It has a tart red-currant flavor, with a hint of banana.",Terre Noire Vieilles Vignes,83,12.0,Beaujolais,Beaujolais,,Roger Voss,@vossroger,Domaine Dupré 2011 Terre Noire Vieilles Vignes  (Beaujolais),Gamay,Domaine Dupré,red,no
68482,France,"From vineyards close to Juliénas, this is a bright wine full of cherry juice and fresh acidity. It does have a sense of structure with a background of tannins and minerality that will allow it to age, although it is delicious now.",Gamay,86,,Beaujolais,Beaujolais-Villages,,Roger Voss,@vossroger,Domaine des Mouilles 2014  Beaujolais-Villages,Gamay,Domaine des Mouilles,red,no
68485,France,"This structured wine has a great weight of fruit behind its firm tannins. Juicy acidity gives a delicious, fragrant and ripe character. Drink this wine from 2016.",Clos des 4 Vents La Madone,86,20.0,Beaujolais,Fleurie,,Roger Voss,@vossroger,Georges Duboeuf 2014 Clos des 4 Vents La Madone  (Fleurie),Gamay,Georges Duboeuf,red,no
68486,France,"This is a light and fresh wine with soft tannins and appealing red berry fruits. It offers attractive acidity at the end, a balanced wine that is ready to drink.",La Réserve d'Amélie,86,22.0,Beaujolais,Moulin-à-Vent,,Roger Voss,@vossroger,Gérard Charvet 2014 La Réserve d'Amélie  (Moulin-à-Vent),Gamay,Gérard Charvet,red,no
68497,France,"This broad, ripe wine has plenty of ripe red fruits but the minimum of structure. It is soft, generous and ready to drink. Much of the hand-picked production is from old vines on a 45-degree slope.",Gamay,86,12.0,Beaujolais,Beaujolais-Villages,,Roger Voss,@vossroger,Henry Fessy 2014  Beaujolais-Villages,Gamay,Henry Fessy,red,no
68500,France,"A subtle touch of tannin in this otherwise fruity wine gives a dry edge that contrasts with the bright red-berry fruits and refreshing acidity. Drink now, although this wine will be even better in 2016.",Automne Gourmand,86,14.0,Beaujolais,Beaujolais-Villages,,Roger Voss,@vossroger,Vignerons de Bel Air 2014 Automne Gourmand  (Beaujolais-Villages),Gamay,Vignerons de Bel Air,red,no
68625,France,"Production from 41 acres of land donated over more than a century to the Hospices of Lyon produces an attractive and aromatic wine. It is full of light, juicy fruit and fresh red cherries. Drink this refreshing wine now.",Gamay,85,,Beaujolais,Beaujolais-Villages,,Roger Voss,@vossroger,Domaine des Hospices Civils de Lyon 2014  Beaujolais-Villages,Gamay,Domaine des Hospices Civils de Lyon,red,no
68631,France,"For fruity, red-cherry-flavored Beaujolais, look no further. This Gamay wine has it all: soft tannins, intensely juicy red fruits and crisp, tangy acidity at the end. Drink now.",Gamay,85,16.0,Beaujolais,Beaujolais-Villages,,Roger Voss,@vossroger,Domaine Dupeuble Père et Fils 2014  Beaujolais-Villages,Gamay,Domaine Dupeuble Père et Fils,red,no
68634,France,"This wine has red-currant fruits, along with acidity and light tannins. The wine is crisp and fruity, maybe not expressing the full power of a Morgon but can be enjoyed now for its fruitiness.",Gamay,85,20.0,Beaujolais,Morgon,,Roger Voss,@vossroger,Georges Duboeuf 2014  Morgon,Gamay,Georges Duboeuf,red,no
68721,France,"Beautifully perfumed, this has swathes of ripe cherry and plum, with a hint of wood aging. The balance is already well established, with a line of crisp acidity that sits behind the rich, sweet fruit. With its tannins, this needs to age for at least three years.",Clos du Grand Carquelin,93,,Beaujolais,Moulin-à-Vent,,Roger Voss,@vossroger,Château des Jacques 2011 Clos du Grand Carquelin  (Moulin-à-Vent),Gamay,Château des Jacques,red,no
68747,France,"This is a generous, ripe wine, full of red fruits and soft acidity. It's already enjoyable, but will benefit from aging until 2015 to bring out the refreshing fruitiness even more.",Gamay,88,22.0,Beaujolais,Beaujolais-Villages,,Roger Voss,@vossroger,Château de Corcelles 2012  Beaujolais-Villages,Gamay,Château de Corcelles,red,no
68791,France,"In its traditional Beaujolais bottle, like the one-pint pot that was served in local restaurants, this is a soft and fruity wine. It has classic red-cherry fruits and light tannins. The aftertaste is juicy with just a hint of banana.",Gamay,86,20.0,Beaujolais,Brouilly,,Roger Voss,@vossroger,Château de Corcelles 2015  Brouilly,Gamay,Château de Corcelles,red,no
68792,France,"Planted around a 12th-century fortress, the vines of this estate have given a crisp wine with red-berry fruit. Along with its fruit, the wine has fine bright acidity and a core of dryer tannins. Like most cru wines from Beaujolais's biggest appellation, it is ready to drink now.",Gamay,86,20.0,Beaujolais,Brouilly,,Roger Voss,@vossroger,Château des Tours 2015  Brouilly,Gamay,Château des Tours,red,no
68793,France,"This nine-acre property has produced a fruity wine that has only the lightest tannins. It is much more to do with red cherries, red currants and crisp acidity. The wine is ready to drink.",Domaine de la Martingale,86,20.0,Beaujolais,Brouilly,,Roger Voss,@vossroger,Georges Duboeuf 2015 Domaine de la Martingale  (Brouilly),Gamay,Georges Duboeuf,red,no
68907,France,"This fresh, light and cherry-flavored wine has acidity, soft tannins and bright fruit. It's all about the crisp fruitiness, ready to drink now.",Les Originelles,86,21.0,Loire Valley,Côte Roannaise,,Roger Voss,@vossroger,Domaine Sérol 2014 Les Originelles Gamay (Côte Roannaise),Gamay,Domaine Sérol,red,no
68940,France,"With its high elevation, it is logical that Chiroubles produces some of the coolest Beaujolais cru wines. This is fruity with a tang of acidity and a mineral texture that is enhanced by a crisp character. The wine has light tannins and a final juicy finish.",Gamay,89,18.0,Beaujolais,Chiroubles,,Roger Voss,@vossroger,Domaine de la Combe au Loup 2015  Chiroubles,Gamay,Domaine de la Combe au Loup,red,no
68959,France,"A blend of wine that has been aged in tank and in wood, this is structured although with a great layer of juicy red fruits. The combination preserves the natural fruitiness of the wine while giving it the tannins to age. Drink from late 2017.",Rose,89,30.0,Beaujolais,Brouilly,,Roger Voss,@vossroger,Albert Bichot 2015 Roche Rose  (Brouilly),Gamay,Albert Bichot,rose,no
69351,France,"Sweet, strawberry jelly aromas lead to a wine that shows ripe, spiced and red plum flavors lifted by definite wood characters. The acidity is a constant right through this attractive wine.",Le Clé Saint-Pierre Oak Aged,86,14.0,Burgundy,Bourgogne,,Roger Voss,@vossroger,Mommessin 2007 Le Clé Saint-Pierre Oak Aged  (Bourgogne),Gamay,Mommessin,red,no
69487,France,"Firm tannins make this wine solid and dry. It has banana and bright cherry fruits well integrated with the acidity. The aftertaste suggests the wine could benefit from a few more months before drinking, so wait until 2017.",Gamay,85,15.0,Beaujolais,Beaujolais-Villages,,Roger Voss,@vossroger,Domaine Foretal 2015  Beaujolais-Villages,Gamay,Domaine Foretal,red,no
69488,France,"A brand created by Pierre Ferraud in 1986, this is a ripe wine. It has red-cherry fruit that is rich and full of piquant flavor. The acidity goes through the fruitiness bringing a fresh aftertaste of red berries. Drink now.",Cuvée des Montagnards,85,,Beaujolais,Beaujolais,,Roger Voss,@vossroger,Ferraud et Fils 2015 Cuvée des Montagnards  (Beaujolais),Gamay,Ferraud et Fils,red,no
69502,France,"Produced from vines around the hilltop village of Oingt (claimed to be the most beautiful in France), this has a soft texture, a banana flavor and light acidity. It is the sort of wine that will be better slightly chilled.",Terra Iconia,84,12.0,Beaujolais,Beaujolais,,Roger Voss,@vossroger,Vignerons des Pierres Dorées 2015 Terra Iconia  (Beaujolais),Gamay,Vignerons des Pierres Dorées,red,no
69503,France,"The wine has pure ripe cherry fruit and a soft texture laced with intense acidity. This is an immediately attractive wine, full of fruit grown on clay soil, and with a light tannic edge to give it shape.",Cuvée Rochebonne,84,17.0,Beaujolais,Beaujolais,,Roger Voss,@vossroger,Trenel Fils 2015 Cuvée Rochebonne  (Beaujolais),Gamay,Trenel Fils,red,no
69506,France,"Soft and fruity, this is a light wine that has tight acidity and crisp red-currant fruit. It is bright and fresh and ready to drink.",Domaine Pignard,84,,Beaujolais,Beaujolais,,Roger Voss,@vossroger,Jean-Claude Debeaune 2015 Domaine Pignard  (Beaujolais),Gamay,Jean-Claude Debeaune,red,no
69507,France,"The wine is tight and tannic. While it does have plenty of red-currant fruitiness, it is crisp, almost green in its acidity. It is very bright, almost shockingly fresh. Drink now.",Special Selection,84,,Beaujolais,Beaujolais-Villages,,Roger Voss,@vossroger,Jean-Claude Debeaune 2015 Special Selection  (Beaujolais-Villages),Gamay,Jean-Claude Debeaune,red,no
69653,France,"Boldly tannic, this structured, wood-aged wine is just starting out. It's as much dry wood and tannins as fruit at this stage, although the fruit and mineral texture do promise aging. There is significant acidity at the end. Drink from 2016.",Réserve Louis Leyre-Loup,89,32.0,Beaujolais,Morgon,,Roger Voss,@vossroger,Domaine de Leyre-Loup 2012 Réserve Louis Leyre-Loup  (Morgon),Gamay,Domaine de Leyre-Loup,red,no
69663,France,"This merchant house, with labels that carry a classic Frenchman's mustache, has made a soft rounded wine with attractive red-berry fruits. It is juicy and full of acidity that finishes the wine with a crisp aftertaste.",Gamay,86,10.0,Beaujolais,Beaujolais-Villages,,Roger Voss,@vossroger,Henry Fessy 2015  Beaujolais-Villages,Gamay,Henry Fessy,red,no
69674,France,"From organically grown grapes, this unfiltered wine is ripe with red-cherry flavors and freshened by acidity. It has a tang of tannin that adds a dry core to this attractive wine.",Les Grands Eparcieux,86,23.0,Beaujolais,Beaujolais,,Roger Voss,@vossroger,Domaine Chasselay 2015 Les Grands Eparcieux  (Beaujolais),Gamay,Domaine Chasselay,red,no
70072,France,"This richly structured wine has dark tannins as well as crisp red fruits and acidity. From old vines, it shows firmness and density. Another year will add elegance to the ripe texture. Drink from 2016.",Vieilles Vignes,89,22.0,Beaujolais,Côte de Brouilly,,Roger Voss,@vossroger,Domaine Régis Champier 2013 Vieilles Vignes  (Côte de Brouilly),Gamay,Domaine Régis Champier,red,no
70077,France,"This is a fruity wine, full of black cherries and plums. From the most northerly of the Beaujolais crus, it has style as well as weight and structure, although the fruitiness that dominates. It is ready to drink now.",Gamay,89,22.0,Beaujolais,Saint-Amour,,Roger Voss,@vossroger,Henry Fessy 2012  Saint-Amour,Gamay,Henry Fessy,red,no
70278,France,"Ripe and floral in character, this rich wine is full and fruity, with a good structure of tannins that brings out spiciness. With acidity and a generous texture, the wine could age for another six months, so drink from spring 2016.",Gamay,90,19.0,Beaujolais,Fleurie,,Roger Voss,@vossroger,Trenel Fils 2014  Fleurie,Gamay,Trenel Fils,red,no
70289,France,"This wine has structure and some dense tannins. Even though there is plenty of black and red cherry fruit, the wine's dry core and tight, mineral texture are still developing. Drink from 2017.",Domaine du Moulin-à-Vent,90,,Beaujolais,Moulin-à-Vent,,Roger Voss,@vossroger,Georges Duboeuf 2014 Domaine du Moulin-à-Vent  (Moulin-à-Vent),Gamay,Georges Duboeuf,red,no
70294,France,"Aged for 12 months in large wooden barrels, this is ripe and solid. It has a concentrated character, layered with some toastiness as well as rich berry and plum flavors. The fruit is well cut with spice and acidity. Drink from late 2016.",Les Sybarites,90,24.0,Beaujolais,Morgon,,Roger Voss,@vossroger,Château de Pizay 2014 Les Sybarites  (Morgon),Gamay,Château de Pizay,red,no
70295,France,"This wine is rich and full in the mouth, with swathes of ripe plum and cherry fruits. To balance that, a firm layer of tannins points up the ripe, juicy and rounded fruits of 100% Gamay. Drink this impressive wine now. It's produced by father and son, Michel and Sébastien Gutty, in Morgon.",Gamay,90,18.0,Beaujolais,Beaujolais-Villages,,Roger Voss,@vossroger,Château Gaillard 2014  Beaujolais-Villages,Gamay,Château Gaillard,red,no
70299,France,"This Jean Bererd wine comes from the village of Le Perreon in northern Beaujolais. It is a rich and fully structured wine with rich cherry fruits that are balanced with acidity. Hand-picked from an organic vineyard, the wine is ripe and full in the mouth. It should be drunk from 2016.",Le Perreon,90,19.0,Beaujolais,Beaujolais-Villages,,Roger Voss,@vossroger,Domaine de la Madone 2014 Le Perreon  (Beaujolais-Villages),Gamay,Domaine de la Madone,red,no
70300,France,"This “heart of the harvest” Gamay is produced from 100-year-old vines, a rarity in any appellation. With less than five acres to work with, this ripe and structured wine shows the potential even of “simple” Beaujolais-appellation wines. It has weight, spice and warm red fruits that are laced with acidity. Drink this wine from 2016.",Coeur de Vendanges,90,,Beaujolais,Beaujolais,,Roger Voss,@vossroger,Domaine du Vissoux 2014 Coeur de Vendanges  (Beaujolais),Gamay,Domaine du Vissoux,red,no
70301,France,"From vines planted in the Tour Bourdon plot in 1940, this concentrated wine is ripe and rich while still shot through with red-currant acidity. Its tannins come from the low-yielding vines, giving a firm edge. The aftertaste is all about fresher red fruits. Jean-Michel Dupré is a member of Terroirs Originels—17 producers on the hills of Beaujolais and Burgundy's Mâcon.",Vignes de 1940,90,17.0,Beaujolais,Beaujolais-Villages,,Roger Voss,@vossroger,Domaine Dupré 2014 Vignes de 1940  (Beaujolais-Villages),Gamay,Domaine Dupré,red,no
70715,France,"A bright and juicy wine from this often easygoing appellation. The red-cherry fruitiness and attractive acidity make for a wine that is rounded and ripe. It is ready to drink, crisp and fruity at the end.",Vieilles Vignes,87,22.0,Beaujolais,Brouilly,,Roger Voss,@vossroger,Les Frères Perroud 2015 Vieilles Vignes  (Brouilly),Gamay,Les Frères Perroud,red,no
70719,France,"This is a rich wine that is full of generous fruit. It has a smooth texture with its broad red-fruit character that is gently lifted by acidity. Ripe and with a soft texture, the wine is ready to drink.",Esprit de Séduction,87,24.0,Beaujolais,Saint-Amour,,Roger Voss,@vossroger,Pascal Berthier 2015 Esprit de Séduction  (Saint-Amour),Gamay,Pascal Berthier,red,no
71356,France,"Produced from old vines on the Chatelard estate, this wine is smooth, ripe and full of vibrant red fruits. There is a good balance between acidity and rich fruit with just a light core of tannins in the background. Drink now.",Cuvée les Vieilles Vignes,88,15.0,Beaujolais,Beaujolais-Villages,,Roger Voss,@vossroger,Château du Châtelard 2015 Cuvée les Vieilles Vignes  (Beaujolais-Villages),Gamay,Château du Châtelard,red,no
71362,France,"Based in Fleurie, this producer has made a wine rich in fruit and tannins. It has a smoky spicy character as well as intense red fruits. It is warm, concentrated and ready to drink.",Gamay,88,12.0,Beaujolais,Beaujolais-Villages,,Roger Voss,@vossroger,Domaine Berrod 2015  Beaujolais-Villages,Gamay,Domaine Berrod,red,no
71690,France,"The wine is full of acidity as well as bright raspberry and red currant fruits. It has a light, fresh feel that's given added weight by firmer fruit tannins and a concentrated dry aftertaste. Drink from 2016.",Gamay,86,14.0,Beaujolais,Beaujolais-Villages,,Roger Voss,@vossroger,Henry Fessy 2013  Beaujolais-Villages,Gamay,Henry Fessy,red,no
71704,France,"This is fresh and juicy, relishing its cherry and light spice flavors as well as its aromatic acidity. It's balanced, with some depth of flavor that gives weight to the fruitiness. Drink now.",Gamay,86,15.0,Beaujolais,Beaujolais-Villages,,Roger Voss,@vossroger,Château de Lacarelle 2013  Beaujolais-Villages,Gamay,Château de Lacarelle,red,no
72163,France,"It was inevitable that a producer would play on the name of the appellation Saint-Amour when naming his wine. Luckily, the wine itself is delicious and charming. With just the right tannic structure to sustain the berry fruits, it's rounded, ripe and fruity. That structure will allow it to age, but it is ready to drink now.",Esprit de Séduction,88,24.0,Beaujolais,Saint-Amour,,Roger Voss,@vossroger,Pascal Berthier 2013 Esprit de Séduction  (Saint-Amour),Gamay,Pascal Berthier,red,no
72173,France,"Ripe and round, this soft, juicy wine shows just a hint of a more serious tannic structure. It has plenty of acidity to go with its warm, red cherry flavors. Drink now, or better from 2015.",Domaine de la Conseillère,88,30.0,Beaujolais,Juliénas,,Roger Voss,@vossroger,Vincent 2012 Domaine de la Conseillère  (Juliénas),Gamay,Vincent,red,no
72190,France,"Tannins form a dark barrier to start this wine. It is still young, dense with chocolate as well as fruit flavors, showing the bitter, tough flavors that come from too much extraction. The fruit will hopefully come through and soften the tannins and bring out the richness. Drink from 2018.",Les Michelons,87,25.0,Beaujolais,Moulin-à-Vent,,Roger Voss,@vossroger,Yohan Lardy 2014 Les Michelons  (Moulin-à-Vent),Gamay,Yohan Lardy,red,no
72199,France,"With dry tannins, this 100% Gamay also has plenty of fruit that will give acidity and red-cherry flavors. For the next few months, it needs to soften and round out. Drink from 2016.",Cuvée de l'Ermitage,86,16.0,Beaujolais,Beaujolais-Villages,,Roger Voss,@vossroger,Pardon et Fils 2014 Cuvée de l'Ermitage  (Beaujolais-Villages),Gamay,Pardon et Fils,red,no
72214,France,"Ripe and jammy, this is a soft, rounded wine with rich berry fruits. The generous texture comes over more vividly than the acidity. The wine is fruity, ready to drink.",Gamay,86,18.0,Beaujolais,Brouilly,,Roger Voss,@vossroger,Château des Tours 2014  Brouilly,Gamay,Château des Tours,red,no
