,country,description,designation,points,price,province,region_1,region_2,taster_name,taster_twitter_handle,title,variety,winery,type,sparkling
91602,Portugal,"A medium-sweet wine, with a light prickle on tongue, very much in the style of some Vinho Verde, this is crisp, with lemon candy flavors and bright acidity. Drink now.",Azulejo,83,10.0,Lisboa,,,Roger Voss,@vossroger,Casa Santos Lima 2014 Azulejo White (Lisboa),Portuguese White,Casa Santos Lima,white,no
91635,Portugal,"This field blend of old white-grape vines—a rarity in the Douro—is rich in the bottle from a mélange of stainless steel, wood fermentation and barrel aging. It is smooth with concentration from the toast flavors and floral complexity. Its ripe character and generous texture make it a wine to drink now.",Pôpa Black Edition Branco,92,23.0,Douro,,,Roger Voss,@vossroger,Quinta do Pôpa 2015 Pôpa Black Edition Branco White (Douro),Portuguese White,Quinta do Pôpa,white,no
91656,Portugal,"This smooth, wood-aged wine is impressively ripe and stylish. Yellow fruit and pear flavors are spiced with nutmeg and toast from the wood, giving richness and a ripe character that are balanced by acidity. Drink this wine now.",Carvalhas Branco,91,30.0,Douro,,,Roger Voss,@vossroger,Quinta das Carvalhas 2015 Carvalhas Branco White (Douro),Portuguese White,Quinta das Carvalhas,white,no
91951,Portugal,"For a Vinho Verde, this is rich and full-bodied, showing delicious acidity, crisp apples and a touch of tropical fruit. There's the typical prickle on the tongue that brings out freshness, but in fact this wine could age for a year.",Grande Escolha,89,10.0,Vinho Verde,,,Roger Voss,@vossroger,Casa de Vilacetinho 2012 Grande Escolha White (Vinho Verde),Portuguese White,Casa de Vilacetinho,white,no
92110,Portugal,"This is a ripe, wood aged wine that has great structure as well as ample fruit flavor. It has a touch of toastiness—50% is aged in oak—although it is sophisticated and subtle. Apple, fresh apricot and green plum flavors show through the still young texture. All native grapes—35% Viosinho, 35% Rabigato and other locals from the estate—are the same used for Port blends. To bring out the richer, more rounded side of this wine, wait until 2017 to enjoy.",Reserva Branco,91,26.0,Douro,,,Roger Voss,@vossroger,Quinta de la Rosa 2014 Reserva Branco White (Douro),Portuguese White,Quinta de la Rosa,white,no
92133,Portugal,"With aromas of superripe fruit, this wood aged wine has a rich, toasty and lightly oxidized character, which in this case adds complexity. It is tangy and aromatic, with pear and citrus flavors that harmonize with the spicy wood accents. It is ready to drink.",Vinhas Velhas Branco,90,,Douro,,,Roger Voss,@vossroger,1912 Winemakers 2011 Vinhas Velhas Branco White (Douro),Portuguese White,1912 Winemakers,white,no
92332,Portugal,"Delicious and wood-aged , this is a cool wine from a hot place. With as much citrus as tropical fruits, it is crisp, fresh, cut with refreshing acidity that contrasts with the toast and minerality. The wine could be drunk now, although it will be better from 2016.",Branco,89,25.0,Douro,,,Roger Voss,@vossroger,Muxagat 2013 Branco White (Douro),Portuguese White,Muxagat,white,no
92356,Portugal,"As young as it comes, this spicy wine has melon and peppered pear flavors. Its fruit is right up front, almost too much at this stage. It needs to calm down a little, so it will be better drunk from 2018.",Portuguese White,84,,Douro,,,Roger Voss,@vossroger,Quinta da Rede 2016 White (Douro),Portuguese White,Quinta da Rede,white,no
92368,Portugal,"This is a deliciously aromatic wine, bursting with bright fruits, acidity, all held together with a soft texture. The wine is easy to drink and ready now.",Espirito Lagoalva Sauvignon-Arinto,84,12.0,Tejo,,,Roger Voss,@vossroger,Quinta da Lagoalva de Cima 2016 Espirito Lagoalva Sauvignon-Arinto White (Tejo),Portuguese White,Quinta da Lagoalva de Cima,white,no
92369,Portugal,This blend of the local white grapes has been given a herbal twist with Sauvignon Blanc. It is fruity and still young with its lively acidity and crisp texture. Drink from the end of 2017.,Lagoalva Talhão 1,84,12.0,Tejo,,,Roger Voss,@vossroger,Quinta da Lagoalva de Cima 2016 Lagoalva Talhão 1 White (Tejo),Portuguese White,Quinta da Lagoalva de Cima,white,no
92375,Portugal,"A soft, fruity wine made from Fernão Pires and Arinto grapes. It has the lightest fruit, gently crisp acidity and a final burst of citrus. Drink now.",Bridão Classico Branco,84,,Tejo,,,Roger Voss,@vossroger,Adega Cooperativa do Cartaxo 2015 Bridão Classico Branco White (Tejo),Portuguese White,Adega Cooperativa do Cartaxo,white,no
92605,Portugal,"This wine is bright, fragrant and fruity, with a clean green-fruit and citrus character that's lively and attractive.",Marquês de Borba Branco,86,15.0,Alentejo,,,Roger Voss,@vossroger,J. Portugal Ramos 2011 Marquês de Borba Branco White (Alentejo),Portuguese White,J. Portugal Ramos,white,no
92658,Portugal,"This is a densely textured wine. It has a strong sense of minerality, while also having a fruitier side. Ripe acidity and a crisp citrus flavor are allied to the warmer apple and green-plum fruits. Drink this wine from late 2017.",Alvarinho-Trajadura Grande Escolha,88,17.0,Vinho Verde,,,Roger Voss,@vossroger,Quinta da Raza 2016 Alvarinho-Trajadura Grande Escolha White (Vinho Verde),Portuguese White,Quinta da Raza,white,no
92659,Portugal,"This is an impressively complex Vinho Verde, obviously made for food. With its tangy acidity and tense mineral texture, this blend of a range of the regional grapes is structured and with a delicious, refreshing aftertaste. Drink now.",Portuguese White,88,12.0,Vinho Verde,,,Roger Voss,@vossroger,Casa do Valle 2016 White (Vinho Verde),Portuguese White,Casa do Valle,white,no
92660,Portugal,"A smooth and ripe blend of Viosinho, Rabigato and Gouvelo, the wine has attractive, smooth apple and pear flavors as well as tangy acidity. With its light touch of acidity at the end, the wine is delicious and ready to drink.",Encostas do Douro,88,9.0,Douro,,,Roger Voss,@vossroger,Caves Velhas 2016 Encostas do Douro White (Douro),Portuguese White,Caves Velhas,white,no
92670,Portugal,"It is probably the small soupçon of Moscatel in the blend that gives this wine its irresistible perfumed character. That just brings out the fine acidity and the crisp citrus flavors. It is a refreshing wine, as aromatic at the end as at the beginning. Drink now.",Tons de Duorum,88,10.0,Douro,,,Roger Voss,@vossroger,Duorum 2016 Tons de Duorum White (Douro),Portuguese White,Duorum,white,no
92749,Portugal,"A short time in oak has done this wine no end of good. It has given it a lightly toasty character, a spicy character and a good depth of fruit flavor. It is rich and will be better from 2018.",Reserva Branco,88,15.0,Douro,,,Roger Voss,@vossroger,Quinta da Rede 2016 Reserva Branco White (Douro),Portuguese White,Quinta da Rede,white,no
92864,Portugal,"A touch of wood goes well with the ripe fruit. It is full in the mouth, rich and needing to age another few months. Yellow fruits and a ripe texture give an imposing presence. Drink from the end of 2014.",Reserva Branco,90,13.0,Douro,,,Roger Voss,@vossroger,Quinta de Porrais 2011 Reserva Branco White (Douro),Portuguese White,Quinta de Porrais,white,no
93185,Portugal,"Produced from the Boavista vineyard at the base of Casa Santos Lima, this wine comes from old vines. It is a serious, complex and structured wine that will develop well over many years. Dark fruits, dense tannins and really fresh acidity are integrated into a fine wine. Drink this impressive wine from 2019.",Reserva,89,,Lisboa,,,Roger Voss,@vossroger,Casa Santos Lima 2013 Reserva White (Lisboa),Portuguese White,Casa Santos Lima,white,no
93345,Portugal,"A blend of Fernão Pires and Moscatel, this is fresh, crisp and perfumed. It's an apéritif-like wine, with light acidity and a creamy, smooth texture.",Portal da Aguia,87,10.0,Tejo,,,Roger Voss,@vossroger,Quinta da Alorna 2011 Portal da Aguia White (Tejo),Portuguese White,Quinta da Alorna,white,no
93420,Portugal,"Very New World in its ripe, tropical fruit flavors, rounded toasty element, and impressive concentration. Yet the elegance also remains, finishing with spice and light acidity, adding shape to this rich wine.",Private Selection Reserva,90,22.0,Alentejo,,,Roger Voss,@vossroger,Herdade do Esporão 2006 Private Selection Reserva White (Alentejo),Portuguese White,Herdade do Esporão,white,no
93465,Portugal,"A deliciously fresh wine, the bright acidity coming from green fruit and peaches. A creamy character adds a sense of roundness, but there is a crisp, taut aftertaste.",Reserva Branco,87,,Douro,,,Roger Voss,@vossroger,Kopke 2010 Reserva Branco White (Douro),Portuguese White,Kopke,white,no
93494,Portugal,"This dry Vinho Verde shows great crisp, green apple and grapefruit flavors, a deliciously fresh wine, with green edges and lively flavors. Great summer drink.",Portuguese White,88,8.0,Vinho Verde,,,Roger Voss,@vossroger,Casa de Vila Verde 2006 White (Vinho Verde),Portuguese White,Casa de Vila Verde,white,no
93561,Portugal,This blend encourages the richness of the Chardonnay and the crispness of the Arinto. Wood-aging smoothes things out and brings a touch of ginger as well as toast. The wine is full on the mouth and still young. Drink from 2017.,Reserva Branco,90,22.0,Lisboa,,,Roger Voss,@vossroger,Quinta de Chocapalha 2013 Reserva Branco White (Lisboa),Portuguese White,Quinta de Chocapalha,white,no
94069,Portugal,"A soft, rounded melon and pear flavored wine. Very fruity, it is rich, smooth and ready to drink.",Monte da Cal Branco,86,,Alentejano,,,Roger Voss,@vossroger,Dão Sul 2010 Monte da Cal Branco White (Alentejano),Portuguese White,Dão Sul,white,no
94103,Portugal,"This single vineyard Vinho Verde is complex and powerful. The texture is creamy, rich, with hints of pineapple as well as grapefruit. There is an edgy texture, balanced with the crispest final acidity.",Quinta de Simaens,88,13.0,Vinho Verde,,,Roger Voss,@vossroger,Borges 2009 Quinta de Simaens White (Vinho Verde),Portuguese White,Borges,white,no
94173,Portugal,"A soft style of Vinho Verde that is open and rounded. There is, of course, plenty of crisp citrus fruits, but these are accompanied by riper yellow fruits and a gentle texture. Ready to drink. Screwcap.",Portuguese White,85,,Vinho Licoroso,,,Roger Voss,@vossroger,Vera 2012 White (Vinho Licoroso),Portuguese White,Vera,white,no
94197,Portugal,"This is an intensely fruity wine that is lemon scented, crisp and very fresh. It has a strong citrus flavor, with touches of orange zest and red apples. Not for aging, this light, bright wine is ready to drink now.",Companhia das Lezírias Catapereiro Branco,85,12.0,Tejo,,,Roger Voss,@vossroger,Wines & Winemakers 2012 Companhia das Lezírias Catapereiro Branco White (Tejo),Portuguese White,Wines & Winemakers,white,no
94198,Portugal,"This is a light, fresh and crisply fruity wine. It is dominated by lime and ripe lemon flavors that come from the bright blend of Fernão Pires and Arinto. Not a wine for aging, so drink now.",Samora Branco,85,13.0,Tejo,,,Roger Voss,@vossroger,Wines & Winemakers 2012 Samora Branco White (Tejo),Portuguese White,Wines & Winemakers,white,no
94489,Portugal,"This is heavily wood dominated. Toast and juice come from wood as much as fruit at this stage. Behind this, generous yellow fruits and a ripe, full-bodied character will lead to a ripe and complex wine. It needs aging, so don't drink before 2016.",Lua Cheia em Vinhas Velhas Secretum,90,,Douro,,,Roger Voss,@vossroger,Wines & Winemakers 2012 Lua Cheia em Vinhas Velhas Secretum White (Douro),Portuguese White,Wines & Winemakers,white,no
94491,Portugal,"An opulently ripe, wood-aged wine that's both fruity and textured. It has weight, richness, a lightly mineral texture with crisp apple and green plum flavors. Give this attractive while serious wine until the end of 2014.",Malhadinha Branco,90,35.0,Alentejano,,,Roger Voss,@vossroger,Herdade da Malhadinha Nova 2012 Malhadinha Branco White (Alentejano),Portuguese White,Herdade da Malhadinha Nova,white,no
94651,Portugal,"This is an orange wine, fermented in open tanks. Flavors of oranges and dried fruits are shot through with acidity. The wine has a tight texture as well as spice and hints of its wood aging. Drink from 2017.",Herdade São Miguel Art. Terra Curtimenta,87,22.0,Alentejano,,,Roger Voss,@vossroger,Casa Agricola Alexandre Relvas 2015 Herdade São Miguel Art. Terra Curtimenta White (Alentejano),Portuguese White,Casa Agricola Alexandre Relvas,white,no
94677,Portugal,"An attractively perfumed wine, it is lively with bright acidity, yello fruits and crisp citrus. Drink now.",EA Branco,86,9.0,Alentejano,,,Roger Voss,@vossroger,Cartuxa 2015 EA Branco White (Alentejano),Portuguese White,Cartuxa,white,no
94815,Portugal,"Attractive, clean and fruity, this has pear and peach flavors; its aromatic intensity comes from the 30% Viognier in the blend. This is smooth, with just a bite of citrusy acidity on the finish. Screwcap.",Periquita Branco,87,,Setubal,,,Roger Voss,@vossroger,José Maria da Fonseca 2011 Periquita Branco White (Setubal),Portuguese White,José Maria da Fonseca,white,no
94877,Portugal,"The blend of Chardonnay and Fernão Pires gives this wine an attractive, textured character. It is full of ripe and creamy yellow fruit and citrus, with a streak of crisp acidity. Drink now.",Tagus Creek Branco,87,9.0,Tejo,,,Roger Voss,@vossroger,Falua 2014 Tagus Creek Branco White (Tejo),Portuguese White,Falua,white,no
94904,Portugal,"This wine is crisp in lemon acidity while also having a strong, tight mineral texture. Produced from Arinto and Antão Vaz, it has bright grapefruit and apple flavors, with hints of exotic apricot and pineapple. Drink now.",Portuguese White,87,22.0,Península de Setúbal,,,Roger Voss,@vossroger,Herdade da Comporta 2014 White (Península de Setúbal),Portuguese White,Herdade da Comporta,white,no
94930,Portugal,"This fragrant wine is a an unusual blend of Riesling, Gewürztraminer and Malvasia. That combination of northern and southern Europe works to give a crisp wine that is also intensely perfumed as well as full of acidity. It is an attractive wine that is already drinkable.",Reserva,88,24.0,Trás-os-Montes,,,Roger Voss,@vossroger,Valle Pradinhos 2016 Reserva White (Trás-os-Montes),Portuguese White,Valle Pradinhos,white,no
94939,Portugal,"The estate around the former royal palace of Carmo is in the heart of Alentejo. Its white wine is a easygoing blend of Roupeiro, Antão Vaz and Arinto, giving ripeness, yellow and white-fruit flavors and a vibrant bright aftertaste. Drink now.",Quinta do Carmo,88,9.0,Alentejano,,,Roger Voss,@vossroger,Bacalhôa Wines of Portugal 2016 Quinta do Carmo White (Alentejano),Portuguese White,Bacalhôa Wines of Portugal,white,no
94958,Portugal,"Light and fruity, the wine has a smooth edge that is cut with acidity. It is an immediately accessible wine with a lzesty lemon finish.",Coreto Branco,85,9.0,Lisboa,,,Roger Voss,@vossroger,DFJ Vinhos 2015 Coreto Branco White (Lisboa),Portuguese White,DFJ Vinhos,white,no
94985,Portugal,"From a 50-year-old vineyard, this blend of mostly Douro white grapes has serious wood-aged aromas, layers of toast and spice along with lightly oxidized white-stone fruits. The wine is ripe, full in the mouth and ready to drink.",Guru,88,45.0,Douro,,,Roger Voss,@vossroger,Wine & Soul 2014 Guru White (Douro),Portuguese White,Wine & Soul,white,no
95035,Portugal,"A lightly wood-aged wine, this is floral and spicy. With its pear and citrus flavors, soft texture and fine mature fruit, it is nicely balanced and ready to drink.",Padre Pedro Reserva Branco Viognier-Arinto,89,25.0,Tejo,,,Roger Voss,@vossroger,Casa Cadaval 2014 Padre Pedro Reserva Branco Viognier-Arinto White (Tejo),Portuguese White,Casa Cadaval,white,no
95294,Portugal,This enjoyable blend of wood-aged Chardonnay and Fernão Pires is rich; the two grapes together lend a smooth and creamy wine.,Hobby,88,,Tejo,,,Roger Voss,@vossroger,Exquisite Wines 2010 Hobby White (Tejo),Portuguese White,Exquisite Wines,white,no
95493,Portugal,"Dominated by Alvarinho, this is a spicy, fruity and tangy wine. It is still young with a tight mineral edge that will soften to bring out a more creamy character. The after-taste, with its fresh citrus, should remain. Drink from 2017.",Alvarinho-Trajadura Grande Escolha,89,16.0,Vinho Verde,,,Roger Voss,@vossroger,Quinta da Raza 2015 Alvarinho-Trajadura Grande Escolha White (Vinho Verde),Portuguese White,Quinta da Raza,white,no
95601,Portugal,"This pretty, warm wine is touched with caramel and yellow fruit flavors. It gets a kick from crisp lemon zest. Drink in the coming months.",Lello Branco,84,8.0,Douro,,,Roger Voss,@vossroger,Borges 2011 Lello Branco White (Douro),Portuguese White,Borges,white,no
95855,Portugal,"The aromas are attractively fresh, while the palate is more towards full, fat fruits. So the green perfume gives way to melon and pear only just touched by citrus acidity. Treat this as a food wine, not an apèritif. This wine was formerly sold under the Cockburn Port brand.",Tuella,84,13.0,Douro,,,Roger Voss,@vossroger,Symington Family Estates 2007 Tuella White (Douro),Portuguese White,Symington Family Estates,white,no
95867,Portugal,"A full, round wine that tastes of the hot, dry climate of the Alentejo, with its ripe fruits, light structure and low acidity. It is a wine for food, its simple textures a great accompaniment to spicy dishes.",Marquès de Borba Branco,84,14.0,Alentejo,,,Roger Voss,@vossroger,J. Portugal Ramos 2007 Marquès de Borba Branco White (Alentejo),Portuguese White,J. Portugal Ramos,white,no
95905,Portugal,"Attractive oily, fruity and fresh wine, mineral with green plum flavors touched with lemon. For drinking now to preserve its bright, ripe character.",Branco,87,11.0,Douro,,,Roger Voss,@vossroger,Castello d'Alba 2009 Branco White (Douro),Portuguese White,Castello d'Alba,white,no
95939,Portugal,"This is a tight, tangy wine that has been rounded out by some wood aging (35%). Crisp apples and grapefruit flavors are lifted by tight acidity and a zesty aftertaste. Drink now.",Selection Branco,87,12.0,Tejo,,,Roger Voss,@vossroger,Encosta do Sobral 2014 Selection Branco White (Tejo),Portuguese White,Encosta do Sobral,white,no
96346,Portugal,"These two great grape varieties make interesting partners. The rich Alvarinho with its apples and cream character balances the perfumed, spicy Viognier to give a harmonious whole. It is a delicious wine, ready to drink.",Reserva Alvarinho-Viognier,90,13.0,Tejo,,,Roger Voss,@vossroger,Quinta da Alorna 2015 Reserva Alvarinho-Viognier White (Tejo),Portuguese White,Quinta da Alorna,white,no
96516,Portugal,This is classic Vinho Verde from the Quinta das Arcas estate. It balances crispness with light sweetness and sparkle. Acidity and an apple-skin texture give it a dancing quality. Screwcap.,Branco,86,11.0,Vinho Verde,,,Roger Voss,@vossroger,Conde Villar 2011 Branco White (Vinho Verde),Portuguese White,Conde Villar,white,no
96826,Portugal,"With its light prickle on the tongue and mineral texture, this is a crisp, dry wine. It is floral with pineapple and bright apple flavors. The acidity and the tangy orange zest all add to the freshness of the wine. Drink now.",Portuguese White,86,12.0,Vinho Verde,,,Roger Voss,@vossroger,Vila Nova 2015 White (Vinho Verde),Portuguese White,Vila Nova,white,no
96846,Portugal,"The 50% Malvasia in the blend gives this wine its perfumed character. It is ripe, touched by honey and spice. The wine has a fine, fresh streak at the end. Drink now.",Cascas Winemaker Selection,85,10.0,Douro,,,Roger Voss,@vossroger,Casca Wines 2015 Cascas Winemaker Selection White (Douro),Portuguese White,Casca Wines,white,no
96912,Portugal,"Lemon, spice and pepper flavors are the keys to this easy, accessible wine. It is full of fresh fruit that has bitter almond and ripe pear flavors. With acidity and a crisp aftertaste, the wine is ripe and ready to drink.",Dona Ermelinda,87,10.0,Palmela,,,Roger Voss,@vossroger,Casa Ermelinda Freitas 2014 Dona Ermelinda White (Palmela),Portuguese White,Casa Ermelinda Freitas,white,no
97105,Portugal,"This is a blend of Encruzado, Malvasia and Bical (more commonly found in the coastal vineyards west of the Dão). Smooth and creamy textured, it offers a perfumed mix of mangos and crisp mandarin zest. Drink this wine from late 2017.",Ribeiro Santo Pinha,88,13.0,Dão,,,Roger Voss,@vossroger,Magnum Vinhos 2016 Ribeiro Santo Pinha White (Dão),Portuguese White,Magnum Vinhos,white,no
97294,Portugal,"A wine that is all about crispness, with its green apple slices, pink grapefruit and lime flavors. The sweet acidity gives it shape.",Portada,84,9.0,Estremadura,,,Roger Voss,@vossroger,DFJ Vinhos 2007 Portada White (Estremadura),Portuguese White,DFJ Vinhos,white,no
97352,Portugal,"A light, bright and breezy wine with an attractive citrus character and tight acidity. Great for an apéritif or with shellfish.",Monte Velho Branco,85,10.0,Alentejano,,,Roger Voss,@vossroger,Herdade do Esporão 2010 Monte Velho Branco White (Alentejano),Portuguese White,Herdade do Esporão,white,no
97396,Portugal,"Floral and fresh, this deliciously fragrant wine bursts with apricots and pineapple as well as lemon zest. Crisp and just plain attractive, it can be drunk now.",Conde de Vimioso Colheita Selectionada,87,9.0,Tejo,,,Roger Voss,@vossroger,Falua 2013 Conde de Vimioso Colheita Selectionada White (Tejo),Portuguese White,Falua,white,no
97398,Portugal,"A ripe straw-colored wine, it has a good freshness and attractive green acidity. There is a hint of vanilla as well as apple and pear fruits. It's fruity and ready to drink.",Monte da Peceguina,87,15.0,Alentejano,,,Roger Voss,@vossroger,Herdade da Malhadinha Nova 2012 Monte da Peceguina White (Alentejano),Portuguese White,Herdade da Malhadinha Nova,white,no
97399,Portugal,"Ripe and rich, it's full of tropical fruit, pineapple and mango flavors. Fresh acidity balances the full fruitiness. The aftertaste brings out a more mineral character.",Ciconia Branco,87,10.0,Alentejano,,,Roger Voss,@vossroger,Herdade de São Miguel 2013 Ciconia Branco White (Alentejano),Portuguese White,Herdade de São Miguel,white,no
97514,Portugal,"This estate is right in the south of the Vinho Verde. That gives the wine extra weight, with added richness from the Avesso grape. The aftertaste brings in crispness.",Avesso,88,12.0,Vinho Verde,,,Roger Voss,@vossroger,Solar de Pinheiro 2009 Avesso White (Vinho Verde),Portuguese White,Solar de Pinheiro,white,no
97592,Portugal,"A smooth, creamy wine that is Burgundian in style, with its judicious use of wood and great structure. The fruits—lemon, yellow and green plum—are beautifully balanced with the tension of the minerality. This wine will develop more complexity with age; drink from 2015.",Pó de Poeira,92,,Douro,,,Roger Voss,@vossroger,Poeira 2011 Pó de Poeira White (Douro),Portuguese White,Poeira,white,no
97890,Portugal,"The lightest feeling wine, attractive in its acidity, its slight sweetness and its creamed apple flavor. A perfect summer apéritif.",Portuguese White,85,10.0,Vinho Verde,,,Roger Voss,@vossroger,Broadbent 2010 White (Vinho Verde),Portuguese White,Broadbent,white,no
97899,Portugal,"Light and fragrant, a perfumed wine, with flavors of almond and refreshing acidity. It feels warm, with pear and lime flavors combining well.",Branco,85,8.0,Alenquer,,,Roger Voss,@vossroger,Quinta do Carneiro 2009 Branco White (Alenquer),Portuguese White,Quinta do Carneiro,white,no
97937,Portugal,"A success in the sweeter Vinho Verde category. There is pleasant softness, flavors of green berries, grapefruit with sugar and freshness.",Santola,84,6.0,Vinho Verde,,,Roger Voss,@vossroger,Messias 2006 Santola White (Vinho Verde),Portuguese White,Messias,white,no
97985,Portugal,"With 50% of Arinto in the blend, this is rounder and richer in taste than many Vinhos Verdes. It does also have a crisp edge that comes from the citrus tang. The general effect is bright while full in the mouth from the delicious fruit. Drink now.",Raza Escolha,86,11.0,Vinho Verde,,,Roger Voss,@vossroger,Quinta da Raza 2016 Raza Escolha White (Vinho Verde),Portuguese White,Quinta da Raza,white,no
98248,Portugal,"Grown at 1,800 feet, the vines for this wine benefit from the cool conditions needed to develop aromatic intensity. With crisp acidity combined with spiced pear and nutmeg flavors, it's both tightly textured and very fruity. Drink now.",Superior,88,15.0,Douro,,,Roger Voss,@vossroger,Colinas do Douro 2015 Superior White (Douro),Portuguese White,Colinas do Douro,white,no
98254,Portugal,"Fermentation on the grape skins has given this wine a pale gold color. The result is a smooth, oxidative wine with a lightly tannic structure, dominated by apple and citrus fruit. Ready to drink.",Branco de Curtimenta,88,17.0,Alentejo,,,Roger Voss,@vossroger,Roquevale 2015 Branco de Curtimenta White (Alentejo),Portuguese White,Roquevale,white,no
98314,Portugal,"A classic fruity blend of local Dão grapes including Encruzado and Malvasia, this is a perfumed, ripe wine that is full of pear, melon and citrus flavors. Its tangy texture suggests minerality. Drink now.",Casa Américo,88,,Dão,,,Roger Voss,@vossroger,Seacampo 2014 Casa Américo White (Dão),Portuguese White,Seacampo,white,no
98349,Portugal,"This is a particularly successful white Monte Velho. It is rich and creamy, full of ripe apple and refreshing acidity in equal measure. Fruity and fragrant, it is ready to drink and will be delicious this summer.",Monte Velho Branco,85,10.0,Alentejano,,,Roger Voss,@vossroger,Herdade do Esporão 2011 Monte Velho Branco White (Alentejano),Portuguese White,Herdade do Esporão,white,no
