,country,description,designation,points,price,province,region_1,region_2,taster_name,taster_twitter_handle,title,variety,winery,type,sparkling
61261,Portugal,"Lemon flavored, this light and fruity wine has a hint of minerality, followed by a crisp, fresh aftertaste. It's ready to drink.",Santa Valha Branco,85,,Trás-os-Montes,,,Roger Voss,@vossroger,Quinta do Sobreiró de Cima 2012 Santa Valha Branco White (Trás-os-Montes),Portuguese White,Quinta do Sobreiró de Cima,white,no
61347,Portugal,"An off-dry, crisp and very fruity wine that has a light lilt of freshness. The wine is just sparkling, giving an attractive burst of apple and citrus at the end.",Mateus,83,,Portuguese Table Wine,,,Roger Voss,@vossroger,Sogrape NV Mateus White (Portuguese Table Wine),Portuguese White,Sogrape,white,no
61392,Portugal,This wood-aged wine is rich and smooth with light toast blending with the yellow fruit and spice. Acidity gives the wine its freshness contrasting with the complex fruit and wood balance. Drink this fine wine from 2017.,Quinta do Mondego Branco,91,20.0,Dão,,,Roger Voss,@vossroger,Fontes da Cunha 2015 Quinta do Mondego Branco White (Dão),Portuguese White,Fontes da Cunha,white,no
61419,Portugal,A sweet wine that has a candy shop confected taste. It does have acidity along with a touch of citrus although the sherbet aftertaste is off-putting.,Ela Branco,83,9.0,Vinho Verde,,,Roger Voss,@vossroger,Adega Cooperativa Ponte de Barca 2013 Ela Branco White (Vinho Verde),Portuguese White,Adega Cooperativa Ponte de Barca,white,no
61431,Portugal,"Smooth Chardonnay-like richness gives concentration to this magnificent ripe wine. The wood aging shows through the fruit, ending on toast, spice and green herbs.",Branco Reserva,90,50.0,Douro,,,Roger Voss,@vossroger,Quinta do Vallado 2009 Branco Reserva White (Douro),Portuguese White,Quinta do Vallado,white,no
61527,Portugal,The wood aging of this wine has given a lightly oxidized character. It is rich and creamy with toasty acidity as well as yellow fruits. Drink now.,Dalva Reserva Branco,86,7.0,Douro,,,Roger Voss,@vossroger,C. da Silva 2011 Dalva Reserva Branco White (Douro),Portuguese White,C. da Silva,white,no
61530,Portugal,"This blend of Sauvignon Blanc and Fernão Pires is aromatic and ripe. Its fruitiness is tropical, with pineapple as well as apricot flavors. It's softly textured  and ready to drink.",Companhia das Lezírias Catapereiro Escolha Branco,86,15.0,Tejo,,,Roger Voss,@vossroger,Wines & Winemakers 2012 Companhia das Lezírias Catapereiro Escolha Branco White (Tejo),Portuguese White,Wines & Winemakers,white,no
61532,Portugal,"Attractively fruity, this is a crisp, citrus and green plum flavored wine. The tight texture gives a fresh character that also has some minerality. Lively and bright at the end.",Portal da Aguia,86,10.0,Tejo,,,Roger Voss,@vossroger,Quinta da Alorna 2013 Portal da Aguia White (Tejo),Portuguese White,Quinta da Alorna,white,no
61734,Portugal,"Named for the Servite convent in the town of Borba, this fresh, crisp and tangy wine is citric, with almond and apple overtones. It's young, fruity and made for immediate consumption.",Convento da Vila Branco,85,7.0,Alentejano,,,Roger Voss,@vossroger,Adega Cooperativa de Borba 2015 Convento da Vila Branco White (Alentejano),Portuguese White,Adega Cooperativa de Borba,white,no
61738,Portugal,"Lightly spritzy, this tastes of crisp apple and finishes just off-dry. It's deliciously refreshing, bright and tangy. Drink now.",Miranda,85,9.0,Vinho Verde,,,Roger Voss,@vossroger,Caves Campelo 2015 Miranda White (Vinho Verde),Portuguese White,Caves Campelo,white,no
61751,Portugal,"With its typical prickle on the tongue, this is a medium sweet wine. It's clean, crisp and citrusy, with sliced apple and orange zest flavors. Drink now.",Campelo,85,10.0,Vinho Verde,,,Roger Voss,@vossroger,Caves Campelo 2015 Campelo White (Vinho Verde),Portuguese White,Caves Campelo,white,no
61779,Portugal,"Crisp and herbaceous, this is a green-fruited wine that's light on the palate, offering delightful refreshing acidity. This is very fruity and ready to drink.",Clemens Reserva,84,,Vinho Verde,,,Roger Voss,@vossroger,Wines & Winemakers 2011 Clemens Reserva White (Vinho Verde),Portuguese White,Wines & Winemakers,white,no
61780,Portugal,"The light prickle adds to the natural freshness of this lemon-sherbet-flavored wine. Very crisp and light in the mouth, this dances on the palate with just a touch of sweetness.",Salsus,84,,Vinho Verde,,,Roger Voss,@vossroger,Wines & Winemakers 2011 Salsus White (Vinho Verde),Portuguese White,Wines & Winemakers,white,no
61907,Portugal,"A warm wine, open, broad and soft with just some mineral texture. Flavors are of quince, sweet white plums, with some final green, herbal character.",Passadouro Branco,86,,Douro,,,Roger Voss,@vossroger,Quinta do Passadouro 2008 Passadouro Branco White (Douro),Portuguese White,Quinta do Passadouro,white,no
62173,Portugal,"A blend of Alvarinho and Trajadura, this combines a creamy texture with bright green fruit acidity. There is weight as well as freshness, the aftertaste rich while also crisp.",Varanda do Conde,90,,Vinho Verde,,,Roger Voss,@vossroger,Provam 2009 Varanda do Conde White (Vinho Verde),Portuguese White,Provam,white,no
62178,Portugal,"Now in a smart clear blue bottle, this is Aveleda's estate wine. It is always a classic, with just some extra weight to give it distinction. The flavors are apple, brightened with lime, finishing with vibrant acidity.",Quinta da Aveleda,90,9.0,Vinho Verde,,,Roger Voss,@vossroger,Aveleda 2009 Quinta da Aveleda White (Vinho Verde),Portuguese White,Aveleda,white,no
62481,Portugal,"This is floral and aromatic, bearing soft, ripe yellow fruit, attractive acidity and a soft, rounded texture. A shaft of citric acidity cuts through the palate, making the wine feel lively and refreshing.",Caiado,86,,Alentejano,,,Roger Voss,@vossroger,Adega Mayor 2011 Caiado White (Alentejano),Portuguese White,Adega Mayor,white,no
62597,Portugal,"A blend of Arinto and Antão Vaz, this is refreshingly fruity. It has pineapple as well as citrus flavors, an attractive blend of freshness and crispness. The aftertaste is bright, full of lively acidity.",Maria Mora Branco,86,10.0,Alentejano,,,Roger Voss,@vossroger,Magnum Vinhos 2014 Maria Mora Branco White (Alentejano),Portuguese White,Magnum Vinhos,white,no
62600,Portugal,"The wine is soft and smooth with yellow fruits and a light texture. It is ripe, generous balancing fruit against the rounded perfumed structure. The wine is ready to drink.",Coroa d'Ouro Branco,86,12.0,Douro,,,Roger Voss,@vossroger,Poças 2014 Coroa d'Ouro Branco White (Douro),Portuguese White,Poças,white,no
62638,Portugal,"The wood fermentation has just brushed the ripe notes of this wine, rounding out the young, fresh fruitiness. It's a full wine with pear, citrus and a tangy, mineral texture. Drink from 2016.",Reserva,88,18.0,Douro,,,Roger Voss,@vossroger,Quinta da Rede 2013 Reserva White (Douro),Portuguese White,Quinta da Rede,white,no
62689,Portugal,"With a typical touch of fizz, this wine is fruity, light and bright. It is dry, very fresh, full of apples and lime juice. Refreshing and ready to drink.",Portuguese White,85,17.0,Vinho Verde,,,Roger Voss,@vossroger,Quinta do Cruzeiro 2012 White (Vinho Verde),Portuguese White,Quinta do Cruzeiro,white,no
62699,Portugal,"Light and bright, this is a totally approachable wine, crisp and lemon scented. With a lively texture, it dances out of the glass, a wine to drink now.",Rufo Branco,85,,Douro,,,Roger Voss,@vossroger,Lemos & Van Zeller 2012 Rufo Branco White (Douro),Portuguese White,Lemos & Van Zeller,white,no
62713,Portugal,"Ripe and perfumed, this has great fruitiness and crisp acidity that suit the delicate texture. The wine is completely ready to drink.",Seleção do Enólogo,87,10.0,Dão,,,Roger Voss,@vossroger,Pedra Cancela 2013 Seleção do Enólogo White (Dão),Portuguese White,Pedra Cancela,white,no
62714,Portugal,"This is aromatic and, yes, exuberant in its bright fruitiness and total freshness. It's crisp with a cool character that is expressed in the layers of citrus that dominate the wine. At the end, a tangy texture offers a tight aftertaste.",Edição Exuberant,87,18.0,Minho,,,Roger Voss,@vossroger,Quinta da Calçada 2013 Edição Exuberant White (Minho),Portuguese White,Quinta da Calçada,white,no
62866,Portugal,"A pear-and pineapple-flavored wine, lifted with bright fresh acidity. There is a smooth texture that comes from ripe fruit. Drink now to enjoy its crispness.",Branco,86,,Alentejano,,,Roger Voss,@vossroger,Casa de Santa Vitoria 2010 Branco White (Alentejano),Portuguese White,Casa de Santa Vitoria,white,no
62969,Portugal,"Named after a local landmark, this is rich for a Vinho Verde, a soft blend of Alvarinho and Trajadura that brings out white fruits as well as a more citrus character. It's very aromatic, fruity and worth keeping a few months.",Torre de Menagem,88,12.0,Vinho Verde,,,Roger Voss,@vossroger,Quintas de Melgaço 2012 Torre de Menagem White (Vinho Verde),Portuguese White,Quintas de Melgaço,white,no
63015,Portugal,"The Moscatel in this blend gives an attractive floral perfumed character that balances the crisper Fernão Pires. It is a fruity, light-hearted apéritif-style wine that is ready to drink.",JP Azeitão Branco,85,11.0,Península de Setúbal,,,Roger Voss,@vossroger,Bacalhôa Wines of Portugal 2013 JP Azeitão Branco White (Península de Setúbal),Portuguese White,Bacalhôa Wines of Portugal,white,no
63020,Portugal,"Deliciously crisp and fruity, this is a bright, clean style of wine not showing much terroir character but is fresh and full of citrus fruits. The acidity gives a refreshing lift at the end.",Contraste Branco,85,19.0,Douro,,,Roger Voss,@vossroger,Conceito Vinhos 2013 Contraste Branco White (Douro),Portuguese White,Conceito Vinhos,white,no
63554,Portugal,"Vineyards in the upper Douro Superior region are able to produce surprisingly fresh and fruity whites like this, despite the heat and dry climate. Old vines go into this yellow and green fruit flavored wine with its lively acidity and totally refreshing palate. Drink from summer 2016.",Contraste Branco,90,19.0,Douro,,,Roger Voss,@vossroger,Conceito Vinhos 2014 Contraste Branco White (Douro),Portuguese White,Conceito Vinhos,white,no
63604,Portugal,The wine is soft and lightly textured. It has fruit with ripe apricot and white peach flavors that are lifted by the bright citrus aftertaste. The wine is ready to drink.,Portuguese White,86,20.0,Alentejano,,,Roger Voss,@vossroger,Herdade do Rocim 2014 White (Alentejano),Portuguese White,Herdade do Rocim,white,no
63650,Portugal,"An easy focus on fruit and flavor is the key to this ripe wine that is full of creamy apple and peach flavors. It is crisp, with plenty of acidity and a delicious, fruity aftertaste. Drink now.",Branco Colheita,88,25.0,Alentejo,,,Roger Voss,@vossroger,Cartuxa 2015 Branco Colheita White (Alentejo),Portuguese White,Cartuxa,white,no
63867,Portugal,"This is a very crisp wine dominated by herbaceous notes and intense acidity. It is bright and lively, hinting at spice and toast and tantalizingly fresh on the finish.",Colheita Seleccionada,87,10.0,Alentejano,,,Roger Voss,@vossroger,Herdade de São Miguel 2010 Colheita Seleccionada White (Alentejano),Portuguese White,Herdade de São Miguel,white,no
63898,Portugal,"This is a ripe perfumed wine based on Verdelho and Arinto. The blend, which also includes some Antão Vaz, creates a rich character full of juicy apricot and melon fruit shot through with lime zest. It is a refreshing wine to drink now.",Santos da Casa Branco,88,15.0,Alentejano,,,Roger Voss,@vossroger,Santos & Seixo 2015 Santos da Casa Branco White (Alentejano),Portuguese White,Santos & Seixo,white,no
63901,Portugal,"Grapes grown at high altitude give the cool feel to this crisp wine. A light touch of oak is revealed in the vanilla flavor that is finely integrated into the citrus and apple fruit. The wine is fruity, ready to drink young.",Churchill's Estates Branco,88,18.0,Douro,,,Roger Voss,@vossroger,Churchill's 2015 Churchill's Estates Branco White (Douro),Portuguese White,Churchill's,white,no
63902,Portugal,"The wine is soft and ripe. With delicious yellow fruits, a soft texture and just enough lively acidity, it is rich and fruity. There is an attractive orange zing at the end.",Branco,88,15.0,Douro,,,Roger Voss,@vossroger,Colinas do Douro 2014 Branco White (Douro),Portuguese White,Colinas do Douro,white,no
63962,Portugal,"A rounded wine, this gives pleasure with its pear and ripe apple flavors. Lightly touched with acidity, this has a soft finish.",Point West,84,9.0,Lisboa,,,Roger Voss,@vossroger,DFJ Vinhos 2011 Point West White (Lisboa),Portuguese White,DFJ Vinhos,white,no
64168,Portugal,"Produced from Aveleda's Quinta da Aguieira, this is a blend of typical Portuguese white grapes with a dash of Chardonnay. From old vines, it has concentration and a rich texture that is cut by fragrant acidity. There is a ripe feel to this impressive wine, generous and full of fruit. Drink now.",Reserva da Familia,92,20.0,Bairrada,,,Roger Voss,@vossroger,Aveleda 2014 Reserva da Familia White (Bairrada),Portuguese White,Aveleda,white,no
64313,Portugal,"Round and smooth, this has a weighty, full-bodied structure, with the Alvarinho adding a more crisp character. Pear and melon fruits are balanced by citrusy acidity.",DFJ Alvarinho-Chardonnay,90,10.0,Lisboa,,,Roger Voss,@vossroger,DFJ Vinhos 2011 DFJ Alvarinho-Chardonnay White (Lisboa),Portuguese White,DFJ Vinhos,white,no
64517,Portugal,"Round and soft, this features white fruit flavors filled out by a touch of smokiness and light acidity. It's gentle, dry and full bodied. Screwcap.",Tagus Creek Chardonnay and Fernão Pires,85,,Tejo,,,Roger Voss,@vossroger,Falua 2011 Tagus Creek Chardonnay and Fernão Pires White (Tejo),Portuguese White,Falua,white,no
64524,Portugal,"Bright and fruity, this has a ripe applesauce flavor that's cut with citrusy acidity. It's a great apéritif, with a soft texture and refreshing finish.",Alandra Branco,85,8.0,Alentejano,,,Roger Voss,@vossroger,Herdade do Esporão 2011 Alandra Branco White (Alentejano),Portuguese White,Herdade do Esporão,white,no
64591,Portugal,"Fresh and crisp, classic dry Vinho Verde, a blend of Alvarinho and Trajadura, with citrus flavors and a tight texture. Lively and fresh.",AT,86,,Vinho Verde,,,Roger Voss,@vossroger,Borges 2009 AT White (Vinho Verde),Portuguese White,Borges,white,no
64597,Portugal,"A medium-dry Vinho Verde, this is light and fresh without being quite crisp enough. Well chilled, though, it makes a lively and fresh apéritif.",Aliança,85,7.0,Vinho Verde,,,Roger Voss,@vossroger,Caves Aliança 2009 Aliança White (Vinho Verde),Portuguese White,Caves Aliança,white,no
64642,Portugal,"It takes a while for the taste of this light, fresh white to come through. Then, it is soft, creamy textured, flavored with pear juice and lemon zest. It is simple, easy, cleanly made.",Portada Branco,84,8.0,Estremadura,,,Roger Voss,@vossroger,DFJ Vinhos 2008 Portada Branco White (Estremadura),Portuguese White,DFJ Vinhos,white,no
64648,Portugal,"A soft wine, creamy and ripe. The flavors are open, with white fruits, green plums, a baked apple character. There is acidity, but with the gentle, ripe fruit, this blends in easily. For early drinking.",Meia Encosta,84,8.0,Dão,,,Roger Voss,@vossroger,Borges 2008 Meia Encosta White (Dão),Portuguese White,Borges,white,no
64686,Portugal,"Pure fruit flavors are fresh, but still show the ripeness of 2009. This is a fruity, ready-to-drink wine that has citrus, green plums and fresh acidity.",Branco,87,19.0,Douro,,,Roger Voss,@vossroger,Maritávora 2009 Branco White (Douro),Portuguese White,Maritávora,white,no
64710,Portugal,"Blending Encruzado and Malvasia Fina, this lightly wood-aged wine is rich, stylish and full of young fruit flavors. Green plums, apricots and a squeeze of lemon all give their bright character to the palate. There is a firm, mineral texture that promises some aging; drink from 2017.",Ribeiro Santo,89,12.0,Dão,,,Roger Voss,@vossroger,Magnum Vinhos 2014 Ribeiro Santo White (Dão),Portuguese White,Magnum Vinhos,white,no
64906,Portugal,"This is a blend of Alvarinho and Trajadura, a lively, fruity wine that has just a hint of a prickle on the tongue. It has apple and grapefruit flavors that are fresh and deliciously crisp. The wine is ready to drink.",Torre de Menagem Escolha,88,12.0,Vinho Verde,,,Roger Voss,@vossroger,Quintas de Melgaço 2015 Torre de Menagem Escolha White (Vinho Verde),Portuguese White,Quintas de Melgaço,white,no
64916,Portugal,"A ripe, tropical fruit flavored wine that is both fresh and rich. While produced in an area of Vinho Verde that is predominately dedicated to the Alvarinho grape, this dry wine is a refreshing, bright blend of many of the local varieties. It is juicy, crisp and ready to drink.",Muros Antigos Escolha,88,17.0,Vinho Verde,,,Roger Voss,@vossroger,Anselmo Mendes 2015 Muros Antigos Escolha White (Vinho Verde),Portuguese White,Anselmo Mendes,white,no
64959,Portugal,This fresh wine shows fruit tones balanced by a light mineral note. It is bright with acidity and grapefruit flavors alongside a crisp aftertaste. Drink now.,Miranda,85,10.0,Vinho Verde,,,Roger Voss,@vossroger,Campelo 2014 Miranda White (Vinho Verde),Portuguese White,Campelo,white,no
64960,Portugal,This is an unusual white made from red Touriga Nacional and white Tamarez. Bright lemon flavors are balanced by notes of apricot and richer fruit tones. Drink now.,Tamarez,85,13.0,Tejo,,,Roger Voss,@vossroger,Quinta da Lapa 2012 Tamarez White (Tejo),Portuguese White,Quinta da Lapa,white,no
64961,Portugal,"This is a bright lemon and grapefruit flavored wine that has lively acidity and the lightest touch of mineral texture. It's crisp, refreshing and will be ready to drink from mid-2016.",Duas Quintas Branco,85,12.0,Douro,,,Roger Voss,@vossroger,Ramos-Pinto 2014 Duas Quintas Branco White (Douro),Portuguese White,Ramos-Pinto,white,no
64974,Portugal,"This is an attractive, ready-to-drink wine, a blend of Arinto and Fernão Pires. Bright and fruity with plenty of citrus freshness, it is lightly crisp and fresh at the end.",Portuguese White,85,8.0,Tejo,,,Roger Voss,@vossroger,Quinta da Alorna 2014 White (Tejo),Portuguese White,Quinta da Alorna,white,no
64981,Portugal,This is a soft ripe wine that has yellow fruits alongside crisper red apples and touches of grapefruit. That makes for a balanced light wine that has a fine texture and a fresh aftertaste. Drink now.,Monta da Baía Branco,85,12.0,Península de Setúbal,,,Roger Voss,@vossroger,Wines & Winemakers 2014 Monta da Baía Branco White (Península de Setúbal),Portuguese White,Wines & Winemakers,white,no
65158,Portugal,"Produced in the Lima Valley, in the heart of the Vinho Verde region, this is fruity and crisp. It is medium sweet in character, the sweetness balanced by the refreshing acidity and citrus flavors. Drink now.",Alto Lima,85,10.0,Vinho Verde,,,Roger Voss,@vossroger,Viniverde 2015 Alto Lima White (Vinho Verde),Portuguese White,Viniverde,white,no
65162,Portugal,"Soft and warm, this is an apricot and pear-flavored wine. It has a soft texture, with a ripe feel that is just lifted by acidity. The aftertaste, with a more citrus character, adds the freshness.",Roupeiro-Antão Vaz,85,8.0,Alentejo,,,Roger Voss,@vossroger,Adega Cooperativa de Borba 2015 Roupeiro-Antão Vaz White (Alentejo),Portuguese White,Adega Cooperativa de Borba,white,no
65163,Portugal,"This is an attractive, lemon and lime-flavored wine. Riper yellow fruits also show through the crisp acidity and the lightly mineral texture. The wine is ready to drink.",Bridão Classico Branco,85,7.0,Tejo,,,Roger Voss,@vossroger,Adega Cooperativa do Cartaxo 2015 Bridão Classico Branco White (Tejo),Portuguese White,Adega Cooperativa do Cartaxo,white,no
65164,Portugal,This blend of the white Trincadeira das Pratas and Arinto is soft and perfumed. It has some ripe acidity and an open texture. The aftertaste brings in some attractive melon flavor. Drink now.,Selection,85,8.0,Tejo,,,Roger Voss,@vossroger,Quinta da Lapa 2015 Selection White (Tejo),Portuguese White,Quinta da Lapa,white,no
65277,Portugal,"This ripe wine is smooth and rounded. Its melon and pear flavors give a generous, fruity character. Clean and crisp at the end, finished with acidity, it is ready to drink.",Castello d'Alba Colheita Branco,86,10.0,Douro,,,Roger Voss,@vossroger,Rui Roboredo Madeira 2015 Castello d'Alba Colheita Branco White (Douro),Portuguese White,Rui Roboredo Madeira,white,no
65306,Portugal,"This ultrayoung wine is all fruit. It is textured with minerality and a chalky character that is keeping the fresh green fruits in balance. The wine is delicious, although really not ready. Better to wait until 2016.",Companhia das Lezírias Tyto Alba Vinhas Protegidas,88,20.0,Tejo,,,Roger Voss,@vossroger,Wines & Winemakers 2014 Companhia das Lezírias Tyto Alba Vinhas Protegidas White (Tejo),Portuguese White,Wines & Winemakers,white,no
65307,Portugal,"This wine reflects the fresh, cool character of Lisboa, with its ocean influence. A tangy, steely edge brings out a mineral character to top up the crisp citrus and apple fruitiness. The wine needs until 2016.",Dory Colheita Branco,88,13.0,Lisboa,,,Roger Voss,@vossroger,Adega Mãe 2013 Dory Colheita Branco White (Lisboa),Portuguese White,Adega Mãe,white,no
65549,Portugal,"With Encruzado and Malvasia in the blend, it is no surprise this wine is deliciously perfumed. It has fresh acidity as well as ripe apple and pear flavors. The wine is fruity, crisp and ready to drink.",Cabriz Colheita Seleccionada Branco,85,10.0,Dão,,,Roger Voss,@vossroger,Dão Sul 2014 Cabriz Colheita Seleccionada Branco White (Dão),Portuguese White,Dão Sul,white,no
65555,Portugal,"Young and fruity, this is a smooth, lightly textured wine. It has just enough acidity to give a fresh edge to the ripe quince and Rocha pear flavors. Drink now.",Branco,85,19.0,Alentejano,,,Roger Voss,@vossroger,Fitapreta Vinhos 2014 Branco White (Alentejano),Portuguese White,Fitapreta Vinhos,white,no
65557,Portugal,"Soft and fresh, with ripe yellow fruits, this is an immediately attractive wine. It has acidity a bright fruitiness from the blend of Antão Vaz and Arinto. The finish is crisp and tangy.",Fonte da Serrana Branco,85,,Alentejano,,,Roger Voss,@vossroger,Monte da Ravasqueira 2014 Fonte da Serrana Branco White (Alentejano),Portuguese White,Monte da Ravasqueira,white,no
65558,Portugal,"With Viognier and Sémillon in the blend, this has the potential to be a ripe, smoothly textured wine. Acidity acts as a contrast and gives a tight lemon edge. The wine is still young, with its full fruitiness suppressed. Drink from 2016.",Portuguese White,85,,Alentejano,,,Roger Voss,@vossroger,Monte da Ravasqueira 2014 White (Alentejano),Portuguese White,Monte da Ravasqueira,white,no
65561,Portugal,"With the classic tongue-tickle of young Vinho Verde, this fresh, crisp and off-dry wine is immediately drinkable. It has ripe orange and sweet citrus fruitiness, and plenty of acidity.",Vera Branco,85,12.0,Vinho Verde,,,Roger Voss,@vossroger,Obrigado 2014 Vera Branco White (Vinho Verde),Portuguese White,Obrigado,white,no
65562,Portugal,"This juicy wine boasts lemon aromas and bright citrusy acidity, resulting in a light, crisp and bright sip. It has a frest lilt, with an attractive zesty texture. Drink now.",Oscar's Branco,85,12.0,Douro,,,Roger Voss,@vossroger,Quevedo 2014 Oscar's Branco White (Douro),Portuguese White,Quevedo,white,no
65563,Portugal,"Aromas of white flowers lead into crisp lemon and grapefruit flavors. This has a fresh tang from the light prickle on the tongue, along with ripe peach and apple skin flavors. Drink now.",Colheita,85,10.0,Vinho Verde,,,Roger Voss,@vossroger,Quinta da Lixa 2014 Colheita White (Vinho Verde),Portuguese White,Quinta da Lixa,white,no
65568,Portugal,"The blend of Fernão Pires and Arinto gives a fruity, fresh and fragrant wine, with lively bright acidity. A lemon edge is filled out by ripe apricot flavor, resulting in a rounded finish. Drink from 2016.",Companhia das Lezirias Samora Branco,85,11.0,Tejo,,,Roger Voss,@vossroger,Wines & Winemakers 2014 Companhia das Lezirias Samora Branco White (Tejo),Portuguese White,Wines & Winemakers,white,no
65575,Portugal,"Here's a bright, slightly sparkling wine, with fresh acidity and an off-dry, fruity character. It has attractive lemon-lime flavors and a salty, mineral aftertaste. Drink now.",Portuguese White,85,,Vinho Verde,,,Roger Voss,@vossroger,Casa de Vila Verde 2014 White (Vinho Verde),Portuguese White,Casa de Vila Verde,white,no
66030,Portugal,"With its big, fat mouthfeel, but very little fruit to back it up, at this stage this wine seems to be about wood, spice and richness without balance. The Reserva from the property seems to have a better focus.",Condessa de Santar,85,32.0,Dão,,,Roger Voss,@vossroger,Casa de Santar 2005 Condessa de Santar White (Dão),Portuguese White,Casa de Santar,white,no
66481,Portugal,"This is a ripe wine that includes Chardonnay and Viognier in its blend. It has yellow fruits that are cut with plenty of acidity. A cool, crisp element reminds that the vineyards are close to the ocean. The wine is ready to drink.",Palha-Canas Branco,86,10.0,Lisboa,,,Roger Voss,@vossroger,Casa Santos Lima 2014 Palha-Canas Branco White (Lisboa),Portuguese White,Casa Santos Lima,white,no
66627,Portugal,"Pineapple and mango dominate this full-bodied, ripe wine. Soft and given a lift by lime juice, it is a well-balanced blend of Arinto and Fernão Pires. The aftertaste is fresh and fruity.",Portuguese White,86,8.0,Tejo,,,Roger Voss,@vossroger,Quinta da Alorna 2013 White (Tejo),Portuguese White,Quinta da Alorna,white,no
