,country,description,designation,points,price,province,region_1,region_2,taster_name,taster_twitter_handle,title,variety,winery,type,sparkling
149,US,"Smashed blackberry and blueberry fruit are enhanced by burned caramel, heavy slate and touches of soy and smoke on the nose. There's great depth in both body and flavors once sipped, with a layer of fine-grained tannins revealing teriyaki, black plum, boysenberry and touches of lavender.",Destruction Level,91,35.0,California,Monterey,Central Coast,Matt Kettmann,@mattkettmann,Wrath 2013 Destruction Level Red (Monterey),Rhône-style Red Blend,Wrath,red,no
209,France,"Intriguing, thought provoking and complex, this wine starts off with perfumed aromas of thyme, bay leaf and lavender. It's supple in the mouth and silky in feel, imbued with black cherry and blueberry fruit, then shows a hint of adhesive bandage on the finish. Drink now.",Rhône-style Red Blend,90,16.0,Rhône Valley,Côtes du Rhône,,Joe Czerwinski,@JoeCz,Domaine St Pierre 2014 Red (Côtes du Rhône),Rhône-style Red Blend,Domaine St Pierre,red,no
211,France,"This is taut and sinewy in profile, but shows off a fine range of aromas, from thyme and lavender to cocoa, red plum and ripe cherry. The raspberry and herb flavors finish in a storm of firm tannins. Drink 2020–2025.",Les Christins,90,32.0,Rhône Valley,Vacqueyras,,Joe Czerwinski,@JoeCz,Famille Perrin 2013 Les Christins Red (Vacqueyras),Rhône-style Red Blend,Famille Perrin,red,no
214,US,"This is a big, brawny expression of Grenache, Mourvèdre, Syrah and Counoise, the Grenache playing the dominant role in the blend. It coats the palate in dense raspberry and blueberry fruit, seasoned with pepper and nutmeg. A leathery touch to the texture and lifted acidity keeps it from feeling heavy or overdone.",Verah,90,36.0,California,Dry Creek Valley,Sonoma,Virginie Boone,@vboone,Mounts 2014 Verah Red (Dry Creek Valley),Rhône-style Red Blend,Mounts,red,no
485,France,"Bulky and rugged but sound, with some drying tannins on the finish. It compensates by offering attractive flavors of black cherries, black olives and hints of asphalt and garrigue. Try it with hearty braises or stews.",Rhône-style Red Blend,87,13.0,Rhône Valley,Côtes du Rhône Villages,,Joe Czerwinski,@JoeCz,Louis Bernard 2009 Red (Côtes du Rhône Villages),Rhône-style Red Blend,Louis Bernard,red,no
504,France,"A simple but attractive Côtes du Rhône, with impressively pure cherry-berry fruit, medium body and a slightly chunky feel. Drink it over the next couple of years.",Réserve Grand Veneur,87,15.0,Rhône Valley,Côtes du Rhône,,Joe Czerwinski,@JoeCz,Alain Jaume et Fils 2009 Réserve Grand Veneur Red (Côtes du Rhône),Rhône-style Red Blend,Alain Jaume et Fils,red,no
594,France,"This medium-bodied blend of 50% Grenache and 50% Syrah is simple but satisfying. Ripe cherries and raspberries carry the load, dressed up by hints of vanilla and cinnamon. A soft dustiness marks the texture, turning silky on the finish. Drink now–2020.",La Decelle,89,20.0,Rhône Valley,,,Joe Czerwinski,@JoeCz,Lavau 2015 La Decelle Red,Rhône-style Red Blend,Lavau,red,no
657,South Africa,"The 2011 Night Sky shows more earthy character than the 2012, as upfront aromas of soil, blackberry leaf and pepper are grounded by ripe fruit tones of black currant, plum and mulberry. Medium weight on the palate, with velvety tannins that grip through the long, spicy finish. The dense, tight mouthfeel, firm structure and overall balance suggest this wine will age well through 2022.",Night Sky,92,50.0,Coastal Region,,,Lauren Buzzeo,@laurbuzz,Fable Mountain 2011 Night Sky Red (Coastal Region),Rhône-style Red Blend,Fable Mountain,red,no
886,France,"This Grenache-heavy blend (with 20% Syrah) offers a good amount of bittersweet cocoa powder and rich jammy black berries and all-fruit preserves on the nose and mouth. A hint of gaminess adds interest to the bouquet, while the crushed velvet texture and firm tannins transition into a long finish laced with earthy spice.",La Mère Grand,90,25.0,Languedoc-Roussillon,Minervois,,Lauren Buzzeo,@laurbuzz,Loup Blanc 2007 La Mère Grand Red (Minervois),Rhône-style Red Blend,Loup Blanc,red,no
1014,US,"This blend from a newer Westside Paso winery offers blackberry, charred pine and sour cherry aromas. The palate is driven by pine sap, charred game and sharp herbs such as oregano and rosemary, and would be a great way to spice up a steak dinner.",Forty Two,88,42.0,California,Paso Robles,Central Coast,Matt Kettmann,@mattkettmann,Brecon Estate 2012 Forty Two Red (Paso Robles),Rhône-style Red Blend,Brecon Estate,red,no
1108,US,"Distinct crushed lava rock aromas meet with dust, cinnamon, cola and Dr Pepper on this blend of 28% Syrah, 22% Grenache, 17% Cinsault, 17% Mourvèdre and 16% Carignane. Light red fruits of cranberry and slight strawberry show on the palate that dives into serious tannins quickly.",Le Cigare Volant,90,38.0,California,Central Coast,Central Coast,Matt Kettmann,@mattkettmann,Bonny Doon 2010 Le Cigare Volant Red (Central Coast),Rhône-style Red Blend,Bonny Doon,red,no
1112,France,"Dense almost to the point of chewiness, this is a concentrated blend of Syrah, Carignan and Grenache. Earthy, plummy notes pick up hints of dark chocolate and licorice before ending rich and velvety.",Les Cimels,90,17.0,Rhône Valley,Costières de Nîmes,,Joe Czerwinski,@JoeCz,Château d'Or et de Gueules 2010 Les Cimels Red (Costières de Nîmes),Rhône-style Red Blend,Château d'Or et de Gueules,red,no
1343,US,"Damp chaparral, dried blueberry, beef and pencil lead scents show on the nose of this blend of 54% Grenache, 35% Syrah and 11% Mourvèdre. Rounded blueberry and black plum flavors meet loamy soil, anise, thyme and marjoram spice, with a savory touch of smoke.",Rendition,90,38.0,California,Paso Robles,Central Coast,Matt Kettmann,@mattkettmann,Écluse 2014 Rendition Red (Paso Robles),Rhône-style Red Blend,Écluse,red,no
1414,France,"Big, full bodied and concentrated, this is a ripe, rich wine. Ripe plum flavors are balanced with nervy acidity and dense tannins. This is a wine that will still need to age, so don't drink before 2017.",Rhône-style Red Blend,93,,Provence,Bandol,,Roger Voss,@vossroger,Domaine de l'Hermitage 2010 Red (Bandol),Rhône-style Red Blend,Domaine de l'Hermitage,red,no
1433,France,"Structured and firm, this is a tight wine with powerful, youthful acidity as well as a dense structure and dark tannins. It has weight as well, indicating a wine with excellent aging potential. Drink from 2016.",Rhône-style Red Blend,92,40.0,Provence,Bandol,,Roger Voss,@vossroger,Château Salettes 2011 Red (Bandol),Rhône-style Red Blend,Château Salettes,red,no
1437,France,"Dense and structured, this is a wine with good potential. It has weight, concentrated tannins and ripe fruit, as well as a solid, full-bodied feel. The palate is marked with power, a fine mineral texture and great acidity on the finish. Drink from 2017.",Rhône-style Red Blend,92,,Provence,Bandol,,Roger Voss,@vossroger,Domaine de Val d'Arenc 2011 Red (Bandol),Rhône-style Red Blend,Domaine de Val d'Arenc,red,no
1443,US,"Dark and thick in the glass, this blend of 82% Syrah and 18% Mourvèdre leads with black cherry syrup, smoked beef and dark chocolate aromas, which blossom as the wine opens. Rich and lavish on the palate, it has fine tannins that frame its blueberry, cassis and mocha flavors. It's firmly structured, with a lingering acidity.",Authenticity,94,75.0,California,Paso Robles,Central Coast,Matt Kettmann,@mattkettmann,Epoch Estate Wines 2013 Authenticity Red (Paso Robles),Rhône-style Red Blend,Epoch Estate Wines,red,no
1449,France,"Purists will no doubt object to this wine's fine patina of sophisticated, cedary oak, but there's plenty of high-quality fruit to back it up. Incorporating unusual proportions of 44% Grenache, 33% Mourvèdre and 23% Syrah, the fruit is ripe and lush, velvety-supple and medium to full in weight, without any sense of heaviness. Drink 2020–2030.",Cuvée des Cadettes,94,180.0,Rhône Valley,Châteauneuf-du-Pape,,Joe Czerwinski,@JoeCz,Château La Nerthe 2013 Cuvée des Cadettes Red (Châteauneuf-du-Pape),Rhône-style Red Blend,Château La Nerthe,red,no
1455,US,"The winery's characteristic dense style is immediately apparent in this blend of 54% Syrah, 21% Mourvèdre, 16% Grenache and 9% Petite Sirah. It offers black licorice, smoked meat, baked black cherry and graphite aromas, needing time to breathe before unleashing black coffee, elderberry jam, asphalt and charcoal flavors through tarry tannins. Drink 2018–2028.",Ingenuity,94,70.0,California,Paso Robles,Central Coast,Matt Kettmann,@mattkettmann,Epoch Estate Wines 2013 Ingenuity Red (Paso Robles),Rhône-style Red Blend,Epoch Estate Wines,red,no
1731,US,"This blend of Syrah, Mourvèdre, Carignan, Counoise, Grenache and Cinsault immediately appeals with its aromas of plum, candied raspberry and garrigue, with no oak influence anywhere in sight. It's fruit laden, focused and supple, with a feel that dazzles the senses and pure fruit flavors that just won't quit.",Subduction,92,20.0,Washington,Columbia Valley (WA),Columbia Valley,Sean P. Sullivan,@wawinereport,Syncline 2013 Subduction Red (Columbia Valley (WA)),Rhône-style Red Blend,Syncline,red,no
1756,US,"This wine is a field blend of Syrah, Mourvèdre and Grenache from Bishop's vineyard. Aromas of herbs, berry, cumin and wet copper penny are followed by smooth-feeling dark berry flavors with a tart, mesquite-filled finish.",Bishop's Block,84,29.0,Washington,Ancient Lakes,Columbia Valley,Sean P. Sullivan,@wawinereport,Crayelle Cellars 2013 Bishop's Block Red (Ancient Lakes),Rhône-style Red Blend,Crayelle Cellars,red,no
1780,US,"This Southern Rhône-style blend is roughly half Mourvèdre, 31% Grenache and 17% Cinsault. It's a delicious match-up, with the Mourvèdre underscoring the minerality, and providing grip and texture around the racy red berry flavors of the other two grapes. The wine has a spine of steel, suggesting it will age through 20206–2022.",Stone Tree SoRhô,91,33.0,Washington,Columbia Valley (WA),Columbia Valley,Paul Gregutt,@paulgwine ,Helix by Reininger 2011 Stone Tree SoRhô Red (Columbia Valley (WA)),Rhône-style Red Blend,Helix by Reininger,red,no
1873,US,"The Doyenne Métier generally drinks very well right out of the chute, and this 2009 is no exception. Supple and concentrated, this blend of 51% Grenache, 32% Mourvèdre and 17% Syrah is an absolute riot of mixed berry fruit scents and flavors. Full, lush, dense and quite long in the finish, it's a spicy, brilliant bit of winemaking. Can it age? Undoubtedly. But good luck keeping your hands off it!",Métier,93,36.0,Washington,Yakima Valley,Columbia Valley,Paul Gregutt,@paulgwine ,Doyenne 2009 Métier Red (Yakima Valley),Rhône-style Red Blend,Doyenne,red,no
1874,France,"It's sad that only 5,080 bottles of this wine were produced, as it's truly a stunner. Dark and developed, complex and concentrated, this wine exhibits such superb balance and finesse, with nuanced notes of minerality, scrubland, whole tobacco leaf, black pepper and licorice root all gracing the dark fruit core of the nose and mouth. It's lush and full on the palate, and medium tannins provide a solid structure, making the wine drinkable now or ready to age.",L'Hospitalitas - La Clape,93,75.0,Languedoc-Roussillon,Coteaux du Languedoc,,Lauren Buzzeo,@laurbuzz,Gérard Bertrand 2008 L'Hospitalitas - La Clape Red (Coteaux du Languedoc),Rhône-style Red Blend,Gérard Bertrand,red,no
1985,US,"A blend of Grenache, Syrah, Cinsault and Counoise, this is bone dry and brisk in acidity, with complex flavors of mineral, herb, sour cherry candy, red currant and white pepper. Although production was only 2,000 cases, this wine is worth the search.",Rhône de Robles,88,18.0,California,Paso Robles,Central Coast,,,Robert Hall 2011 Rhône de Robles Red (Paso Robles),Rhône-style Red Blend,Robert Hall,red,no
2035,US,"This Syrah, Grenache and Mourvèdre blend shows hot alcohol and superripe flavors of blackberries, cassis, dark chocolate and raisins. It's a big, rich, thick wine that sticks to the gums, almost syrupy, but fully dry. Decant it and drink with stews, casseroles, barbecue.",Aurelio's Selection,87,35.0,California,Paso Robles,Central Coast,,,Star Angel by Montes 2009 Aurelio's Selection Red (Paso Robles),Rhône-style Red Blend,Star Angel by Montes,red,no
2066,US,"You want black pepper? You'll get plenty of it in this dry, interesting Rhône blend of Mourvèdre and Syrah. It has briary flavors of wild blackberries, with an edge of leather, tobacco and herbs, and is thoroughly dry. Pretty tannic, too. An interesting wine, and one to watch.",River of Skulls Dalton Vineyard,90,35.0,California,Calaveras County,Sierra Foothills,,,Twisted Oak 2007 River of Skulls Dalton Vineyard Red (Calaveras County),Rhône-style Red Blend,Twisted Oak,red,no
2206,US,"With 58% Mourvèdre, 20% Syrah, 20% Grenache and 2% Counoise grapes from the dry-farmed, head-pruned Old Oak Vineyard (formerly Sheep Camp Creek), this wine shows dried black cherries, pencil lead, uncrushed cloves and nutmeg on the nose. The palate is flatter, with cooked cherries as well as other dried purple and red fruits.",Oveja Negra,88,48.0,California,Paso Robles Willow Creek District,Central Coast,Matt Kettmann,@mattkettmann,Lone Madrone 2013 Oveja Negra Red (Paso Robles Willow Creek District),Rhône-style Red Blend,Lone Madrone,red,no
2506,US,"Purple fruit aromas of blueberry, blackberry and boysenberry are given complexity with Indian spice, hot asphalt and beef char on the nose of this blend of 88% Syrah and 12% Grenache. The palate is full of crushed herbs, from oregano to thyme to marjoram, with just a tiny shred of cranberry fruit and lots of pine sap and even bell pepper.",Nefarious,88,44.0,California,Paso Robles,Central Coast,Matt Kettmann,@mattkettmann,Asuncion Ridge 2012 Nefarious Red (Paso Robles),Rhône-style Red Blend,Asuncion Ridge,red,no
2571,US,"Mourvèdre and Syrah each make up a third of this wine with the rest Grenache and Viognier. The latter (12%) shows itself prominently on the aromas, with perfumed notes of purple flowers and orange peel that are followed by purple fruit, vanilla, coffee and spice. The palate offers elegant, yet sweet and flavorful pomegranate and cranberry flavors with pleasing spice accents.",Reserve M-S-G-V,89,30.0,Washington,Horse Heaven Hills,Columbia Valley,Sean P. Sullivan,@wawinereport,14 Hands 2013 Reserve M-S-G-V Red (Horse Heaven Hills),Rhône-style Red Blend,14 Hands,red,no
2669,France,"Ripe, jammy black-fruit sensations dominate the nose and mouth of this wine, with lush, expressive notes of blackberry, black raspberry and boysenberry preserves. The texture is like crushed satin, with medium-plus yet fine tannins and a cocoa-kissed finish. Enjoyable now, but should develop additional complexities after 2016.",Serge & Nicolas,90,24.0,Languedoc-Roussillon,Maury Sec,,Lauren Buzzeo,@laurbuzz,Domaine Cabirau 2011 Serge & Nicolas Red (Maury Sec),Rhône-style Red Blend,Domaine Cabirau,red,no
2674,France,"This is vibrant and expressive, with upfront purple-flower fragrances of violet and iris mixed with fruity tones of boysenberry and raspberry sauce. The crushed-silk texture offers medium tannins, ample acidity and skin-driven fruit flavors. Roasted coffee bean and sweet smoke accents mark the lingering finish.",Rhône-style Red Blend,90,24.0,Languedoc-Roussillon,Côtes du Roussillon Villages Caramany,,Lauren Buzzeo,@laurbuzz,Les Villages de Terroir Catalan 2010 Red (Côtes du Roussillon Villages Caramany),Rhône-style Red Blend,Les Villages de Terroir Catalan,red,no
2938,US,"Despite some black cherry richness, there's a green, minty, stalky note of unripeness in this blend of Grenache, Syrah and Mourvèdre that limits its appeal. Decanting doesn't help and neither will aging.",Tete-a-Tete,84,18.0,California,Sierra Foothills,Sierra Foothills,,,Terre Rouge 2007 Tete-a-Tete Red (Sierra Foothills),Rhône-style Red Blend,Terre Rouge,red,no
2972,US,"Like a trip through an orchard, this Syrah, Grenache and Mourvèdre blend bursts with flavors of cherries, raspberries, blackberries, tangerines, kumquats, dates, golden mangoes, yellow currants, the list goes on and on. It's a little on the sweet side, while grippy tannins give the palate handrails to negotiate this fruity ride.",Morpheus,85,32.0,California,Paso Robles,Central Coast,,,Kaleidos 2004 Morpheus Red (Paso Robles),Rhône-style Red Blend,Kaleidos,red,no
3022,US,"“Rhône times three” seems to be the code name for this classy blend of Grenache, Mourvèdre and Syrah. It takes the best from each grape, creating a rich, pure, high-acid wine with a zingy berry flavor, plus a mineral underpinning and earthy, coffee-soaked tannins.",Rx-3 Red Wine,92,30.0,Washington,Columbia Valley (WA),Columbia Valley,Paul Gregutt,@paulgwine ,Nefarious 2010 Rx-3 Red Wine Red (Columbia Valley (WA)),Rhône-style Red Blend,Nefarious,red,no
3189,US,"This is quite a dynamic and layered wine, especially for the bargain price, with deep and hearty blackberry, caramel, rust, lavender and potpourri on the nose. The berry-led palate is rustic and unrefined, with feral flavors, peppery spice and decent acidity.",Rhône-style Red Blend,90,12.0,California,Paso Robles,Central Coast,Matt Kettmann,@mattkettmann,Now Presenting... 2014 Red (Paso Robles),Rhône-style Red Blend,Now Presenting...,red,no
3195,France,"This blend of 60% Grenache, 30% Syrah and 10% Cinsault would be a crowd favorite if more than 700 cases were available in the U.S. The black cherry fruit is punched up by hints of herbs and cracked pepper, there's ample weight but great freshness and zest, and the finish is long and complex, showing off hints of licorice, pepper and dusty earth. Drink now–2020.",Haut de Brun,90,15.0,Rhône Valley,Côtes du Rhône,,Joe Czerwinski,@JoeCz,Alain Jaume et Fils 2014 Haut de Brun Red (Côtes du Rhône),Rhône-style Red Blend,Alain Jaume et Fils,red,no
3340,France,"This blend of 70% Grenache and 30% Syrah is a chunky, slightly rustic style of Côtes-du-Rhône. It starts off with tar and herb aromas, then turns plummy and chocolaty on the palate. Drink now–2017.",Linteau,84,13.0,Rhône Valley,Côtes du Rhône,,Joe Czerwinski,@JoeCz,L. Tramier & Fils 2012 Linteau Red (Côtes du Rhône),Rhône-style Red Blend,L. Tramier & Fils,red,no
3603,France,"A Syrah-dominant blend with 20% Grenache and 20% Cinsault, this wine exhibits some greenness to the skin-driven red fruit flavors. Herbal notes of rosemary and thyme sprigs add depth to the nose and mouth, while a touch of mocha graces the clean finish.",Le Cinq Montpeyroux,86,22.0,Languedoc-Roussillon,Coteaux du Languedoc,,Lauren Buzzeo,@laurbuzz,Le Mas de Bertrand 2008 Le Cinq Montpeyroux Red (Coteaux du Languedoc),Rhône-style Red Blend,Le Mas de Bertrand,red,no
3815,France,"Les Cimels is a solid, entry-level Costières de Nîmes blend of Syrah, Carignan and Grenache. Blackberry fruit dominates this full-bodied red, picking up intriguing tarry notes and glancing those with crisp, citrusy acids. Long and mouthwatering on the finish.",Les Cimels,88,20.0,Rhône Valley,Costières de Nîmes,,Joe Czerwinski,@JoeCz,Château d'Or et de Gueules 2012 Les Cimels Red (Costières de Nîmes),Rhône-style Red Blend,Château d'Or et de Gueules,red,no
3834,France,"The name is an oblique reference to Shiraz, which forms the basis of this cuvée. It's inky in hue and rather reticent on the nose at first. But swirl it vigorously and be rewarded with layers of cassis, blackberry and black pepper. Full bodied, rich and tannic, its blueberry and cassis fruit lingers on the long, mouthwatering finish. Drink 2015–2025.",Persia,93,30.0,Rhône Valley,Ventoux,,Joe Czerwinski,@JoeCz,Domaine de Fondrèche 2009 Persia Red (Ventoux),Rhône-style Red Blend,Domaine de Fondrèche,red,no
3966,US,"A Châteauneuf-du-Pape-style Rhône blend that really nails it for satisfaction. Rich and fruity, spicy, yet with great structure. Defines the vintner's art of blending, comprised of five varieties sourced from a dozen vineyards. Fun and serious at the same time.",M5,90,24.0,California,Santa Barbara County,Central Coast,,,Margerum 2007 M5 Red (Santa Barbara County),Rhône-style Red Blend,Margerum,red,no
4056,US,"One of the Chronic brothers' most beloved bottlings, this blend of 46% Syrah, 27% Grenache, 22% Petite Sirah, 3% Mourvèdre and 2% Tannat shows vibrant and fresh aromas of boysenberries, cola and lavender on the nose. It's easy to enjoy once sipped, with red currant, red plum and cranberry flavors gaining depth from oregano and marjoram herbs.",Sofa King Bueno,88,22.0,California,Paso Robles,Central Coast,Matt Kettmann,@mattkettmann,Chronic Cellars 2014 Sofa King Bueno Red (Paso Robles),Rhône-style Red Blend,Chronic Cellars,red,no
4069,US,"Here is a hefty, concentrated, satisfying wine to pair with big proteins. A dense red-black color, with aromas of blackberry jam and dried plums lead to bold fruit flavors, full body and a thick, nicely tannic texture. The intense plum and blackberry character lasts through the lingering finish.",Clone 877.4.369.362,90,29.0,California,El Dorado,Sierra Foothills,Jim Gordon,@gordone_cellars,Miraflores 2012 Clone 877.4.369.362 Red (El Dorado),Rhône-style Red Blend,Miraflores,red,no
4159,US,"This blend of 70% Syrah, 25% Grenache and 5% Mourvèdre is a beautiful shade of purple in the glass, and offers aromas of black plum and milk chocolate. The mouthfeel is silky, with zesty acidity that rises through blueberry and boysenberry flavors toward the caramel-layered finish.",Square Root Heart Hill Vineyard Estate Grown,92,50.0,California,Paso Robles Willow Creek District,Central Coast,Matt Kettmann,@mattkettmann,Niner 2013 Square Root Heart Hill Vineyard Estate Grown Red (Paso Robles Willow Creek District),Rhône-style Red Blend,Niner,red,no
4530,US,"This blend is based on Grenache. It has white sugar, raspberry, caramel and spice flavors that finish as luscious as a candy bar.",Osiris,82,32.0,California,Paso Robles,Central Coast,,,Kaleidos 2008 Osiris Red (Paso Robles),Rhône-style Red Blend,Kaleidos,red,no
4610,France,"From the family behind Bosquet des Papes in Châteauneuf, this is a solid Côtes du Rhône, with modest tannins but decent structure and typical notes of leather, dried cherries, chocolate and cinnamon. Drink it over the next few years.",Rhône-style Red Blend,87,16.0,Rhône Valley,Côtes du Rhône,,Joe Czerwinski,@JoeCz,Domaine Nicolas Boiron 2008 Red (Côtes du Rhône),Rhône-style Red Blend,Domaine Nicolas Boiron,red,no
4985,France,"Moderately intense menthol, black licorice and African violets aromas on the nose. The mouth, full of ripe plum and dark cherries accented by notes of cocoa and fresh mint leaves, has a lovely balance and silky texture. Ends on a somewhat simple yet clean finish.",La Baronne,88,11.0,Languedoc-Roussillon,Corbières,,Lauren Buzzeo,@laurbuzz,Domaine Lignères 2003 La Baronne Red (Corbières),Rhône-style Red Blend,Domaine Lignères,red,no
5135,US,"A blend of Syrah (68%), Grenache (29%) and Viognier, this wine brings pungent, directly appealing aromas of smoked meat, blue fruit, black olive, orange peel and high-toned flowers. The blue and black-fruit and smoked-meat flavors are silky and well constructed with a finish that lingers.",Vaucluse Lawrence Vineyards,92,35.0,Washington,Columbia Valley (WA),Columbia Valley,Sean P. Sullivan,@wawinereport,Gård 2014 Vaucluse Lawrence Vineyards Red (Columbia Valley (WA)),Rhône-style Red Blend,Gård,red,no
5142,US,"A savory rather than fruity blend of 60% Syrah and 40% Grenache, this bottling offers black pepper, anise and light violet alongside boysenberry and elderberry fruit on the nose. The palate tightens up into underripe cherry, thyme, marjoram and bay leaf, with very dry elderberry fruit tones.",Pendulum,92,35.0,California,Monterey County,Central Coast,Matt Kettmann,@mattkettmann,Baker & Brain 2013 Pendulum Red (Monterey County),Rhône-style Red Blend,Baker & Brain,red,no
5174,France,"Bright and woodsy, this Syrah-dominant red is intriguing for its tapestry of earth and mushroom flavors interwoven with mixed berry fruit. There's enough acidity in the medium, yeast-scented finish to stand up to hearty red meats. Drink up.",Rhône-style Red Blend,87,13.0,Provence,Côtes de Provence,,,,Domaine Saint Andrieu 2007 Red (Côtes de Provence),Rhône-style Red Blend,Domaine Saint Andrieu,red,no
5195,US,"This early peek at Margerum's 2012 Rhône-style red wines holds the promise of future great releases from the acclaimed vintage. The wine, a blend of Syrah, Mourvèdre, Cinsault and Counoise, is enormous in ripe red cherries, red currants, cola and oak flavors, and while the acidity is fine, it's soft enough to drink now.",M5,90,27.0,California,Santa Barbara County,Central Coast,,,Margerum 2012 M5 Red (Santa Barbara County),Rhône-style Red Blend,Margerum,red,no
5271,France,"Very perfumed, this wine is exotic and rich with fruit, but also remarkably dry. Drink from 2017.",Rhône-style Red Blend,88,,Provence,Bandol,,Roger Voss,@vossroger,Domaine Sorin 2011 Red (Bandol),Rhône-style Red Blend,Domaine Sorin,red,no
5317,France,"Like many of the Perrin & Fils wines, this one is firmly structured, its cherry and cocoa flavors ending on a dusty, tannic note. But the fruit is attractive, and even boasts some complexity in the wisps of garrigue on the nose. Probably best from 2013–2017.",Rhône-style Red Blend,87,15.0,Rhône Valley,Côtes du Rhône Villages,,Joe Czerwinski,@JoeCz,Perrin & Fils 2009 Red (Côtes du Rhône Villages),Rhône-style Red Blend,Perrin & Fils,red,no
