,country,description,designation,points,price,province,region_1,region_2,taster_name,taster_twitter_handle,title,variety,winery,type,sparkling
96553,France,"A slightly herbal edge and floral notes mingle with the dark berry and cherry aromas. Hints of tobacco and soft sweet spice add depth to the mouth, which is otherwise bright and vibrant but also straightforward. Drink now.",Cuvée Arthur,87,25.0,Languedoc-Roussillon,Minervois,,Lauren Buzzeo,@laurbuzz,Château Cabezac 2007 Cuvée Arthur Red (Minervois),Rhône-style Red Blend,Château Cabezac,red,no
96554,France,"This wine starts off a bit closed, but with time opens up to express attractive notes of small red berries, herbal twigs and whole baking spice. Medium weight with soft tannins and balanced acidity, this is a food-friendly wine that's sure to pair with most red meat or game dishes without overpopwering them.",Le Petit Arthur,87,12.0,Languedoc-Roussillon,Minervois,,Lauren Buzzeo,@laurbuzz,Château Cabezac 2008 Le Petit Arthur Red (Minervois),Rhône-style Red Blend,Château Cabezac,red,no
96561,US,"A traditional Rhône-style Grenache, Mourvèdre and Syrah blend in roughly equal parts, this light, dry wine is silky in the mouth. It has pleasant berry, cherry and dried herb flavors.",Côtes-du-Robles,87,21.0,California,Paso Robles,Central Coast,,,Eberle 2008 Côtes-du-Robles Red (Paso Robles),Rhône-style Red Blend,Eberle,red,no
96595,France,"Features attractive aromas of chocolate, prunes, leather and soy sauce that are fairly complex and mature. The flavors are similar, with touches of earth and black cherries. Drink now.",Rhône-style Red Blend,84,20.0,Provence,Côtes de Provence,,Joe Czerwinski,@JoeCz,Château des Sarrins 1997 Red (Côtes de Provence),Rhône-style Red Blend,Château des Sarrins,red,no
96597,France,"Bears a striking resemblance to blueberry pie in its aromas. Lighter than expected on the palate, before fading on the finish. A pleasant lunch mate to pâté or charcouterie.",Rhône-style Red Blend,84,8.0,Rhône Valley,Costières de Nîmes,,Joe Czerwinski,@JoeCz,Château d'Or et de Gueules 1998 Red (Costières de Nîmes),Rhône-style Red Blend,Château d'Or et de Gueules,red,no
96603,France,"This well-known Burgundy négociant has branched out into the Rhône, like so many others have before. The good news is that the wine is bursting with bright cherry flavors—tart and juicy. Would make a nice burger or sandwich accompaniment.",Château De Domazan,84,8.0,Rhône Valley,Côtes du Rhône,,,,Mommessin 1999 Château De Domazan Red (Côtes du Rhône),Rhône-style Red Blend,Mommessin,red,no
96620,France,"A light, toffee-and-caramel-tinged red that seems to be fading. Some earth and cherry flavors provide for acceptable drinking now, but this wine is headed south. Get to it soon.",Cru Classe,82,12.0,Provence,Côtes de Provence,,Joe Czerwinski,@JoeCz,Castel Roubine 1996 Cru Classe Red (Côtes de Provence),Rhône-style Red Blend,Castel Roubine,red,no
96871,South Africa,"This Shiraz-based blend—with splashes of Grenache, Mourvèdre and Viognier—is lush and rich, with notes of ripe blackberry, cherry and strawberry preserves backed by hints of fruit-cake spice and black pepper. The plush mouthfeel boasts similarly concentrated dark-fruit flavors, and the finish boasts a decadent fudgy chocolate note that shows good staying power. Drink now–2016.",Full Circle,91,42.0,Tulbagh,,,Lauren Buzzeo,@laurbuzz,Saronsberg 2008 Full Circle Red (Tulbagh),Rhône-style Red Blend,Saronsberg,red,no
97136,France,"This wine is unusually taut and crisp for a Châteauneuf-du-Pape, with cherry and cranberry fruit framed by hints of earth and leather. Drink now–2020.",Rhône-style Red Blend,87,40.0,Rhône Valley,Châteauneuf-du-Pape,,Joe Czerwinski,@JoeCz,Les Trois Couronnes 2013 Red (Châteauneuf-du-Pape),Rhône-style Red Blend,Les Trois Couronnes,red,no
97207,US,"The subdued nose offers traces of red fruits and rose petals. On entrance, this feels broad and juicy, and it offers tangy plum and raspberry flavors that continue onto the finish.",Roan,86,28.0,Arizona,Cochise County,,,,Pillsbury 2011 Roan Red (Cochise County),Rhône-style Red Blend,Pillsbury,red,no
97250,US,"This blend showcases Grenache and Mourvèdre, with small amounts of Syrah, Counoise and Carignan. Raspberry, cherry and chocolate flavors combine with and are enlivened by a dash of white pepper. Excellent focus and length suggest that this can be cellared for at least five years.",Cuvée Elena,92,40.0,Washington,Columbia Valley (WA),Columbia Valley,Paul Gregutt,@paulgwine ,Syncline 2010 Cuvée Elena Red (Columbia Valley (WA)),Rhône-style Red Blend,Syncline,red,no
97478,US,"This blend of Mourvèdre, Carignane and Syrah is still quite young but already shows lots of savory potential. Wild berry, underbrush, subtle game and crushed slate aromas lead into a palate of loaded with mulberry, sagebrush and cedar flavors. It has loads of energy out of the gate.",MCS,89,27.0,California,Santa Barbara County,Central Coast,Matt Kettmann,@mattkettmann,Municipal Winemakers 2015 MCS Red (Santa Barbara County),Rhône-style Red Blend,Municipal Winemakers,red,no
97729,France,"For what is essentially a second wine, generally blended from the estate's younger vines, this is a solid effort in a not-so-easy vintage. Vanilla and cinnamon from barrel-aging play a role hedre, but there's also plenty of juicy, plum-tinged fruit. There's ample body and texture, capped off by supple tannins and a lingering finish. Drink now–2022.",Les Granières de la Nerthe,91,42.0,Rhône Valley,Châteauneuf-du-Pape,,Joe Czerwinski,@JoeCz,Château La Nerthe 2014 Les Granières de la Nerthe Red (Châteauneuf-du-Pape),Rhône-style Red Blend,Château La Nerthe,red,no
97846,France,"Plan de Dieu is a broad, stony plain near Gigondas that's an underrated commune. This is a firmly built, medium-bodied wine, with lifted, floral aromas and bright cherry and raspberry fruit. chocolate notes emerge on the finish, which simultaneously shows some dusty tannins and mouthwatering acids. Drink now–2022.",Domaine du Père Hugues Plan de Dieu,89,15.0,Rhône Valley,Côtes du Rhône Villages,,Joe Czerwinski,@JoeCz,Louis Bernard 2015 Domaine du Père Hugues Plan de Dieu Red (Côtes du Rhône Villages),Rhône-style Red Blend,Louis Bernard,red,no
97847,France,"Peppery spice, cassis fruit and some savory notes sum up this medium-bodied wine. It's just not that complex or concentrated, but it remains an attractive wine for near-term consumption. Drink it with grilled meats to help balance the dry, dusty tannins that poke out on the finish.",Rhône-style Red Blend,89,73.0,Rhône Valley,Côte Rôtie,,Joe Czerwinski,@JoeCz,Maison Nicolas Perrin 2013  Côte Rôtie,Rhône-style Red Blend,Maison Nicolas Perrin,red,no
98091,France,"This shows a fine, silky texture from a vintage that resulted in some tough-textured wines. Raspberry and garrigue combine on the nose, while the palate adds hints of sun-baked earth on the long, softly dusty finish. Drink now–2023.",L'Andéol,89,25.0,Rhône Valley,Rasteau,,Joe Czerwinski,@JoeCz,Famille Perrin 2013 L'Andéol Red (Rasteau),Rhône-style Red Blend,Famille Perrin,red,no
98243,France,"This is not nearly as rich and plush as La Nerthe's luxury-level Cuvée des Cadettes, but remains a very good wine. Red plum and red currant fruit is medium-bodied, supported by bright acids, while some slightly ashy notes and a hint of cocoa emerge on the crisp finish.",Rhône-style Red Blend,88,65.0,Rhône Valley,Châteauneuf-du-Pape,,Joe Czerwinski,@JoeCz,Château La Nerthe 2013 Red (Châteauneuf-du-Pape),Rhône-style Red Blend,Château La Nerthe,red,no
98414,US,"The Justine, a new, southern Rhône-style red blend from Avennia, is an expressive wine, with aromas of berries, plums and cassis. There's a whiff of smoked meat also, but the Grenache—roughly half of the blend—brings lovely fruit that trumps the rest. Delicious now, or cellar it for a few more years.",Justine,92,38.0,Washington,Columbia Valley (WA),Columbia Valley,Paul Gregutt,@paulgwine ,Avennia 2011 Justine Red (Columbia Valley (WA)),Rhône-style Red Blend,Avennia,red,no
98642,France,This offering from a well-known négociant is made in a lighter style and has good flavor. The essential ripeness of the vintage shows; there is some texture to the mouthfeel and it wraps up with a clean finish of good length.,Rhône-style Red Blend,88,23.0,Rhône Valley,Châteauneuf-du-Pape,,,,Barton & Guestier 1998 Red (Châteauneuf-du-Pape),Rhône-style Red Blend,Barton & Guestier,red,no
98643,France,"From the full bouquet with its dark-cherry and black-pepper notes, this wine makes its presence felt. There’s very good depth of fruit, with a characteristic brambly quality. Some complexity can be found here via earth and white-pepper elements that accent the fruit.",Rhône-style Red Blend,88,10.0,Rhône Valley,Côtes du Rhône,,,,Domaine de la Solitude 1998 Red (Côtes du Rhône),Rhône-style Red Blend,Domaine de la Solitude,red,no
98645,France,"Not quite as impressive as the wonderful 1998, this blend of 60% Grenache and 40% Syrah features solid black-cherry fruit and hints of smoke but seems a bit compact, with firm structure. Still, the persistent finish and reasonable depth suggest it will show better in a couple of months.",Cuvée Reservée,87,12.0,Rhône Valley,Lirac,,Joe Czerwinski,@JoeCz,Château de Ségriès 1999 Cuvée Reservée Red (Lirac),Rhône-style Red Blend,Château de Ségriès,red,no
98649,France,"An effusive, unabashedly fruity wine that's loaded with grapey, black-cherry fruit. Some sweaty-leather notes on the nose bring you back to the Rhône Valley, and a dash of green peppercorns spices up the finish.",Rhône-style Red Blend,87,9.0,Rhône Valley,Côtes du Rhône,,Joe Czerwinski,@JoeCz,La Bouvaude 1999 Red (Côtes du Rhône),Rhône-style Red Blend,La Bouvaude,red,no
98663,France,"Another solid showing from one of importer Fran Kysela's stable of Rhône producers. This offering shows plenty of rustic leathery aromas, along with a blend of cherries and blackberries. Not overripe or heavy; the fruit and tanned-hide notes come together in a velour-textured finish.",Domaine Grand Veneur,86,9.0,Rhône Valley,Côtes du Rhône,,Joe Czerwinski,@JoeCz,Alain Jaume et Fils 1998 Domaine Grand Veneur Red (Côtes du Rhône),Rhône-style Red Blend,Alain Jaume et Fils,red,no
98664,France,"A pleasant, if somewhat light offering, featuring bright Grenache fruit highlighted by red cherries and hints of black pepper. Finishes with a touch of stemmy astringency that adds needed grip.",Rhône-style Red Blend,85,10.0,Rhône Valley,Côtes du Rhône,,Joe Czerwinski,@JoeCz,Château de Ségriès 1999 Red (Côtes du Rhône),Rhône-style Red Blend,Château de Ségriès,red,no
98693,US,"A problematic wine, although not without its virtues. Made from Mourvèdre, Grenache, Syrah and Cinsault, it's too soft in structure and too sweet, and there's a vegetable, mushroomy taste to the raspberries.",Version Anna's Vineyard,82,36.0,California,Paso Robles,Central Coast,,,Adelaida 2010 Version Anna's Vineyard Red (Paso Robles),Rhône-style Red Blend,Adelaida,red,no
98745,US,"If you love old-world Rhônes, Sierra Vista is a producer to know about. This blend of Grenache, Syrah, Mourvèdre and Cinsault is medium in weight and easy to drink and love, tinged with hints of lavender, cherry and baked bread.",Fleur de Montagne,88,30.0,California,El Dorado,Sierra Foothills,Virginie Boone,@vboone,Sierra Vista 2009 Fleur de Montagne Red (El Dorado),Rhône-style Red Blend,Sierra Vista,red,no
98923,US,"A Chateauneuf-du-Pape inspired blend of 64% Grenache, 24% Mourvèdre and 12% Syrah, Moriah was not made in 2011 but roars back to life in 2012 light ruby red in color and fully refined in rose petal aromatics. Integrated and subtle, it's focused in bright red fruit and layered white pepper.",Cuvée Moriah,94,50.0,California,Sonoma County,Sonoma,Virginie Boone,@vboone,Donelan 2012 Cuvée Moriah Red (Sonoma County),Rhône-style Red Blend,Donelan,red,no
99246,US,"A blend of 43% Grenache, 41% Mourvédre and 16% Syrah from two vineyard sites, one warmer than the other, this plummy red is bright on the palate. Smoky and not overly oaked, it contributes gamy twinges of black currant and cardamom to the long finish.",Turbine,88,28.0,California,Sonoma Valley,Sonoma,Virginie Boone,@vboone,Anaba 2012 Turbine Red (Sonoma Valley),Rhône-style Red Blend,Anaba,red,no
99375,France,"Even the big négociant Michel Picard has managed to turn out a decent 2007 Châteauneuf-du-Pape, which speaks to the quality and consistency of the vintage. It combines leather and meat with cherry fruit and some firm tannins, but falls off a bit rapidly on the finish. Drink now.",Rhône-style Red Blend,86,39.0,Rhône Valley,Châteauneuf-du-Pape,,Joe Czerwinski,@JoeCz,Michel Picard 2007 Red (Châteauneuf-du-Pape),Rhône-style Red Blend,Michel Picard,red,no
99608,US,"From winemaker Michael Zinke, this is yet another stylish Rhône-style blend. Aromas of boysenberry, plum, tar, black peppercorn and lavender delicately lay across the nose. The palate presents very judiciously and evenly, with dried purple flowers, black tea, slight teriyaki and just a touch of plum.",Gypsy Thompson Vineyard,92,38.0,California,Santa Barbara County,Central Coast,Matt Kettmann,@mattkettmann,Zinke 2012 Gypsy Thompson Vineyard Red (Santa Barbara County),Rhône-style Red Blend,Zinke,red,no
99657,France,"Lush in texture, despite having aged solely in concrete vats prior to bottling. The rich texture and supple tannins support warm, brandied cherry notes. Drink this engaging blend of 60% Grenache, 25% Carignan and 15% Syrah now and over the next couple of years.",Epicure,88,,Rhône Valley,Ventoux,,Joe Czerwinski,@JoeCz,Château Valcombe 2009 Epicure Red (Ventoux),Rhône-style Red Blend,Château Valcombe,red,no
99663,US,"This is two-thirds Grenache, the balance divided equally between Syrah and Mourvèdre. It's a fruity mix of berry and plum flavors, with added spice and a lick of chocolate from aging in once-used French oak barrels. Relatively light, very clean and best for drinking young.",Southern Blend Red,88,40.0,Washington,Washington,Washington Other,Paul Gregutt,@paulgwine ,Rôtie Cellars 2009 Southern Blend Red Red (Washington),Rhône-style Red Blend,Rôtie Cellars,red,no
99774,US,"The attack on this wine is soft and ripe, but it finishes quite dry. A blend of Grenache, Syrah, Tannat and Cinsault, it's rich and softly tannic, suggesting pairings with beef or game.",Anthology,88,45.0,California,Paso Robles,Central Coast,,,Edmond August 2011 Anthology Red (Paso Robles),Rhône-style Red Blend,Edmond August,red,no
99812,South Africa,"A nose of minerals, black fruit and dried lavender is the start of this stylish wine from Black Rock. On the palate, assertive flavors of blueberry, cherry and spice are lifted by fresh minerality. The finish is clean but lingering. An intriguing wine that offers elegance with an exotic touch.",Red Blend,89,24.0,Swartland,,,Susan Kostrzewa,@suskostrzewa,Black Rock 2006 Red Blend Red (Swartland),Rhône-style Red Blend,Black Rock,red,no
99928,France,"Leathery and earthy, with hints of cranberries and chocolate. It's medium bodied and supple enough to drink now, turning a bit tart on the finish.",Rhône-style Red Blend,84,11.0,Rhône Valley,Côtes du Rhône,,Joe Czerwinski,@JoeCz,Lucas Carton 2005 Red (Côtes du Rhône),Rhône-style Red Blend,Lucas Carton,red,no
100001,France,"Chapoutier's selections of the best parcels of vines in Hermitage are set to become legendary. Sold under the ancient spelling of the appellation name (Ermitage), they represent the epitome of the power and concentration that lies behind the reputation of the appellation. This cuvée is the best of the collection, with its brooding, opaque character, suggesting rather than revealing power at this stage. Age it until your new-born baby is old enough to drink, and it will be just about ready.",Le Méal Ermitage,98,150.0,Rhône Valley,Hermitage,,Roger Voss,@vossroger,M. Chapoutier 1999 Le Méal Ermitage  (Hermitage),Rhône-style Red Blend,M. Chapoutier,red,no
100002,France,"Jean-Louis, the son of Gérard Chave, is now in charge of the family business, as well as being president of the Hermitage wine producers. He is continuing the family tradition of making powerful statements of Syrah from Hermitage, combining massive structure and over-powering perfumes. This 1999 seems to have the best of the traditional world of tannic immensity and the modern world of beautiful, ripe fruit. A wine that will age for a very long time.",Rhône-style Red Blend,97,125.0,Rhône Valley,Hermitage,,Roger Voss,@vossroger,J.L. Chave 1999  Hermitage,Rhône-style Red Blend,J.L. Chave,red,no
100006,France,"Even though the 42 months this wine has spent in new wood give it an intensely toasty character, the enormously soft, perfumed fruits and ripe, sweet flavors that go along with the wood produce a finely tuned, balanced wine that should age well over many years. As an expression of pure Syrah, there are few better.",La Mouline,96,175.0,Rhône Valley,Côte Rôtie,,Roger Voss,@vossroger,E. Guigal 1998 La Mouline  (Côte Rôtie),Rhône-style Red Blend,E. Guigal,red,no
100008,France,"A firm, dry, foursquare wine that has power and structure rather than the immediate perfumes of La Mouline, the partner cuvée from Guigal. This is the wine for those who want power with big tannins, and they don't come more powerful or tannic than this. Its aging potential is enormous:  after 10 years there should be more sign of the perfumed fruit which is there, somewhere.",La Turque,95,175.0,Rhône Valley,Côte Rôtie,,Roger Voss,@vossroger,E. Guigal 1998 La Turque  (Côte Rôtie),Rhône-style Red Blend,E. Guigal,red,no
100009,France,"Here is a superbly rich and smooth wine. Aromas of violets and flavors of blueberries and red cherries along with dusty tannins, give this wine both immediate appeal and the promise of a good long-term future.",La Landonne,95,150.0,Rhône Valley,Côte Rôtie,,Roger Voss,@vossroger,Domaine Jean-Michel Gerin 1999 La Landonne  (Côte Rôtie),Rhône-style Red Blend,Domaine Jean-Michel Gerin,red,no
100010,France,"A huge, ink-black wine with all the brooding majesty that gives Cornas its reputation. A blockbuster with enormous rich, sweet tannins. At the end it is the quality of the superripe fruit from old vines that dominates, but it is certainly a wine to keep for generations.",Empreintes,95,37.0,Rhône Valley,Cornas,,Roger Voss,@vossroger,Éric & Jöel Durand 1999 Empreintes  (Cornas),Rhône-style Red Blend,Éric & Jöel Durand,red,no
100011,France,"A massive wine, with its opaque, dense purple color, its huge tannins and its tight, powerful structure. When it develops—maybe in 10 or 15 years' time—the perfumed, juicy Syrah fruits that are just suggested for the moment are going to be as dominant as the tannins are now. What a wine it will be then.",Rhône-style Red Blend,95,55.0,Rhône Valley,Hermitage,,Roger Voss,@vossroger,E. Guigal 1999  Hermitage,Rhône-style Red Blend,E. Guigal,red,no
100016,France,"Jaboulet's view of its most famous wine seems to have changed. Although the concentrated, dense tannins and big black fruit flavors are still there, it has lost the huge brooding presence of past vintages, and now has a veneer of sophistication with superripe fruit, plums and dark jam tastes. Whether this 1999 will age as well as older vintages remains to be seen, but it will certainly be ready to drink sooner.",La Chapelle,94,131.0,Rhône Valley,Hermitage,,Roger Voss,@vossroger,Paul Jaboulet Aîné 1999 La Chapelle  (Hermitage),Rhône-style Red Blend,Paul Jaboulet Aîné,red,no
100018,France,"Old vines in the Les Bessards vineyard on the Hermitage hill have offered up a majestic wine that has considerable power. With its strong, firm tannins and intense, brooding dark fruits, this is a wine that has obviously been made to last. With little use of new wood for this wine (only 10%), the structure and the complexity come entirely from the enormously ripe fruit and traditional fermentation.",Les Bessards,94,98.0,Rhône Valley,Hermitage,,Roger Voss,@vossroger,Delas Frères 1999 Les Bessards  (Hermitage),Rhône-style Red Blend,Delas Frères,red,no
100175,France,"This blend of 80% Syrah and 20% Cabernet Sauvignon reveals plenty of blackberry and plum fruit, carried along by a full-bodied, somewhat tannic mouthfeel. Finishes with soft tannins, making it approachable in the near term.",Rhône-style Red Blend,87,,Provence,Côtes de Provence,,Joe Czerwinski,@JoeCz,Château Miraval 2004 Red (Côtes de Provence),Rhône-style Red Blend,Château Miraval,red,no
100309,US,"Ripe and concentrated, this wine is also full bodied and quite tannic while maintaining a velvety mouthfeel. The abundant flavors of black cherry and dark chocolate are inviting and deep.",The Keep,91,60.0,California,Lake County,,Jim Gordon,@gordone_cellars,Sol Rouge 2013 The Keep Red (Lake County),Rhône-style Red Blend,Sol Rouge,red,no
100321,US,"There is an impressive density to the nose of this blend of 88% Syrah and 12% Grenache, with blueberry and black currant showing alongside crushed gravel and tar. The palate is rich with dark fruits and dark spices, showing baked black plum torte, a touch of fennel and a tart finish.",Nefarious,91,58.0,California,Paso Robles,Central Coast,Matt Kettmann,@mattkettmann,Asuncion Ridge 2014 Nefarious Red (Paso Robles),Rhône-style Red Blend,Asuncion Ridge,red,no
100380,France,"This full-bodied, fleshy wine fits the typical Châteauneuf-du-Pape mold, delivering ample black-cherry and plum fruit, then layering atop hints of Mexican chocolate and baking spices. Drink now–2025.",La Sousto,92,55.0,Rhône Valley,Châteauneuf-du-Pape,,Joe Czerwinski,@JoeCz,Domaine Lucien Barrot et Fils 2013 La Sousto Red (Châteauneuf-du-Pape),Rhône-style Red Blend,Domaine Lucien Barrot et Fils,red,no
100398,US,"Ross Mickel (Ross Andrew Winery) made this Côtes du Rhône-style blend, a flashy riot of floral scents and earthy, funky fruit. Even with several hours breathing time it feels tight—decanting is mandatory. But give it a few years in the cellar and it will unpack even more layers of flavor. Dry and astringent in the mouth, it brings young flavors of cranberry juice and grape concentrate, plenty of acidity and minerality, and excellent depth.",Collaboration Series II Ciel du Cheval Vineyard Red Wine,92,45.0,Washington,Red Mountain,Columbia Valley,Paul Gregutt,@paulgwine ,Grand Rêve 2007 Collaboration Series II Ciel du Cheval Vineyard Red Wine Red (Red Mountain),Rhône-style Red Blend,Grand Rêve,red,no
100828,France,"This pure Carignan from 80-year-old vines is really interesting aromatically, featuring hints of clove, cinnamon and lavender, but its substantial tannins clamp down hard on the palate, raising the question of whether it has enough fruit concentration to age successfully. Drink now with tannin-taming rare beef or lamb, or cellar it and hope.",Qu'es Aquo,88,,Rhône Valley,Costières de Nîmes,,Joe Czerwinski,@JoeCz,Château d'Or et de Gueules 2009 Qu'es Aquo Red (Costières de Nîmes),Rhône-style Red Blend,Château d'Or et de Gueules,red,no
100832,France,"A fruit-driven style, with cherry and raspberry notes accented by hints of chocolate and coffee. It's ripe and creamy on the midpalate, just fading a little too quickly on the finish. Drink now–2013.",Les Boudalles,88,,Rhône Valley,Ventoux,,Joe Czerwinski,@JoeCz,Domaine Brusset 2009 Les Boudalles Red (Ventoux),Rhône-style Red Blend,Domaine Brusset,red,no
100833,France,"With its distinctively briary, herbal edge, this wine stands out in a crowd. Ample cracked pepper spices up chocolate and plum flavors in this medium-bodied 60-40 blend of Grenache and Syrah. Drink now–2016.",Instant Présent,88,15.0,Rhône Valley,Ventoux,,Joe Czerwinski,@JoeCz,Mas Oncle Ernest 2008 Instant Présent Red (Ventoux),Rhône-style Red Blend,Mas Oncle Ernest,red,no
101047,France,"This is rather fresh in style for a 2009 from the Southern Rhône, with bold cherry and chocolate notes, reasonably crisp acids and softly dusty tannins. That said, it's a mouth-filling wine, but one that's harmonious and easy to drink.",Rhône-style Red Blend,89,35.0,Rhône Valley,Châteauneuf-du-Pape,,Joe Czerwinski,@JoeCz,J.V. Fleury 2009 Red (Châteauneuf-du-Pape),Rhône-style Red Blend,J.V. Fleury,red,no
101093,France,"This wine is concentrated with ripe, juicy fruit along with brisk acidity and a delicious sense of Southern French herbs. The wine has weight as well, giving it fine aging potential. Drink from 2016.",Rhône-style Red Blend,91,,Provence,Bandol,,Roger Voss,@vossroger,Domaine de Terrebrune 2010 Red (Bandol),Rhône-style Red Blend,Domaine de Terrebrune,red,no
101130,France,"Beaucastel's Côtes du Rhône is like a mini Châteauneuf-du-Pape in its blend of grapes and its sourcing, just outside that famous appellation. The 2009 is a very successful and flattering Coudoulet, with scents of garrigue and cherry followed by a palate that's round and lush without being at all heavy. Long and velvety on the finish.",Coudoulet de Beaucastel,91,36.0,Rhône Valley,Côtes du Rhône,,Joe Czerwinski,@JoeCz,Château de Beaucastel 2009 Coudoulet de Beaucastel Red (Côtes du Rhône),Rhône-style Red Blend,Château de Beaucastel,red,no
101342,France,"This blend of 60% Syrah, 25% Grenache and 15% Carignan offers prominent wild gamy notes framed by aromas of ripe berry compote, crushed violets and soft, lush mocha creaminess. The palate is elegant and fruit-driven, with the soft spice accents unfolding on the finish.",La Dournie,87,16.0,Languedoc-Roussillon,Saint-Chinian,,Lauren Buzzeo,@laurbuzz,Château La Dournie 2009 La Dournie Red (Saint-Chinian),Rhône-style Red Blend,Château La Dournie,red,no
