,country,description,designation,points,price,province,region_1,region_2,taster_name,taster_twitter_handle,title,variety,winery,type,sparkling
67020,France,"Jaboulet has been investing heavily in recent years, and the terrific 2009 Terre Ferme is one of the payoffs. It's meaty and plummy on the nose, with an expansive, plush mouthfeel. Plum and black cherry flavors work well with the leather and cedar notes, while the finish lingers, picking up hints of cinnamon and licorice. Drink 2015–2025.",Domaine de Terre Ferme,93,100.0,Rhône Valley,Châteauneuf-du-Pape,,Joe Czerwinski,@JoeCz,Paul Jaboulet Aîné 2009 Domaine de Terre Ferme Red (Châteauneuf-du-Pape),Rhône-style Red Blend,Paul Jaboulet Aîné,red,no
67064,France,"Bright and concentrated at the same time, with strong notes of black berries and cassis backed by softer notes of yellow flowers, almond skin, rosemary and pepper. The mouth is lightweight but full, with soft acids and a short but clean finish. Very approachable; drink now.",Grand Terroir Tautavel,87,19.0,Languedoc-Roussillon,Côtes du Roussillon Villages,,Lauren Buzzeo,@laurbuzz,Gérard Bertrand 2006 Grand Terroir Tautavel Red (Côtes du Roussillon Villages),Rhône-style Red Blend,Gérard Bertrand,red,no
67264,France,"Boysenberry, blueberry and black cherry aromas lead on the nose of this wine, with a touch of warmth and chocolaty sensation following behind. The palate veers more towards red-fruit flavors, with a thin midpalate and an astringent close.",Pur Sang,86,23.0,Languedoc-Roussillon,Côtes du Roussillon,,Lauren Buzzeo,@laurbuzz,Château de Corneilla 2009 Pur Sang Red (Côtes du Roussillon),Rhône-style Red Blend,Château de Corneilla,red,no
67273,France,"Herbal garrigue notes take centerstage in this blend of 50% Syrah, 25% Marselan and 25% Mourvèdre. The palate is lifted and bright, with flavors of tart blackberry and plum. Not an ager, so enjoy it now.",Rhône-style Red Blend,85,12.0,Languedoc-Roussillon,Vin de Pays des Côtes Catalanes,,Lauren Buzzeo,@laurbuzz,Caspen 2011 Red (Vin de Pays des Côtes Catalanes),Rhône-style Red Blend,Caspen,red,no
67278,US,"This blend of Syrah, Mourvèdre and Grenache has some pretty raspberry, pomegranate and Bing cherry fruit flavors. Dried herbs add a nice grace note, but the finish brings a darker, roasted character that turns slightly burnt and bitter.",Dark Star,85,20.0,Washington,Columbia Valley (WA),Columbia Valley,Paul Gregutt,@paulgwine ,Kana 2009 Dark Star Red (Columbia Valley (WA)),Rhône-style Red Blend,Kana,red,no
67293,US,"This medium-bodied wine is fresh and fruity, but also polished and sophisticated. It smells like raspberries and black plums, then adds chocolate and blackberry in the flavors. Rich and flavorful it also has welcome firm tannins and fruit acidity to keep it lively. Grenache is the leading grape ingredient.",Estate Infrared,89,31.0,California,Livermore Valley,Central Coast,Jim Gordon,@gordone_cellars,Fenestra 2010 Estate Infrared Red (Livermore Valley),Rhône-style Red Blend,Fenestra,red,no
67306,US,"Sweet-seeming aromas and flavors dominate this full-bodied, ripe-tasting wine—not unusual for a Rhône-style blend that leads with  Grenache. A spicy, smoky influence is delicious in its own right, but has a tasty component of fresh blackberry and boysenberry to back it up.",Côtes du Renard,89,26.0,California,Lodi,Central Valley,Jim Gordon,@gordone_cellars,The Dancing Fox 2011 Côtes du Renard Red (Lodi),Rhône-style Red Blend,The Dancing Fox,red,no
67317,France,"Clove, bay leaf and black cherry aromas burst from the glass, followed by flavors of dark cherry and cocoa. The tannins are supple, the mouthfeel ample, and the finish ends with a refreshing lift of acidity. Drink now–2018.",Les Abeilles de  Colombo,89,13.0,Rhône Valley,Côtes du Rhône,,Joe Czerwinski,@JoeCz,Jean-Luc Colombo 2013 Les Abeilles de  Colombo Red (Côtes du Rhône),Rhône-style Red Blend,Jean-Luc Colombo,red,no
67378,France,"This full-flavored blend is 65% Grenache and the balance is mostly Syrah, with a little Mourvèdre. It opens with a rustic nose and full earthy, horsey flavors. There’s a very typical Rhône-ish brambly quality to the dark-berry fruit, and the finish is long and flavorful. Quite approachable right now; it should drink well for the next 4 to 8 years, maybe longer.",Rhône-style Red Blend,89,21.0,Rhône Valley,Châteauneuf-du-Pape,,,,Domaine de la Solitude 1998 Red (Châteauneuf-du-Pape),Rhône-style Red Blend,Domaine de la Solitude,red,no
67383,France,"A reserve selection that’s seen some barrel aging, but not too much. The toasty, chocolaty oak is hardly noticeable under a firm wallop of cherry-berry fruit that turns velvety on the palate. Some softly bitter tannins creep in on the finish, letting you know that the best is yet to come. Pick up a few bottles and drink them over the next couple of years.",Prestige des Gibelins,88,15.0,Rhône Valley,Costières de Nîmes,,Joe Czerwinski,@JoeCz,Château Mas Neuf 1998 Prestige des Gibelins Red (Costières de Nîmes),Rhône-style Red Blend,Château Mas Neuf,red,no
67384,France,"A very Grenache-like wine, with red berries, rhubarb, meat and spices on the nose. Earth and anise notes in the mouth add interest, and there is a fine fruit-acid balance here. Sweet berries, a strong mineral component and fine tannic structure shine on the solid finish. Tight now, it will show better in two or three years.",Les Laurentides,88,16.0,Rhône Valley,Côtes du Rhône,,,,Domaine Gramenon 1998 Les Laurentides Red (Côtes du Rhône),Rhône-style Red Blend,Domaine Gramenon,red,no
67506,US,"There's so much raspberry, cherry, cola, clove, cinnamon and pepper flavor in this wine, it's hard to know where to begin. It's also dry, with smoky, vanilla oak notes. Yet it lacks the vital structure a good Rhône blend wants in order to house all this richness. Drink now. Grenache-Syrah.",Beespoke,87,38.0,California,Santa Ynez Valley,Central Coast,,,Jorian Hill 2007 Beespoke Red (Santa Ynez Valley),Rhône-style Red Blend,Jorian Hill,red,no
67692,France,"This is a straightfoward, plummy, grapy red wine. It's medium in body but rather simple, ending on a slightly astringent, chalky note. Ecocert.",Nature,85,15.0,Rhône Valley,Côtes du Rhône,,Joe Czerwinski,@JoeCz,Famille Perrin 2013 Nature Red (Côtes du Rhône),Rhône-style Red Blend,Famille Perrin,red,no
67747,US,"Elegant lilacs and other purple flowers meet with cola and licorice elements on the nose of this Mourvèdre-led blend, which also included 30% Syrah and 10% Grenache. The versatile palate is bright with tart cranberry and savory with vanilla-bean shavings.",Ardor,89,45.0,California,Paso Robles,Central Coast,Matt Kettmann,@mattkettmann,Two Moons 2012 Ardor Red (Paso Robles),Rhône-style Red Blend,Two Moons,red,no
67977,US,"One of the annual blends from the historic West Paso winery, this mix of 55% Grenache, 30% Syrah, 10% Counoise and 5% Mourvèdre shows black cherry extract, elderberries, concentrated rose petals, marjoram leaf and a gamy touch of bloody organ meat on the nose. The flavors prove more slate-driven, with a bit of bacon fat and crushed herbs.",Côtes de Tablas Estate Grown & Bottled,89,35.0,California,Paso Robles,Central Coast,Matt Kettmann,@mattkettmann,Tablas Creek 2013 Côtes de Tablas Estate Grown & Bottled Red (Paso Robles),Rhône-style Red Blend,Tablas Creek,red,no
68202,US,"This wine is 60% Grenache, 20% Syrah, 10% Cinsault and 10% Mourvèdre. It opens with aromas of white pepper, potpourri, herbs and raspberries. The flavors are soft, displaying a very pretty mouthfeel and a pleasing sense of restraint.",Ma Belle Olsen Vineyard,90,45.0,Washington,Yakima Valley,Columbia Valley,Sean P. Sullivan,@wawinereport,Covington 2011 Ma Belle Olsen Vineyard Red (Yakima Valley),Rhône-style Red Blend,Covington,red,no
68519,France,"This blend of 60% Grenache, 20% Syrah and 20% Mourvèdre delivers juicy, almost gulpable fruit, supported by a loose spine of soft tannins. Purple raspberry and black cherry flavors linger on the supple finish. Drink now–2018.",Rhône-style Red Blend,91,35.0,Rhône Valley,Châteauneuf-du-Pape,,Joe Czerwinski,@JoeCz,Les Trois Couronnes 2010 Red (Châteauneuf-du-Pape),Rhône-style Red Blend,Les Trois Couronnes,red,no
68534,France,"The blend is 70% Syrah, 20% Grenache and 10% Carignan, and in 2009 the grapes were as ripe as they could be. Mocha and chocolate notes pick up a touch of prune. With its superripe fruit, ample weight, lush texture and warm finish, there are valid concerns about its ageability, but this offers hedonistic drinking for an affordable price.",El Niño Loco,91,17.0,France Other,Vin de Pays de la Méditerranée,,Joe Czerwinski,@JoeCz,Guillaume Gros 2009 El Niño Loco Red (Vin de Pays de la Méditerranée),Rhône-style Red Blend,Guillaume Gros,red,no
68693,US,"Mourvèdre (40%) makes up the majority of this blend, followed by Grenache (37%), Syrah (19%) and Cinsault. It's locked up at present with brooding aromas of iron, cherry and dark berries that are followed by power-packed fruit flavors that show a pleasing sense of balance. It's bold but shows no shortage of detail.",Métier,92,42.0,Washington,Yakima Valley,Columbia Valley,Sean P. Sullivan,@wawinereport,DeLille 2014 Métier Red (Yakima Valley),Rhône-style Red Blend,DeLille,red,no
68749,France,"Les Cimels is a solid, entry-level Costières de Nîmes blend of Syrah, Carignan and Grenache. Blackberry fruit dominates this full-bodied red, picking up intriguing tarry notes and glancing those with crisp, citrusy acids. Long and mouthwatering on the finish.",Les Cimels,88,20.0,Rhône Valley,Costières de Nîmes,,Joe Czerwinski,@JoeCz,Château d'Or et de Gueules 2012 Les Cimels Red (Costières de Nîmes),Rhône-style Red Blend,Château d'Or et de Gueules,red,no
68813,US,"Medium bodied and lean in profile, this wine starts with floral aromas, then brings in fairly tart cherry and pomegranate flavors and firmly tannic texture.",Sage Canyon,86,26.0,California,California,California Other,Jim Gordon,@gordone_cellars,Neyers 2015 Sage Canyon Red (California),Rhône-style Red Blend,Neyers,red,no
68841,US,"This blend of Syrah, Mourvèdre, Carignan, Counoise, Grenache and Cinsault immediately appeals with its aromas of plum, candied raspberry and garrigue, with no oak influence anywhere in sight. It's fruit laden, focused and supple, with a feel that dazzles the senses and pure fruit flavors that just won't quit.",Subduction,92,20.0,Washington,Columbia Valley (WA),Columbia Valley,Sean P. Sullivan,@wawinereport,Syncline 2013 Subduction Red (Columbia Valley (WA)),Rhône-style Red Blend,Syncline,red,no
68875,US,"Light in color and light-bodied in the mouth, this Grenache-based Rhône blend offers easy, sweet flavors of cherries, cola, vanilla and oak.",Cuvée Jeanne Marie,85,35.0,California,Santa Ynez Valley,Central Coast,,,Foxen 2009 Cuvée Jeanne Marie Red (Santa Ynez Valley),Rhône-style Red Blend,Foxen,red,no
69007,France,"A gorgeous Corbières with beautiful expression of the terroir thanks to prominent notes of wild berries and animal laced with accents of garrigue herbs and spice. A hint of cocoa dusts the firmly structured mouth, the palate brimming with flavors of boysenberry and mulberry. Tobacco leaf and licorice root remain on the close.",La Pompadour,91,18.0,Languedoc-Roussillon,Corbières,,Lauren Buzzeo,@laurbuzz,Castelmaure 2008 La Pompadour Red (Corbières),Rhône-style Red Blend,Castelmaure,red,no
69019,France,"With 15 months in French oak, this blend of 80% Syrah and 20% Grenache starts off rich and lavish, as creamy mocha notes infuse the deep plum, blueberry and black cherry fruit core. Iris florals add lightness to the otherwise dark and concentrated mouth, as the crushed velvet texture transitions into a long finish loaded with roasted espresso and toasted fennel seed flavors. Drink now–2015.",Clot de l'Amandier La Clape,91,63.0,Languedoc-Roussillon,Coteaux du Languedoc,,Lauren Buzzeo,@laurbuzz,Mas du Soleilla 2008 Clot de l'Amandier La Clape Red (Coteaux du Languedoc),Rhône-style Red Blend,Mas du Soleilla,red,no
69223,US,"Half Grenache, 40% Syrah and the rest Mourvèdre, all sourced from vineyards in the Royal Slope region. Exceptionally fragrant, with appealing plummy, juicy blueberry and cherry fruit. A hint of leather does not detract, though it seems to toughen up the tannins with a touch of bitterness in the finish.",Una Notte,89,35.0,Washington,Columbia Valley (WA),Columbia Valley,Paul Gregutt,@paulgwine ,:Nota Bene 2009 Una Notte Red (Columbia Valley (WA)),Rhône-style Red Blend,:Nota Bene,red,no
69250,US,Earthy aromas of bay leaf and garrigue lift the dried boysenberry fruit on the nose of this bottling. Tangy elderberry fruit and underripe boysenberry show on the sip alongside oregano and savory spices.,Ame de la Vigne,88,43.0,California,Paso Robles,Central Coast,Matt Kettmann,@mattkettmann,Le Vigne 2014 Ame de la Vigne Red (Paso Robles),Rhône-style Red Blend,Le Vigne,red,no
69322,France,"Its red fruit-driven nose gives way to a significantly earthy palate, which also shows dried mushrooms and exotic spices. Full-bodied and generous in alcohol, this wine possesses somewhat chunky, though attractive, tannins. The acidity is fresh and balances the fairly rich texture. The finish is moderate. Drink now through 2015.",Passion d'une Vie,90,,Languedoc-Roussillon,Côtes du Roussillon,,,,Bernard Magrez 2009 Passion d'une Vie Red (Côtes du Roussillon),Rhône-style Red Blend,Bernard Magrez,red,no
69343,France,"With 40% Grenache, 40% Syrah, 20% Carignan and no oak aging, this is a fresh and juicy wine with characteristics of black cherry, black berry, thyme, Asian spice and cola. Solid acidity and a medium finish make this an easy pleaser.",Grande Tradition,86,17.0,Languedoc-Roussillon,Minervois,,Lauren Buzzeo,@laurbuzz,Château du Donjon 2007 Grande Tradition Red (Minervois),Rhône-style Red Blend,Château du Donjon,red,no
69360,France,"A balanced and straightforward wine boasting strong dark fruit flavors of black cherry and berry along with accents of milk chocolate and licorice. Medium weight with a soft structure, approachable tannins and a clean finish. Drink now.",Rhône-style Red Blend,86,10.0,Languedoc-Roussillon,Corbières,,Lauren Buzzeo,@laurbuzz,Château Lamy 2006 Red (Corbières),Rhône-style Red Blend,Château Lamy,red,no
69407,France,"One of many excellent values to be found among the 2012 Southern Rhône wines, this is supple in style, with ripe cherry and chocolate accented by vanilla and sandalwood. Drink now–2016.",Esprít Barville,87,12.0,Rhône Valley,Côtes du Rhône,,Joe Czerwinski,@JoeCz,Brotte 2012 Esprít Barville Red (Côtes du Rhône),Rhône-style Red Blend,Brotte,red,no
69512,US,"An incredibly concentrated, silky blend of 80% Grenache and 20% Syrah. Nothing shy about this wine, inspired as it is by the great Chateauneuf-du-Papes and yet undoubtedly Californian. Make that mountain Californian. With baked cherry fruit and baking spices throughout and serious grip and weight, this is one heady and delicious wine.",The Brat,94,36.0,California,Calaveras County,Sierra Foothills,Virginie Boone,@vboone,Prospect 772 2009 The Brat Red (Calaveras County),Rhône-style Red Blend,Prospect 772,red,no
69541,France,"This Rasteau-based estate has turned out a plummy, savory blend of Grenache, Syrah and Carignan aged solely in concrete. The plum fruit is pronounced, balanced by hints of asphalt and some dusty tannins on the finish.",Rhône-style Red Blend,85,16.0,Rhône Valley,Côtes du Rhône,,Joe Czerwinski,@JoeCz,Grand Nicolet 2013 Red (Côtes du Rhône),Rhône-style Red Blend,Grand Nicolet,red,no
69761,US,"A mouthfilling blend of 75% Syrah and 25% Grenache, this is soft and substantial, yet balanced. Leathery meat and blackberry compote intermix in a vibrantly fresh take on Rhône-style reds, peaking on the bright, herbes-de-Provence-flecked finish.",Kick Ranch Ambition,90,25.0,California,Sonoma County,Sonoma,Virginie Boone,@vboone,Overland 2012 Kick Ranch Ambition Red (Sonoma County),Rhône-style Red Blend,Overland,red,no
69850,US,"Suave aromas of bramble and red berries meet with chipped slate, a touch of anise and pressed lilacs on this nose of this blend of 37% Grenache, 29% Mourvèdre, 13% Syrah, 10% Counoise, 6% Cinsault and 5% Carignane. Bright cranberry and red cherry fruit pop on the palate, which is bolstered by fennel, black peppercorns and dried rose petals.",Keeper,88,25.0,California,Paso Robles,Central Coast,Matt Kettmann,@mattkettmann,Adelaida 2012 Keeper Red (Paso Robles),Rhône-style Red Blend,Adelaida,red,no
69997,France,"Initially gentle and sunny, this wine develops a briary blackberry character as it opens up. It has a dry and tannic core that lends firm structure and suggests potential for aging. Drink from 2014.",Fontanyl,87,17.0,Provence,Côtes de Provence,,Roger Voss,@vossroger,Ravoire et Fils 2010 Fontanyl Red (Côtes de Provence),Rhône-style Red Blend,Ravoire et Fils,red,no
70085,US,"This is 75% Grenache with the balance Syrah. It's full bodied and offers jammy red fruit accented by clove and barrel spices, with a creamy texture and abundant vanilla flavors throughout.",Vineyard Series Mosaic,89,28.0,Washington,Wahluke Slope,Columbia Valley,Sean P. Sullivan,@wawinereport,Milbrandt 2011 Vineyard Series Mosaic Red (Wahluke Slope),Rhône-style Red Blend,Milbrandt,red,no
70159,US,"Made from Syrah, Grenache and a splash of Viognier, this wine is in a transitional state. The raspberry, cherry and blackberry fruit flavors are just turning the corner from primary to more aged bottle characteristics. Notes of mushrooms and beef carpaccio are beginning to emerge. You can drink it now, but it will be fascinating, if a little risky, to see what the wine does in five years.",Kick Ranch Home Run Cuvée,89,40.0,California,Sonoma County,Sonoma,,,Kale 2009 Kick Ranch Home Run Cuvée Red (Sonoma County),Rhône-style Red Blend,Kale,red,no
70190,US,"This wine combines a slight majority of Syrah blended with 28% Grenache and 14% Viognier, the fruit coming from three vineyard sites, including Big River Ranch. Slightly reductive, it carries a huge barrel imprint at first, settling into softer, brighter, luscious tenets of blueberry pie and leather.",Sucker Punch,91,35.0,California,Sonoma County,Sonoma,Virginie Boone,@vboone,JCK Wine Company 2014 Sucker Punch Red (Sonoma County),Rhône-style Red Blend,JCK Wine Company,red,no
70245,France,"A terrific example of Corbières terroir at an unbeatable price. The wine, a traditional Rhône-style blend of Syrah, Grenache and Carignan, is so loaded with aromas and flavors of the surrounding garrigue you might think that they threw in a bouquet garni during maturation. Sage, rosemary,menthol, thyme and bay leaves all abound while rich, dark fruit and oak aging (Élevé en Fûts de Chêne means aged in oak barrels) provides support and structure. Silky texture, approachable tannins and a long finish bring it all together.",Élevé en Fûts de Chêne,90,13.0,Languedoc-Roussillon,Corbières,,Lauren Buzzeo,@laurbuzz,Domaine Serres Mazard 2004 Élevé en Fûts de Chêne Red (Corbières),Rhône-style Red Blend,Domaine Serres Mazard,red,no
70417,France,"A blend of 40% Syrah, 30% Grenache, 20% Carignan and 10% Mourvèdre aged in French oak for 12 months, this wine exhibits great depth of flavors against a tight structure. Notes of garrigue herbs and peppery spice infuse the blackberry and rich plum fruit core. Sweet oak flavors linger on the long finish along with firm but fine tannins. Drink now–2016.",Rhône-style Red Blend,90,20.0,Languedoc-Roussillon,Faugères,,Lauren Buzzeo,@laurbuzz,Mas Gabinèle 2009 Red (Faugères),Rhône-style Red Blend,Mas Gabinèle,red,no
70432,France,"This Carignan-based blend with 25% Grenache is dense and concentrated, highlighting just how well the old Carignan vines from the region can express themselves. Ripe blueberry and boysenberry flavors are matched with medium-intense notes of bay, menthol, sweet bark and bittersweet chocolate. The silky mouth offers a round but balanced feel, with a nice mineral lift to the close.",Nos Racines,90,25.0,Languedoc-Roussillon,Faugères,,Lauren Buzzeo,@laurbuzz,Château de la Liquiere 2007 Nos Racines Red (Faugères),Rhône-style Red Blend,Château de la Liquiere,red,no
70509,US,"Black olive dominates on the nose in this blend of 75% Syrah, 12.5% Grenache and 12.5% Mourvèdre, all from Kick Ranch. Lively red fruit is amplified by soft, medium-bodied tannins and a well-composed finish, with just enough earth and spice to go around.",Kick Ranch Siren,90,32.0,California,Sonoma County,Sonoma,Virginie Boone,@vboone,Carica 2010 Kick Ranch Siren Red (Sonoma County),Rhône-style Red Blend,Carica,red,no
70567,France,"Chapoutier has fashioned a full-bodied, creamy-textured 2009 Le Bernardine, with dark, plummy fruit and a hint of chocolate liqueur that ably reflect the warm vintage. Yet despite all of the lushness, the wine doesn't come across as heavy or overdone, making it attractive for early drinking. Try now–2018.",Le Bernardine,91,56.0,Rhône Valley,Châteauneuf-du-Pape,,Joe Czerwinski,@JoeCz,M. Chapoutier 2009 Le Bernardine Red (Châteauneuf-du-Pape),Rhône-style Red Blend,M. Chapoutier,red,no
71215,France,"This is a rich and perfumed wine that is solid with dusty tannins and ripe fruit. Bold acidity adds balance and promises good aging. It is quite dry with fruit hiding behind all the structure, but it will soften, so drink from 2016.",Tradition,90,20.0,Provence,Coteaux d'Aix-en-Provence,,Roger Voss,@vossroger,Château de Calavon 2010 Tradition Red (Coteaux d'Aix-en-Provence),Rhône-style Red Blend,Château de Calavon,red,no
71216,France,"While the wine is a touch gamy, it also has a ripe, fruity character. There is a touch of wood, underlining the acidity and juicy red fruits. The finish brings out the richness of the vintage.",Rhône-style Red Blend,90,,Provence,Bandol,,Roger Voss,@vossroger,Chateau de Pibarnon 2009 Red (Bandol),Rhône-style Red Blend,Chateau de Pibarnon,red,no
71400,France,"Prices for this estate's wines have skyrocketed, but there is no doubting the quality in the bottle. The 2009 Cuvée Réservée is a huge wine, overflowing with intense black cherry and plum flavors to the point of seeming a bit sweet. Yet it's all framed by strong yet softly dusty tannins that should see it age well for at least 15 years.",Cuvée Réservée,94,111.0,Rhône Valley,Châteauneuf-du-Pape,,Joe Czerwinski,@JoeCz,Domaine du Pegau 2009 Cuvée Réservée Red (Châteauneuf-du-Pape),Rhône-style Red Blend,Domaine du Pegau,red,no
71410,US,"This is a big, voluptuous and unbelievably concentrated wine. The blend is Grenache, Syrah and Viognier, grown in two great vineyards, Thompson and Bien Nacido. It dazzles with intense cherry and raspberry purée flavors that are blanketed in sweet, smoky, vanilla-scented new oak. The alcohol is high, but the wine wears it well. Drink now.",Levity,94,70.0,California,Santa Barbara County,Central Coast,,,Sanguis 2009 Levity Red (Santa Barbara County),Rhône-style Red Blend,Sanguis,red,no
71432,France,"Full bodied and silky, like so many of the 2007s from the Southern Rhône, this has already reached maturity. Notes of dried cherry, cinnamon, clove and chocolate all come together in a very drinkable package.",Rhône-style Red Blend,89,57.0,Rhône Valley,Châteauneuf-du-Pape,,Joe Czerwinski,@JoeCz,Domaine la Mereuille 2007 Red (Châteauneuf-du-Pape),Rhône-style Red Blend,Domaine la Mereuille,red,no
71550,France,"Made from 60% Grenache and 40% Syrah, there's a delicate earthy character to the nose of this wine, lending interest to the ripe red-cherry and -plum fruit. The palate is soft and accessible, with juicy fruit flavors that finish clean but a touch short.",Les Jardins Suspendus,87,20.0,Languedoc-Roussillon,Saint-Chinian,,Lauren Buzzeo,@laurbuzz,Domaine de Cambis 2014 Les Jardins Suspendus Red (Saint-Chinian),Rhône-style Red Blend,Domaine de Cambis,red,no
71558,US,"A big burst of vanilla highlights the scents and flavors of this Rhône-inspired blend of Mourvèdre, Grenache, Cinsault and Syrah. Unfortunately, all that vanilla obscures the fruit and blankets any subtleties. Residual flavors of stem and slightly green tannins fill in the finish.",Heartwood,85,23.0,Washington,Columbia Valley (WA),Columbia Valley,Paul Gregutt,@paulgwine ,Cadaretta 2010 Heartwood Red (Columbia Valley (WA)),Rhône-style Red Blend,Cadaretta,red,no
71589,US,"This Rhône blend of Syrah, Grenache and Mourvèdre contains a splash of Petite Sirah. It's a classy wine, bone dry, tannic and full-bodied, and while it shows the rustic, briary nature of Dry Creek Valley, it's awesome in blackberries, cherries, raspberries and mocha, with a deliciously meaty edge of bacon. There's no reason why this wine shouldn't age in interesting ways over the next six years.",Elusive,88,28.0,California,Dry Creek Valley,Sonoma,,,Quivira 2008 Elusive Red (Dry Creek Valley),Rhône-style Red Blend,Quivira,red,no
71693,France,"This traditional Southern Rhône blend features some attractive floral and herbal aromas some might call garrigue, but also an intrusive cruciferous note. It's a crisp, medium-bodied wine with bright, red-plum fruit flavors and a hint of cabbage. Drink it now–2016.",Domaine des Causses,86,17.0,Rhône Valley,Lirac,,Joe Czerwinski,@JoeCz,Louis Bernard 2011 Domaine des Causses Red (Lirac),Rhône-style Red Blend,Louis Bernard,red,no
