,country,description,designation,points,price,province,region_1,region_2,taster_name,taster_twitter_handle,title,variety,winery,type,sparkling
34855,South Africa,"Winemaker: Dewaldt Heyns. This Shiraz-dominant blend, with 18% Grenache, 9% Mourvèdre and 2% Viognier, is spicy, structured and powerful. Intense notes of cigar box, leather, cured meat, licorice and anise frame the tight black-fruit core. Dense black berry, cherry and currant flavors unfold on the right, gripping palate, with a firm, spicy finish that lingers long. Despite its age, it comes from one of the best vintages in South Africa, and it has the stuffing to continue to age well through 2022.",Cape Winemakers Guild Die Erf Shiraz-Grenache-Mourvèdre-Viognier,92,,Tulbagh,,,Lauren Buzzeo,@laurbuzz,Saronsberg 2011 Cape Winemakers Guild Die Erf Shiraz-Grenache-Mourvèdre-Viognier Red (Tulbagh),Rhône-style Red Blend,Saronsberg,red,no
34875,South Africa,"Winemaker: David Trafford. A blend of 62% Syrah and 33% Mourvèdre, this is plush and floral, with upfront aromas of violet and iris that grace the black cherry and plum fruits on the nose. Additional hints of black pepper, licorice, dried herbs and mocha lend depth to the palate, while medium tannins lend ample structure but not too much grip through the close. Balanced and approachable, drink now–2021.",Cape Winemakers Guild /awa,90,,Malgas,,,Lauren Buzzeo,@laurbuzz,Sijnn 2014 Cape Winemakers Guild /awa Red (Malgas),Rhône-style Red Blend,Sijnn,red,no
34905,US,"A sound, bistro-style wine that's dry and full-bodied. Made from Syrah and Grenache, it shows tobacco, cherry and spice flavors, with brisk acidity.",Cotes du Crow's,86,18.0,California,Monterey,Central Coast,,,Morgan 2010 Cotes du Crow's Red (Monterey),Rhône-style Red Blend,Morgan,red,no
34998,US,"This dark and meaty blend of 58% Syrah and 42% Grenache shows black currant, charred game and black licorice touches. The palate combines pepper-crusted beef flavors with pretty violet and lilac accents, framed by a tannic structure that's robust but not obstructive.",Revelation Rodney's Vineyard,92,48.0,California,Santa Barbara County,Central Coast,Matt Kettmann,@mattkettmann,Epiphany 2014 Revelation Rodney's Vineyard Red (Santa Barbara County),Rhône-style Red Blend,Epiphany,red,no
35007,US,"Emmy is 70% Mourvèdre and 30% Syrah blend. The fruit expression is pure and powerful, an intense burst of raspberry and cranberry, anchored in mineral and chalk. Only neutral oak was used, so the fruit is framed beautifully by the acids and tannins, and it is so pure and resonant that it is hard to believe that this wine won't age beautifully for a decade or more.",Emmy,92,36.0,Washington,Wahluke Slope,Columbia Valley,Paul Gregutt,@paulgwine ,Efeste 2008 Emmy Red (Wahluke Slope),Rhône-style Red Blend,Efeste,red,no
35094,US,"This Syrah, Grenache and Mourvèdre blend shows hot alcohol and superripe flavors of blackberries, cassis, dark chocolate and raisins. It's a big, rich, thick wine that sticks to the gums, almost syrupy, but fully dry. Decant it and drink with stews, casseroles, barbecue.",Aurelio's Selection,87,35.0,California,Paso Robles,Central Coast,,,Star Angel by Montes 2009 Aurelio's Selection Red (Paso Robles),Rhône-style Red Blend,Star Angel by Montes,red,no
35306,France,"A blend of 60% Grenache and 40% Syrah from vineyards near Laudun, this is a typical blend that isn't typical in flavor. Crisp, dusty notes of cinnamon, red peppercorn and pomegranate predominate, making this medium-bodied wine interesting, if not incredibly hedonistic.",Chateau de Bord La Croix de Frégère Laudun,85,14.0,Rhône Valley,Côtes du Rhône Villages,,Joe Czerwinski,@JoeCz,Brotte 2012 Chateau de Bord La Croix de Frégère Laudun Red (Côtes du Rhône Villages),Rhône-style Red Blend,Brotte,red,no
35320,France,"This is a crisp, firmly structured blend of 60% Syrah, 30% Mourvèdre and 10% Grenache (within the Rhône, Signargues is best known for its Syrah). The asphalt, black olive and black cherry notes are all positive, but the structure dominates, making the wine seem a bit tough and ungenerous. Perhaps another year or two of aging will help?",Terre de Galets Signargues,85,18.0,Rhône Valley,Côtes du Rhône Villages,,Joe Czerwinski,@JoeCz,Domaine de Magalanne 2012 Terre de Galets Signargues Red (Côtes du Rhône Villages),Rhône-style Red Blend,Domaine de Magalanne,red,no
35354,US,"Neil Collins goes for the classic five Rhône grapes in this bottling, blending 48% Mourvèdre, 21% Syrah, 11% Grenache, 11% Cinsault and 9% Counoise to elicit aromas of dried fennel, fresh lavender, white pepper and boysenberry jam. Tight but juicy blueberry and elderberry fruit show on the palate, bound together by upright tannins and lifted with asphalt, black peppercorns and potpourri spice.",Points West,92,35.0,California,Paso Robles,Central Coast,Matt Kettmann,@mattkettmann,Lone Madrone 2012 Points West Red (Paso Robles),Rhône-style Red Blend,Lone Madrone,red,no
35567,US,"This blend consists of 40% Mourvèdre, 40% Grenache and 20% Syrah, creating a strong base that's loaded with steely mineral and graphite notes, plus tart fruit flavors of cranberry and strawberry. A hint of strawberry leaf brings in an herbal accent.",Métier,91,45.0,Washington,Yakima Valley,Columbia Valley,Paul Gregutt,@paulgwine ,Doyenne 2010 Métier Red (Yakima Valley),Rhône-style Red Blend,Doyenne,red,no
35653,US,"Consistently among the best $20-and-under wines each vintage, this blend of 52% Grenache, 44% Syrah and 4% Tempranillo from vintner Dan Lee delivers plump boysenberry, plum, baking spice and rosemary scents on the nose. The palate is dry and herbal yet bright with acidity, full of thyme and sagebrush notes against a backdrop of plum fruit.",Cotes du Crow's,88,18.0,California,Monterey County,Central Coast,Matt Kettmann,@mattkettmann,Morgan 2015 Cotes du Crow's Red (Monterey County),Rhône-style Red Blend,Morgan,red,no
35705,US,"This wine blends 49% Syrah with 27% Mourvèdre, 18% Grenache and 6% Counoise. Together, they provide a smooth, seductive taste of strawberry pie that invites and delights within a full-bodied package that's enjoyable now.",Elusive,90,36.0,California,Dry Creek Valley,Sonoma,Virginie Boone,@vboone,Quivira 2013 Elusive Red (Dry Creek Valley),Rhône-style Red Blend,Quivira,red,no
35824,France,"This blend of 50% Carignan, 30% Syrah and 20% Grenache opens with juicy scents of red cherry, blueberry and a touch of bramble. Those notes continue through to the palate, alongside a soft, spicy accent that adds depth. Medium tannins provide a solid structure and carry on through the medium-length close.",Les Falaises,88,24.0,Languedoc-Roussillon,Côtes du Roussillon Villages Tautavel,,Lauren Buzzeo,@laurbuzz,Domaine Gardiés 2009 Les Falaises Red (Côtes du Roussillon Villages Tautavel),Rhône-style Red Blend,Domaine Gardiés,red,no
35909,US,"Ripe, rich fruit flavors and a handsome streak of spicy oak make this full-bodied Rhône-style blend luscious and tempting. Great fruit concentration and a nicely viscous texture team up with soft tannins and an almost-sweet finish.",Le Grand-Pere Estate Grown,91,46.0,California,Sierra Foothills,Sierra Foothills,Jim Gordon,@gordone_cellars,Naggiar 2013 Le Grand-Pere Estate Grown Red (Sierra Foothills),Rhône-style Red Blend,Naggiar,red,no
35928,France,"This is a pretty traditional blend of 80% Grenache, 10% Syrah, 5% Mourvèdre and 5% Cinsault that's backed up by the aromas of clove and ripe cherries. It's firm yet silky in texture, adding notes of dried herbs and baking spices on the palate. Drink 2017–2025.",Rhône-style Red Blend,91,55.0,Rhône Valley,Châteauneuf-du-Pape,,Joe Czerwinski,@JoeCz,Clos de L'Oratoire des Papes 2013 Red (Châteauneuf-du-Pape),Rhône-style Red Blend,Clos de L'Oratoire des Papes,red,no
35945,US,"Mourvèdre (47%) and Grenache (37%) are in the lead on this wine with the balance Syrah, Counoise and Picpoul. The aromas of red and black fruit, brown stems, green olive, coffee and spice are initially faint while the tart red-fruit flavors bring a sense of delicacy and restraint.",Charlotte,91,60.0,Washington,Walla Walla Valley (WA),Columbia Valley,Sean P. Sullivan,@wawinereport,K Vintners 2012 Charlotte Red (Walla Walla Valley (WA)),Rhône-style Red Blend,K Vintners,red,no
35992,US,"This formidable Rhône-style blend has a deep color, smoky, toasted, and grilled-meat aromas, a dense and chewy texture and focused flavors like blackberries and black pepper. The concentration is quite good, the balance and tannins are very firm, preparing this wine for a long life. Drink after 2019.",The Butler,91,55.0,California,Mendocino County,,Jim Gordon,@gordone_cellars,Bonterra 2012 The Butler Red (Mendocino County),Rhône-style Red Blend,Bonterra,red,no
36124,US,"From a promising winery in the Morgan Hill area south of San Jose, this blend of 48% Grenache, 36% Syrah, 12% Mourvèdre, 2% Carignane and 2% Petite Sirah shows deep, dark but not juicy black plum, condensed coffee and game aromas. There's firm structure to the palate, which is dense yet dry with elderberry, dark chocolate and violet flavors.",Hope,89,45.0,California,Santa Clara County,Central Coast,Matt Kettmann,@mattkettmann,Aver Family Vineyards 2014 Hope Red (Santa Clara County),Rhône-style Red Blend,Aver Family Vineyards,red,no
36238,France,"This superripe blend of Grenache (70%), Syrah (15%) and Mourvèdre (15%) is full-bodied, with a rich, creamy texture and a long, velvety finish. Spice and herb notes accent dusty black cherries, and a hint of cocoa sneaks in as well. Drink now–2017.",Khayyâm,92,20.0,Rhône Valley,Côtes du Rhône,,Joe Czerwinski,@JoeCz,Mas de Libian 2012 Khayyâm Red (Côtes du Rhône),Rhône-style Red Blend,Mas de Libian,red,no
36579,France,"This is a full-bodied blend of Syrah and Carignan, aged a year in oak. It's dense and velvety, with an almost chocolate-fudge texture and notes of plum, leather and spice. Drink now–2018.",Trassegum,90,25.0,Rhône Valley,Costières de Nîmes,,Joe Czerwinski,@JoeCz,Château d'Or et de Gueules 2010 Trassegum Red (Costières de Nîmes),Rhône-style Red Blend,Château d'Or et de Gueules,red,no
36580,France,"Something different, the fruit for this wine comes off 80-year-old Carignan vines. The result is an intensely concentrated wine that mixes raspberry and blueberry fruit with delicate herbal shadings. It's full-bodied, but supple and easy to drink, ending on a note of dark chocolate. Drink now–2018.",Qu'es aQuo,90,40.0,Rhône Valley,Costières de Nîmes,,Joe Czerwinski,@JoeCz,Château d'Or et de Gueules 2012 Qu'es aQuo Red (Costières de Nîmes),Rhône-style Red Blend,Château d'Or et de Gueules,red,no
36627,US,"A Southern Rhône-style blend, this wine shows aromas of cranberry, raspberry, fresh herbs and peppery spices. The flavors show purity, richness and restraint, with a finish that lingers.",Slice of Pape,91,35.0,Washington,Columbia Valley (WA),Columbia Valley,Sean P. Sullivan,@wawinereport,Tranche 2011 Slice of Pape Red (Columbia Valley (WA)),Rhône-style Red Blend,Tranche,red,no
36942,US,"Coming from Upland and Boushey vineyards, this wine is 60% Grenache, 33% Mourvèdre and 7% Syrah. Expressive aromas of fresh blackberry, huckleberry, black pepper, smoked meat and herb are followed by penetratingly pure dark fruit flavors that are rich but still bring a sense of freshness. The purity is dazzling as is the length on the finish.",La Fraternite,93,28.0,Washington,Yakima Valley,Columbia Valley,Sean P. Sullivan,@wawinereport,Kevin White 2015 La Fraternite Red (Yakima Valley),Rhône-style Red Blend,Kevin White,red,no
37014,France,"T-L has three cuvées of Châteauneuf, and while this is the least expensive, it's also the most enjoyable now. A hint of sweaty horse blanket may put off some tasters, but this full-bodied, lushly textured wine features ample raspberry and cherry flavors, copious spices and a long, softly dusty finish. Drink it over the next 5–8 years.",Rhône-style Red Blend,93,56.0,Rhône Valley,Châteauneuf-du-Pape,,Joe Czerwinski,@JoeCz,Tardieu-Laurent 2009 Red (Châteauneuf-du-Pape),Rhône-style Red Blend,Tardieu-Laurent,red,no
37027,France,"Lush and mouth-filling, this is a plummy rendering of Châteauneuf-du-Pape that's ready to drink. Hints of green peppercorn and mocha add nuance, while the finish is long and voluptuous.",Domaine La Crau des Papes,92,44.0,Rhône Valley,Châteauneuf-du-Pape,,Joe Czerwinski,@JoeCz,Louis Bernard 2009 Domaine La Crau des Papes Red (Châteauneuf-du-Pape),Rhône-style Red Blend,Louis Bernard,red,no
37030,France,"Le Châtaignier is a luxury cuvée of the domaine's oldest vines, approximately 96% Grenache and 4% Mourvèdre. Bright red fruit flavors of raspberry and cherry are complemented by coffee and chocolate notes (the wine spends four months in oak). For a 2009, it's crisp and on the firm side, so give it until next year, and then drink it through 2025.",Le Châtaignier,92,68.0,Rhône Valley,Châteauneuf-du-Pape,,Joe Czerwinski,@JoeCz,Domaine de Nalys 2009 Le Châtaignier Red (Châteauneuf-du-Pape),Rhône-style Red Blend,Domaine de Nalys,red,no
37141,US,"A Southern Rhône-style blend, this wine shows aromas of cranberry, raspberry, fresh herbs and peppery spices. The flavors show purity, richness and restraint, with a finish that lingers.",Slice of Pape,91,35.0,Washington,Columbia Valley (WA),Columbia Valley,Sean P. Sullivan,@wawinereport,Tranche 2011 Slice of Pape Red (Columbia Valley (WA)),Rhône-style Red Blend,Tranche,red,no
37364,US,"Softly tannic, sexy and delicious, with waves of berry-cherry pie filling and mocha for richness, and drier, tarter notes of currants, leather, rhubarb and pomegranates, accentuated with smoky wood. A blend of Grenache and Syrah, it's sophisticated and nuanced. Try as an interesting, more food-friendly alternative to Cabernet Sauvignon.",The Brat,94,36.0,California,Sierra Foothills,Sierra Foothills,,,Prospect 772 2007 The Brat Red (Sierra Foothills),Rhône-style Red Blend,Prospect 772,red,no
37388,US,"Cola and soft red raspberry scents show on the nose of this blend of 58% Grenache, 25% Mourvèdre, 17% Syrah. It's easy-drinking and simple, with red fruit, white pepper and asphalt hints. A great, light, quaffable red for a warm day.",Cuvée Constantine,88,47.0,California,Santa Ynez Valley,Central Coast,Matt Kettmann,@mattkettmann,Demetria 2014 Cuvée Constantine Red (Santa Ynez Valley),Rhône-style Red Blend,Demetria,red,no
37499,France,"A terrific effort, the 2010 Terre Ferme is a full-bodied, velvety-textured wine with a long, multidimensional finish. It's pungent and savory upfront in its aromas of clove and allspice, but raspberry undertones add another layer of interest and those grace notes are all underscored by the powerful bass duo of black olive and espresso. Drink now–2025.",Domaine de Terre Ferme,93,100.0,Rhône Valley,Châteauneuf-du-Pape,,Joe Czerwinski,@JoeCz,Paul Jaboulet Aîné 2010 Domaine de Terre Ferme Red (Châteauneuf-du-Pape),Rhône-style Red Blend,Paul Jaboulet Aîné,red,no
37514,France,"Roughly equal parts Grenache, Syrah and Mourvèdre, this is probably Lirac's top wine at the moment. It's big and rich in the mouth, leaving behind a coating of dark fruit, hints of meaty savoriness, baking spices and softly layered wood.",La Reine des Bois,93,43.0,Rhône Valley,Lirac,,Joe Czerwinski,@JoeCz,Domaine de la Mordorée 2010 La Reine des Bois Red (Lirac),Rhône-style Red Blend,Domaine de la Mordorée,red,no
37779,US,"There's so much raspberry, cherry, cola, clove, cinnamon and pepper flavor in this wine, it's hard to know where to begin. It's also dry, with smoky, vanilla oak notes. Yet it lacks the vital structure a good Rhône blend wants in order to house all this richness. Drink now. Grenache-Syrah.",Beespoke,87,38.0,California,Santa Ynez Valley,Central Coast,,,Jorian Hill 2007 Beespoke Red (Santa Ynez Valley),Rhône-style Red Blend,Jorian Hill,red,no
37867,France,"Only 6,000 bottles and 300 magnums have been made of this wine, from a parcel in the famed La Landonne vineyard. This is a beautifully crafted wine, with vanilla and polished violet perfumes. To taste, the ripeness of the tannins and the richness of the fruit give both complexity and elegance. It should age for at least 15 years.",La Landonne,94,105.0,Rhône Valley,Côte Rôtie,,Roger Voss,@vossroger,Delas Frères 1999 La Landonne  (Côte Rôtie),Rhône-style Red Blend,Delas Frères,red,no
37872,France,"Jaboulet bought this 7.3-acre estate in 1998, and this is the first full vintage. It is a huge wine, with all the true inky blackness and density of a Cornas. Firm, dry and concentrated, it also has generous ripe black plums, a hint of sweet jelly. It makes an excellent mix of the traditional foursquare Cornas style, with modern sophistication.",Domaine de Saint-Pierre,93,40.0,Rhône Valley,Cornas,,Roger Voss,@vossroger,Paul Jaboulet Aîné 1999 Domaine de Saint-Pierre  (Cornas),Rhône-style Red Blend,Paul Jaboulet Aîné,red,no
37877,France,"A finely perfumed wine, with powerful tannins but also excellent flavors of dark plums and ripe black fruits, with well-judged acidity and a sweet jelly character. This will develop relatively quickly for a Cornas, but still has all the right power and intensity.",Rhône-style Red Blend,93,32.0,Rhône Valley,Cornas,,Roger Voss,@vossroger,Éric & Jöel Durand 1999  Cornas,Rhône-style Red Blend,Éric & Jöel Durand,red,no
37878,France,"According to Brigitte Roch, this was an exceptional year for the domaine. With such huge concentration, heavy black tannins, fine acidity and hugely ripe fruit, it is hard to disagree. This wine, made using an old-fashioned hand-operated basket press, is full of power, yet has an astonishing elegance.",Rhône-style Red Blend,93,,Rhône Valley,Côte Rôtie,,Roger Voss,@vossroger,Domaine Clusel-Roch 1999  Côte Rôtie,Rhône-style Red Blend,Domaine Clusel-Roch,red,no
37973,US,"This blend of Grenache, Syrah and Petite Sirah from the Warner Springs area southeast of Temecula shows lots of promise for this producer. Smoky berries, uncrushed black peppercorns and a bit of asphalt show on the nose, with juicy, plump red fruits benefitting from lots of cardamom, allspice and other black spices on the palate.",Cold Fusion,92,29.0,California,South Coast,South Coast,Matt Kettmann,@mattkettmann,Hawk Watch Winery 2011 Cold Fusion Red (South Coast),Rhône-style Red Blend,Hawk Watch Winery,red,no
37994,US,"Aromas of strawberries and olallieberries seasoned with mace, allspice and savory woods greet the nose on this blend of Syrah and Grenache by Mark Chesebro, former winemaker for Bernardus. The palate shows black cherry, cedar and tobacco, proving quite flavorful, structured by sticky tannins and a striking acidity.",La Montagne Sauvage,92,23.0,California,Carmel Valley,Central Coast,Matt Kettmann,@mattkettmann,Chesebro 2009 La Montagne Sauvage Red (Carmel Valley),Rhône-style Red Blend,Chesebro,red,no
38049,US,"Well-integrated blueberry and purple flower aromas make for a casual rather than bombastic nose in this blend of 32% Syrah, 28% Grenache, 25% Mourvèdre and 15% Petite Sirah. Roasted meat, charred blackberry and dried fennel notes show on the palate, feeling very balanced and acid-even.",Morpheus,90,40.0,California,Paso Robles,Central Coast,Matt Kettmann,@mattkettmann,Kaleidos 2015 Morpheus Red (Paso Robles),Rhône-style Red Blend,Kaleidos,red,no
38148,US,"This blend of 47% Grenache, 39% Syrah and 23% Mourvèdre packs dense fruit on the nose, showing plump blackberry and black plum, with touches of pepper, tar and charred beef. The palate is dry and leads with savory peppercorn and asphalt notes, then rounds out with blueberry and dried herb flavors, all balanced by spry acidity.",Mega Focus,91,40.0,California,Central Coast,Central Coast,Matt Kettmann,@mattkettmann,Sculpterra 2014 Mega Focus Red (Central Coast),Rhône-style Red Blend,Sculpterra,red,no
38155,US,"This wine is a blend of Syrah (44.5%), Grenache (33.3%) and Mourvèdre. The aromas are light and nuanced, with notes of raspberry, thistle, flower petal and herb. The red- and black-fruit flavors bring a pleasing sense of purity and freshness that carries through the finish.",Cuvée Mirabelle,91,50.0,Washington,Columbia Valley (WA),Columbia Valley,Sean P. Sullivan,@wawinereport,Lauren Ashton Cellars 2013 Cuvée Mirabelle Red (Columbia Valley (WA)),Rhône-style Red Blend,Lauren Ashton Cellars,red,no
38428,US,"Fess Parker's sister winery hits a savory home run with this blend of 62% Syrah and 38% Grenache, which presents game, leather, blackberry extract and sage on the nose. Purple fruit leads the palate, with dark chocolate on the midpalate and strong acidity and smooth tannins throughout.",Revelation,93,44.0,California,Santa Barbara County,Central Coast,Matt Kettmann,@mattkettmann,Epiphany 2011 Revelation Red (Santa Barbara County),Rhône-style Red Blend,Epiphany,red,no
38652,US,"Reserved fruit and spice flavors, and a soothing, gripping texture will make this medium-bodied blend of Syrah and Cabernet Sauvignon a great dinner guest. Plenty of tannins give a fine sandpaper feel on the tongue, and the wine will counterbalance the richness of meat, fowl and game dishes.",Garrigue,89,20.0,California,California,California Other,Jim Gordon,@gordone_cellars,Terre Rouge 2013 Garrigue Red (California),Rhône-style Red Blend,Terre Rouge,red,no
38662,France,"There's an assertive garrigue character to this wine, with strong aromas of thyme, bay, lavender, fennel and white pepper that overwhelm the red fruit tones. The medium-weight palate offers a bit more fruit, with flavors of strawberry and raspberry to partner with the assertive mentholated-herb notes. Accents of oak and sweet spice unfold on the finish.",Helios,89,25.0,Languedoc-Roussillon,Languedoc,,Lauren Buzzeo,@laurbuzz,Blanville 2013 Helios Red (Languedoc),Rhône-style Red Blend,Blanville,red,no
38764,France,"Like oak? Yes? Then this is the Vacqueyras for you. There's ample fruit weight to support the lush lashings of toasted coconut and luxurious vanilla notes and pull them through a long, velvety-textured finish. Drink now–2018.",Vieilles Vignes,91,42.0,Rhône Valley,Vacqueyras,,Joe Czerwinski,@JoeCz,Tardieu-Laurent 2010 Vieilles Vignes Red (Vacqueyras),Rhône-style Red Blend,Tardieu-Laurent,red,no
38771,US,"A blend of Syrah, Grenache and Mourvèdre, it's an immediately appealing wine with notes of coffee, black olive, blueberry and smoked meat. There's a pleasing texture and richness running from head to tail with coffee and chocolate flavors that linger on the finish.",Tres Cruces Red Wine Coyote Canyon Vineyard,91,25.0,Washington,Horse Heaven Hills,Columbia Valley,Sean P. Sullivan,@wawinereport,Coyote Canyon 2011 Tres Cruces Red Wine Coyote Canyon Vineyard Red (Horse Heaven Hills),Rhône-style Red Blend,Coyote Canyon,red,no
38780,US,"A very dark color and ripe, almost raisiny aromas lead to rich, opulent flavors like chocolate-covered cherries and blackberry jam. These saturate a velvety texture of good acidity and firm tannins. While the wine is full of big flavors from ripe or overripe grapes, it has the structure to support them.",Le Grand-père Estate Grown,89,46.0,California,Sierra Foothills,Sierra Foothills,Jim Gordon,@gordone_cellars,Naggiar 2011 Le Grand-père Estate Grown Red (Sierra Foothills),Rhône-style Red Blend,Naggiar,red,no
38788,US,"This wine is 40% each of Grenache and Mourvèdre with the balance Counoise. It's lighter in color, with aromas of plum, boysenberry, herbs, flowers and peppery spices. It's palate-coating with silky, sweet fruit flavors that linger.",Spicebox,89,28.0,Washington,Columbia Valley (WA),Columbia Valley,Sean P. Sullivan,@wawinereport,Tamarack Cellars 2013 Spicebox Red (Columbia Valley (WA)),Rhône-style Red Blend,Tamarack Cellars,red,no
38863,France,"This is a full-bodied yet succulent, supple wine, loaded with dark fruit. Black cherries and plums hint at sur-maturité, framed in a soft wrap of baking spices and mocha. Drink now–2020.",Rhône-style Red Blend,90,55.0,Rhône Valley,Châteauneuf-du-Pape,,Joe Czerwinski,@JoeCz,Clos de L'Oratoire des Papes 2014 Red (Châteauneuf-du-Pape),Rhône-style Red Blend,Clos de L'Oratoire des Papes,red,no
38864,France,"The bottling from the Delorme family is a fruit bomb in the best sense. It's not unnuanced, just offers masses of black cherries and plums that pick up hints of chocolate on the finish. Drink now–2020.",La Dame Rousse,90,24.0,Rhône Valley,Lirac,,Joe Czerwinski,@JoeCz,Domaine de la Mordorée 2014 La Dame Rousse Red (Lirac),Rhône-style Red Blend,Domaine de la Mordorée,red,no
38875,US,"Extremely high alcohol shows up as heat throughout, especially in the finish. That aside, this Rhône red blend has lots to like. It's dry and full-bodied and soft, with complex flavors of blackberries, currants, chocolate, leather, anise, black pepper and sandalwood. Drink now with rich meats and cheeses.",5 Blocks,87,48.0,California,Paso Robles,Central Coast,,,Terry Hoage 2007 5 Blocks Red (Paso Robles),Rhône-style Red Blend,Terry Hoage,red,no
39214,US,"This wine is half Grenache, with the balance Mourvèdre (31%), Syrah (14%) and Counoise. Lighter in color, it brings aromas of cranberry, cherry, spice, smoked meat and herb. The tart cranberry flavors are full bodied, showing a sense of purity and balance, pulling up a bit on the finish.",The Ramparts,89,46.0,Washington,Red Mountain,Columbia Valley,Sean P. Sullivan,@wawinereport,The Walls 2014 The Ramparts Red (Red Mountain),Rhône-style Red Blend,The Walls,red,no
